{
    "builtinndfilter": "Yes, manual operation type (OFF, 2 stops, 4 stops, 6 stops)",
    "weight": "Body only: approx. TBA lb. (TBA kg) Grip: approx. 8.1 oz (230 g) BP-955 Battery: 7.8 oz (220 g)",
    "inputs": "XLR (x2) 3.5mm Microphone Jack (x1) High Speed Mini-B USB (input/output x1)",
    "powersupply": "7.4 V DC (battery pack: BP-955) 8.4 V DC (DC IN)",
    "isorange": "320 - 20,000 in 1-step and 1/3-step increments",
    "recordingmedia": "2 SDHC/SDXC card slots",
    "horizontalresolution": "1000 TV lines",
    "effectivepixels": "Approx. 8.29 megapixels (3840 x 2160 pixels)",
    "audiorecordmode": "24 Mbps Mode: Linear PCM; 2-Channel; 16-Bit; 48 kHz All Other Modes: Dolby Digital AC3",
    "audioformat": "Dolby Digital/2 channel 48kHz linear PCM (24Mbps)",
    "minimumsubjectillumination": "59.94 Hz: 0.3 lux 50 Hz: 0.25 lux",
    "category": "camera",
    "builtinmicrophone": "L/R Stereo electret condenser microphone",
    "maximumrecordingtime": "With an 2GB SD Memory Card 24 Mbps 1920 x 1080: 10 minutes 17 Mbps 1920 x 1080: 15 minutes 7 Mbps 1440 x 1080: 35 minutes With an 4GB SD Memory Card 24 Mbps 1920 x 1080: 20 minutes 17 Mbps 1920 x 1080: 30 minutes 7 Mbps 1440 x 1080: 1 hours 10 minutes With an 6GB SD Memory Card 24 Mbps 1920 x 1080: 30 minutes 17 Mbps 1920 x 1080: 45 minutes 7 Mbps 1440 x 1080: 1 hour 45 minutes With an 8GB SD Memory Card 24 Mbps 1920 x 1080: 40 minutes 17 Mbps 1920 x 1080: 1 hour 7 Mbps 1440 x 1080: 2 hours 20 minutes With an 12GB SD Memory Card 24 Mbps 1920 x 1080: 1 hour 5 minutes 17 Mbps 1920 x 1080: 1 hour 30 minutes 7 Mbps 1440 x 1080: 3 hours 35 minutes With an 16GB SD Memory Card 24 Mbps 1920 x 1080: 1 hour 25 minutes 17 Mbps 1920 x 1080: 2 hours 5 minutes 7 Mbps 1440 x 1080: 4 hours 45 minutes With an 32GB SD Memory Card 24 Mbps 1920 x 1080: 2 hours 55 minutes 17 Mbps 1920 x 1080: 4 hours 10 minutes 7 Mbps 1440 x 1080: 9 hours 35 minutes With an 64GB SD Memory Card 24 Mbps 1920 x 1080: 5 hours 55 minutes 17 Mbps 1920 x 1080: 8 hours 20 minutes 7 Mbps 1440 x 1080: 19 hours 10 minutes",
    "recordingformat": "Compression: MPEG-4, AVC/H.264 File Format: AVCHD Color Space: 4:2:0 SD down Conversion: MPEG2",
    "focusingsystem": "Manual One-Shot AF AutoFocus (dependent on interchangeable lenses)",
    "totalpixels": "Approx. 9.84 megapixels (4206 x 2340)",
    "dimensionswxhxd": "Body with Thumb Rest: 5.3 x 6.7 x 5.1 in (13.5 x 17 x 12.9 cm) Body with Grip: 7.2 x 6.7 x 5.1 in (18.2 x 17 x 12.9 cm) W/ Thumb Rest and handle: 5.6 x 11.1 x 9.3 in (14.2 x 28.1 x 23.6 cm) W/ Grip and handle: 7.2 x 11.1 x 9.3 in (18.2 x 28.1 x 23.6 cm)",
    "attr1star": "2 stars3 stars4 stars5 stars",
    "peripheralilluminationcorrection": "Yes (with EF lenses)",
    "specifications": "Lens Mount Canon EF mount with EF contacts Image Sensor Super 35mm CMOS (24.6 x 13.8 mm) (28.2 mm diagonal) Processor DIGIC DV III Total Pixels Approx. 9.84 megapixels (4206 x 2340) Effective Pixels Approx. 8.29 megapixels (3840 x 2160 pixels) Horizontal Resolution 1000 TV lines Minimum Subject Illumination 59.94 Hz: 0.3 lux 50 Hz: 0.25 lux Recording Format Compression: MPEG-4, AVC/H.264 File Format: AVCHD Color Space: 4:2:0 SD down Conversion: MPEG2 Signal System NTSC and PAL Video Record Mode 24 Mbps LPCM: 1920 x 1080 at 60i, PF30, PF24, 24p, 50i, PF25 24 Mbps: 1920 x 1080 at 60i, PF30, PF24, 24p, 50i, PF25 17 Mbps: 1920 x 1080 at 60i, PF30, PF24, 24p, 50i, PF25 7 Mbps: 1440 x 1080 at 60i, PF30, PF24, 24p, 50i, PF25 Audio Record Mode 24 Mbps Mode: Linear PCM; 2-Channel; 16-Bit; 48 kHz All Other Modes: Dolby Digital AC3 Recording Media 2 SDHC/SDXC card slots Maximum Recording Time With an 2GB SD Memory Card 24 Mbps 1920 x 1080: 10 minutes 17 Mbps 1920 x 1080: 15 minutes 7 Mbps 1440 x 1080: 35 minutes With an 4GB SD Memory Card 24 Mbps 1920 x 1080: 20 minutes 17 Mbps 1920 x 1080: 30 minutes 7 Mbps 1440 x 1080: 1 hours 10 minutes With an 6GB SD Memory Card 24 Mbps 1920 x 1080: 30 minutes 17 Mbps 1920 x 1080: 45 minutes 7 Mbps 1440 x 1080: 1 hour 45 minutes With an 8GB SD Memory Card 24 Mbps 1920 x 1080: 40 minutes 17 Mbps 1920 x 1080: 1 hour 7 Mbps 1440 x 1080: 2 hours 20 minutes With an 12GB SD Memory Card 24 Mbps 1920 x 1080: 1 hour 5 minutes 17 Mbps 1920 x 1080: 1 hour 30 minutes 7 Mbps 1440 x 1080: 3 hours 35 minutes With an 16GB SD Memory Card 24 Mbps 1920 x 1080: 1 hour 25 minutes 17 Mbps 1920 x 1080: 2 hours 5 minutes 7 Mbps 1440 x 1080: 4 hours 45 minutes With an 32GB SD Memory Card 24 Mbps 1920 x 1080: 2 hours 55 minutes 17 Mbps 1920 x 1080: 4 hours 10 minutes 7 Mbps 1440 x 1080: 9 hours 35 minutes With an 64GB SD Memory Card 24 Mbps 1920 x 1080: 5 hours 55 minutes 17 Mbps 1920 x 1080: 8 hours 20 minutes 7 Mbps 1440 x 1080: 19 hours 10 minutes Simultaneous REC./Relay REC. Yes Slow/Fast Motion No Peripheral Illumination Correction Yes (with EF lenses) Focusing System Manual One-Shot AF AutoFocus (dependent on interchangeable lenses) Shutter Speed Max. 1/2000 sec. ISO Range 320 - 20,000 in 1-step and 1/3-step increments Built-in ND Filter Yes, manual operation type (OFF, 2 stops, 4 stops, 6 stops) White Balance AWB, Kelvin setting (2000K to 15000K), daylight, tungsten, set A, set B Built-In Microphone L/R Stereo electret condenser microphone Audio Format Dolby Digital/2 channel 48kHz linear PCM (24Mbps) Auto Functions ONE SHOT AF and PUSH AUTO IRIS provided for all EF mount lenses Display LCD: 3.5-inch, 920k dots, vari-angle (100% coverage) EVF: 0.24-inch with an equivalent of 1,560,000 dots (100% coverage) Outputs HDMI (Type A x1) 3.5mm Headphone mini-jack (x1) High Speed Mini-B USB (input/output x1) Inputs XLR (x2) 3.5mm Microphone Jack (x1) High Speed Mini-B USB (input/output x1) Remote Connection LANC Power Supply 7.4 V DC (battery pack: BP-955) 8.4 V DC (DC IN) Operating Temperature Performance requirements 32 - 104\u00b0 F (0 - 40\u00b0 C), 85% relative humidity Operating requirements: 32 - 113\u00b0 F (0 - 45\u00b0 C), 60% relative humidity Dimensions (W x H x D) Body with Thumb Rest: 5.3 x 6.7 x 5.1 in (13.5 x 17 x 12.9 cm) Body with Grip: 7.2 x 6.7 x 5.1 in (18.2 x 17 x 12.9 cm) W/ Thumb Rest and handle: 5.6 x 11.1 x 9.3 in (14.2 x 28.1 x 23.6 cm) W/ Grip and handle: 7.2 x 11.1 x 9.3 in (18.2 x 28.1 x 23.6 cm) Weight Body only: approx. TBA lb. (TBA kg) Grip: approx. 8.1 oz (230 g) BP-955 Battery: 7.8 oz (220 g)",
    "outputs": "HDMI (Type A x1) 3.5mm Headphone mini-jack (x1) High Speed Mini-B USB (input/output x1)",
    "brand": "Canon",
    "whitebalance": "AWB, Kelvin setting (2000K to 15000K), daylight, tungsten, set A, set B",
    "miscellaneous": "No",
    "includes": "Canon EOS C100 EF Cinema Camcorder - Body Only Side Grip Camera Cover R-F-3 Top Handle Unit Thumb Rest Shoulder Strap SS-1200 BP-955 Lithium-Ion Battery Pack (5200mAh) Battery Charger CG-940 CA-930 Compact Power Adapter DC Cable (for CA-940) AC Cable Eye Cup Viewfinder Cap Tripod Base TB-1 WFT Attachment Measuring Hook XF Utility Disc Version 3.0 Data Transfer Application",
    "signalsystem": "NTSC and PAL",
    "remoteconnection": "LANC",
    "lensmount": "Canon EF mount with EF contacts",
    "shutterspeed": "Max. 1/2000 sec.",
    "name": "Canon EOS C100 EF Cinema Camcorder - Body Only",
    "operatingtemperature": "Performance requirements 32 - 104\u00b0 F (0 - 40\u00b0 C), 85% relative humidity Operating requirements: 32 - 113\u00b0 F (0 - 45\u00b0 C), 60% relative humidity",
    "imagesensor": "Super 35mm CMOS (24.6 x 13.8 mm) (28.2 mm diagonal)",
    "videorecordmode": "24 Mbps LPCM: 1920 x 1080 at 60i, PF30, PF24, 24p, 50i, PF25 24 Mbps: 1920 x 1080 at 60i, PF30, PF24, 24p, 50i, PF25 17 Mbps: 1920 x 1080 at 60i, PF30, PF24, 24p, 50i, PF25 7 Mbps: 1440 x 1080 at 60i, PF30, PF24, 24p, 50i, PF25",
    "processor": "DIGIC DV III",
    "simultaneousrecrelayrec": "Yes",
    "display": "LCD: 3.5-inch, 920k dots, vari-angle (100% coverage) EVF: 0.24-inch with an equivalent of 1,560,000 dots (100% coverage)"
}