{
    "batterychargetime": "Approx. 4 hours",
    "weight": "4.44 lb (2.01 kg)",
    "battery": "Integrated lithium ion polymer battery",
    "sdiaudiooutput": "2 channels in 3G-SDI 48 Khz and 24-bit 2 channels for talkback on channel 15-16",
    "storagetemperature": "-4 to 113\u00b0F (-20 to 45\u00b0C)",
    "size": "10.1\" (25.7 cm)",
    "attr1star": "2 stars3 stars4 stars5 stars",
    "microphone": "Integrated stereo microphone",
    "usb": "1 x USB 2.0 Mini-B port for software updates",
    "batterylife": "Approx. 4 hours",
    "controls": "Push button controls for navigating menus",
    "sensorsize": "12.48 x 7.02 mm",
    "dimensionswxhxd": "10.05 x 7.66 x 4.47\" (25.53 x 19.46 x 11.35 cm)",
    "type": "Integrated TFT-LCD",
    "relativehumidity": "0 to 90%, non-condensing",
    "operatingsystemssupported": "Mac OS X 10.8 Mountain Lion or later Windows 7 or later",
    "category": "camera",
    "specifications": "Camera Sensor Size 12.48 x 7.02 mm Lens Mount Micro Four Thirds (active), with auto iris control button Shutter Speed 1/50 to 1/2000 second White Balance Six presets: 3200K, 4500K, 500K, 5600K, 6500K, and 7500K Resolution 1920 x 1080p 23.98/24/25/29.97/30/50/59.94/60 1920 x 1080i 50/59.9/60 Display Type Integrated TFT-LCD Size 10.1\" (25.7 cm) Resolution 1920 x 1200 Connections Compliance SMPTE 292M SDI Video Output 1 x 3G-SDI, 10-bit 4:2:2 SDI Video Input 1 x 3G-SDI Reference Input 1 x Reference input Optical Fiber Compatibility 3G Optical Fiber input and output Analog Audio Input 2 x XLR analog, switchable between mic and line levels; Phantom power support Analog Audio Output Aviation headphone (Fixed Wing Plugs) output for talkback and audio monitoring SDI Audio Output 2 channels in 3G-SDI 48 Khz and 24-bit 2 channels for talkback on channel 15-16 Remote Control 1 x 2.5 mm LANC for iris and focus control SDI CCU control from ATEM USB 1 x USB 2.0 Mini-B port for software updates General Microphone Integrated stereo microphone Mounting Options 2 x 3/8\" tripod mount 10 x 1/4\"-20 threaded holes (4 on top of the camera, 3 on left, 3 on right) Controls Push button controls for navigating menus Operating Systems Supported Mac OS X 10.8 Mountain Lion or later Windows 7 or later Power Requirements 11 to 30 VDC External Power Input 1 x 4-pin XLR Battery Integrated lithium ion polymer battery Battery Life Approx. 4 hours Battery Charge Time Approx. 4 hours Operating Temperature 32 to 104\u00b0F (0 to 40\u00b0C) Storage Temperature -4 to 113\u00b0F (-20 to 45\u00b0C) Relative Humidity 0 to 90%, non-condensing Dimensions (W x H x D) 10.05 x 7.66 x 4.47\" (25.53 x 19.46 x 11.35 cm) Weight 4.44 lb (2.01 kg)",
    "brand": "Blackmagic Design",
    "miscellaneous": "Usually ships in 7 to 10 Days",
    "includes": "Blackmagic Design Studio Camera HD Sun Shield and Attaching Screws Turret Dust Cap 12 VAC Adapter Limited 1-Year Warranty",
    "analogaudiooutput": "Aviation headphone (Fixed Wing Plugs) output for talkback and audio monitoring",
    "analogaudioinput": "2 x XLR analog, switchable between mic and line levels; Phantom power support",
    "lensmount": "Micro Four Thirds (active), with auto iris control button",
    "shutterspeed": "1/50 to 1/2000 second",
    "powerrequirements": "11 to 30 VDC",
    "name": "Blackmagic Design Studio Camera HD",
    "remotecontrol": "1 x 2.5 mm LANC for iris and focus control SDI CCU control from ATEM",
    "operatingtemperature": "32 to 104\u00b0F (0 to 40\u00b0C)",
    "compliance": "SMPTE 292M",
    "mountingoptions": "2 x 3/8\" tripod mount 10 x 1/4\"-20 threaded holes (4 on top of the camera, 3 on left, 3 on right)",
    "resolution": "1920 x 1200",
    "whitebalance": "Six presets: 3200K, 4500K, 500K, 5600K, 6500K, and 7500K"
}