{
    "accessoryshoe": "None",
    "weight": "5.89 oz\u00a0/\u00a0167 g Recorder, without battery 1.80 oz\u00a0/\u00a051 g LCD unit",
    "battery": "Rechargeable Lithium-Ion Battery Pack, 3.7-4.2VDC, 1050mAh Providing up to 3 Hours per Charge",
    "channels": "Stereo",
    "displaytype": "LCD",
    "builtinspeaker": "Yes",
    "chargingtime": "3 hours",
    "attr1star": "2 stars3 stars4 stars5 stars",
    "audioformat": "AAC WAV",
    "videoformat": "High Definition MPEG4-AVC/H.264 1920 x 1080p / 30 fps 1280 x 720p / 60 fps 1280 x 720p / 30 fps Standard Definition WVGA 848 x 480 / 60 fps 848 x 480 / 30 fps",
    "category": "camera",
    "attr35mmequivalentfocallength": "22",
    "system": "NTSC",
    "maximumaperture": "2.8",
    "dimensionswxhxd": "4.2 x 2.3 x 1.2\"\u00a0/\u00a0106.4 x 57.8 x 30.4 mm Recorder, without battery 1.6 x 1.9 x 2.9\"\u00a0/\u00a040.1 x 48.4 x 73.6 mm LCD unit",
    "sensor": "3 Megapixel 1/3\" \u00a0CMOS",
    "inputs": "1x\u00a01/8\" (3.5mm) Stereo Input (Jack)\u00a0combined line/mic (can supply plug-in power)",
    "touchscreen": "No",
    "specifications": "Camera Sensor 3 Megapixel 1/3\" \u00a0CMOS Optics 35mm Equivalent Focal Length 22 Maximum Aperture 2.8 Lens Fixed Focus Focusing Distance 21.7\" / 55.0 cm - Infinity Angle of View 130\u00b0 Zoom Digital Recording System NTSC Recording Media SD/SDHC/SDXC\u00a0Up To 128GB Video Format High Definition MPEG4-AVC/H.264 1920 x 1080p / 30 fps 1280 x 720p / 60 fps 1280 x 720p / 30 fps Standard Definition WVGA 848 x 480 / 60 fps 848 x 480 / 30 fps Aspect Ratio 16:9 Microphone Recording Angle 120\u00b0 Channels Stereo Audio Format AAC WAV Sampling Frequency AAC: 48.0\u00a0kHz WAV: 96.0\u00a0kHz WAV: 48.0\u00a0kHz WAV: 44.1\u00a0kHz Bit Rate AAC: 320.0 kbps AAC: 256.0 kbps AAC: 192.0 kbps AAC: 128.0 kbps AAC: 64.0 kbps WAV:24.0-bit WAV:16.0-bit Display Display Type LCD Touchscreen No Screen Size 2.0\" Features Scene Modes Preset: Yes Built-in Mic Yes Built-in Speaker Yes Accessory Shoe None Tripod Mount 1/4\" Input/Output Connectors Inputs 1x\u00a01/8\" (3.5mm) Stereo Input (Jack)\u00a0combined line/mic (can supply plug-in power) Outputs 1x\u00a01/8\" (3.5mm) Stereo Output (Jack)\u00a0combined line/headphone 1x\u00a0HDMI D (Micro) 1x\u00a0USB Mini-B Microphone Input Yes Headphone Jack Yes General Battery Rechargeable Lithium-Ion Battery Pack, 3.7-4.2VDC, 1050mAh Providing up to 3 Hours per Charge Charging Method AC Adapter USB Charging Time 3 hours Dimensions (WxHxD) 4.2 x 2.3 x 1.2\"\u00a0/\u00a0106.4 x 57.8 x 30.4 mm Recorder, without battery 1.6 x 1.9 x 2.9\"\u00a0/\u00a040.1 x 48.4 x 73.6 mm LCD unit Weight 5.89 oz\u00a0/\u00a0167 g Recorder, without battery 1.80 oz\u00a0/\u00a051 g LCD unit",
    "outputs": "1x\u00a01/8\" (3.5mm) Stereo Output (Jack)\u00a0combined line/headphone 1x\u00a0HDMI D (Micro) 1x\u00a0USB Mini-B",
    "brand": "Zoom",
    "miscellaneous": "No",
    "headphonejack": "Yes",
    "includes": "Zoom Q4 Handy Video Recorder Detachable LCD Screen Lithium-Ion Battery Hairy Windscreen Attachment Screw for Hairy Windscreen USB Cable Limited 1-Year Warranty",
    "lens": "Fixed Focus",
    "scenemodes": "Preset: Yes",
    "builtinmic": "Yes",
    "screensize": "2.0\"",
    "angleofview": "130\u00b0",
    "aspectratio": "16:9",
    "bitrate": "AAC: 320.0 kbps AAC: 256.0 kbps AAC: 192.0 kbps AAC: 128.0 kbps AAC: 64.0 kbps WAV:24.0-bit WAV:16.0-bit",
    "name": "Zoom Q4 Handy Video Recorder",
    "recordingmedia": "SD/SDHC/SDXC\u00a0Up To 128GB",
    "tripodmount": "1/4\"",
    "zoom": "Digital",
    "focusingdistance": "21.7\" / 55.0 cm - Infinity",
    "microphoneinput": "Yes"
}