{
    "batterychargetime": "Approximately 2 hours when not in use.",
    "dynamicrange": "13 stops",
    "cameradimensions": "166.2mm by 113.51mm x 126.49mm excluding detachable sunshade and turret dust cap",
    "focus": "Focus button turns on peaking",
    "framerates": "23.98p, 24p, 25p, 29.97p, 30p",
    "attr1star": "2 stars3 stars4 stars5 stars",
    "rawresolution": "12-bit RAW files recorded at 2432 x 1366",
    "microphone": "Integrated mono microphone",
    "batterylife": "Approximately 90 minutes",
    "metadatasupport": "Automatic camera data and user data such as shot number, filenames and keywords",
    "controls": "Onscreen touch menus and physical buttons for recording and transport control",
    "sensorsize": "16.64 mm x 14.04 mm",
    "speaker": "Integrated mono speaker",
    "category": "camera",
    "cameraweight": "1.7 kg / 3.75 lb",
    "power": "Integrated Lithium-ion Polymer rechargeable battery. 12V-30V DC port for external battery power or use included 12V AC adapter.",
    "specifications": "Camera Features Sensor Resolution 2592 x 2192 Raw Resolution 12-bit RAW files recorded at 2432 x 1366 Shooting Resolutions 2.5K RAW at 2432 x 1366. ProRes and DNxHD at 1920 x 1080 Frame Rates 23.98p, 24p, 25p, 29.97p, 30p Sensor Size 16.64 mm x 14.04 mm Sensor Size - Active 15.6 mm x 8.8 mm Dynamic Range 13 stops Focus Focus button turns on peaking Iris Control Iris button automatically adjusts the lens iris settings so no pixel is clipped Lens Mount EF and ZE mount compatible with electronic iris control Screen Dimensions 5\" and 800 x 480 resolution Screen Type Integrated LCD capacitive touchscreen Metadata Support Automatic camera data and user data such as shot number, filenames and keywords Controls Onscreen touch menus and physical buttons for recording and transport control Microphone Integrated mono microphone Speaker Integrated mono speaker Mounting Options 3 x 1/4\" thread mounting points on top of camera. 1 x 1/4\" thread tripod mount with locator pin. Power Integrated Lithium-ion Polymer rechargeable battery. 12V-30V DC port for external battery power or use included 12V AC adapter. Battery Life Approximately 90 minutes Battery Charge Time Approximately 2 hours when not in use. Camera Dimensions 166.2mm by 113.51mm x 126.49mm excluding detachable sunshade and turret dust cap Camera Weight 1.7 kg / 3.75 lb",
    "brand": "Blackmagic Design",
    "shootingresolutions": "2.5K RAW at 2432 x 1366. ProRes and DNxHD at 1920 x 1080",
    "miscellaneous": "No",
    "includes": "Blackmagic Design Cinema Camera External 12 VAC Power Supply DaVinci Resolve Software Media Express Software Blackmagic UltraScope Software Detachable Sun Shield Camera Strap Turret Dust Cap One (1) Year Warranty",
    "lensmount": "EF and ZE mount compatible with electronic iris control",
    "name": "Blackmagic Design Cinema Camera with EF Mount",
    "iriscontrol": "Iris button automatically adjusts the lens iris settings so no pixel is clipped",
    "screentype": "Integrated LCD capacitive touchscreen",
    "mountingoptions": "3 x 1/4\" thread mounting points on top of camera. 1 x 1/4\" thread tripod mount with locator pin.",
    "sensorresolution": "2592 x 2192"
}