{
    "accessoryshoe": "1x Cold",
    "builtinndfilters": "Clear, 1/4, 1/16, 1/64",
    "imagestabilization": "Optical",
    "weight": "3.41 lb\u00a0/\u00a01550 g Without Battery or SD card",
    "powerconsumption": "in LCD Operation: 15.4 W in Viewfinder Operation: 14.3 W",
    "channels": "2.0-Channel",
    "recordingmedia": "SDHC/SDXC",
    "builtinspeaker": "Yes",
    "effectivepixels": "8.85\u00a0Video 8.29 @\u00a0Video\u00a016:9",
    "poweradapter": "12-VDC",
    "pixelgross": "18,470,000",
    "audioformat": "AAC Dolby Digital 2ch LPCM",
    "stillimageresolution": "JPEG: 8.8 Megapixel, 4096 x 2160 (17:9) JPEG: 8.3 Megapixel, 3840 x 2160 (16:9) JPEG: 2.1 Megapixel, 1920 x 1080 (16:9)",
    "category": "camera",
    "videoformat": "4K MP4 4096 x 2160p / 24 fps (100Mbps) UltraHD MP4 30,840 x 2160 / 59.94 fps (150Mbps) 3840 x 2160p / 59.94 fps (100Mbps) 3840 x 1080p / 23.98 fps (100Mbps) High Definition MP4 1920 x 1080p / 59.94 fps (200Mbps) 1920 x 1080p / 59.94 fps (100Mbps) 1920 x 1080p / 59.94 fps (50Mbps) High Definition MP4 1920 x 1080p / 29.97 fps (200Mbps) 1920 x 1080p / 29.97 fps (50Mbps) High Definition MP4 1920 x 1080p / 23.98 fps (200Mbps) 1920 x 1080p / 23.98 fps (50Mbps) High Definition MOV 1920 x 1080p / 59.94 fps (200Mbps) 1920 x 1080p / 59.94 fps (50Mbps) 1920 x 1080p / 59.94 fps (50Mbps) High Definition MOV 1920 x 1080p / 29.97 fps (200Mbps) 19,020 x 1080p / 29.97 fps (50Mbps) High Definition MOV 1920 x 1080p / 23.98 fps (200Mbps) 1920 x 1080p / 23.98 fps (50Mbps) High Definition AVCHD Progressive 1920 x 1080p / 59.94 fps (28Mbps) 1920 x 1080i / 59.94 fps (24Mbps) 1920 x 1080i / 59.94 fps (17Mbps) High Definition AVCHD Progressive 1920 x 1080i / 59.94 fps (5Mbps) 1280 x 720p / 59.94 fps (8Mbps)",
    "attr1star": "2 stars3 stars4 stars5 stars",
    "attr35mmequivalentfocallength": "29.5 - 600 @ Aspect Ratio: 17:9 30.8 - 626 @ Aspect Ratio: 16:9",
    "lux": "1400 4 (Super Gain 30dB, Shutter 1/30)",
    "system": "NTSC/PAL",
    "battery": "Rechargeable Lithium-Ion Battery Pack, 7.2VDC",
    "maximumaperture": "f/ 1.8 - f/ 3.6",
    "dimensionswxhxd": "6.3 x 6.7 x 12.4\"\u00a0/\u00a0160.0 x 170.0 x 315.0 mm",
    "sensor": "1x 18.47 Megapixel 1/2.3\" \u00a0MOS Sensor",
    "whitebalancemodes": "3000K 5500K Auto Manual",
    "inputs": "2x\u00a0XLR\u00a0microphone 1x\u00a01/8\" (3.5mm) Stereo Mini\u00a0camera remote 1x\u00a0LANC Terminal\u00a02.5 mm super mini jack camera remote",
    "touchscreen": "Yes",
    "specifications": "Camera Sensor 1x 18.47 Megapixel 1/2.3\" \u00a0MOS Sensor Pixel Gross 18,470,000 Effective Pixels 8.85\u00a0Video 8.29 @\u00a0Video\u00a016:9 Optics Focal Length 4.08 - 81.6 mm 35mm Equivalent Focal Length 29.5 - 600 @ Aspect Ratio: 17:9 30.8 - 626 @ Aspect Ratio: 16:9 Maximum Aperture f/ 1.8 - f/ 3.6 Zoom Optical: 20x Intelligent: 40x\u00a0(in HD) Digital: 2x Digital: 5x Digital: 10x Filter Size 49 mm Built-in ND Filters Clear, 1/4, 1/16, 1/64 Recording System NTSC/PAL Recording Media SDHC/SDXC Video Format 4K MP4 4096 x 2160p / 24 fps (100Mbps) UltraHD MP4 30,840 x 2160 / 59.94 fps (150Mbps) 3840 x 2160p / 59.94 fps (100Mbps) 3840 x 1080p / 23.98 fps (100Mbps) High Definition MP4 1920 x 1080p / 59.94 fps (200Mbps) 1920 x 1080p / 59.94 fps (100Mbps) 1920 x 1080p / 59.94 fps (50Mbps) High Definition MP4 1920 x 1080p / 29.97 fps (200Mbps) 1920 x 1080p / 29.97 fps (50Mbps) High Definition MP4 1920 x 1080p / 23.98 fps (200Mbps) 1920 x 1080p / 23.98 fps (50Mbps) High Definition MOV 1920 x 1080p / 59.94 fps (200Mbps) 1920 x 1080p / 59.94 fps (50Mbps) 1920 x 1080p / 59.94 fps (50Mbps) High Definition MOV 1920 x 1080p / 29.97 fps (200Mbps) 19,020 x 1080p / 29.97 fps (50Mbps) High Definition MOV 1920 x 1080p / 23.98 fps (200Mbps) 1920 x 1080p / 23.98 fps (50Mbps) High Definition AVCHD Progressive 1920 x 1080p / 59.94 fps (28Mbps) 1920 x 1080i / 59.94 fps (24Mbps) 1920 x 1080i / 59.94 fps (17Mbps) High Definition AVCHD Progressive 1920 x 1080i / 59.94 fps (5Mbps) 1280 x 720p / 59.94 fps (8Mbps) Aspect Ratio 16:9 17:9 Still Image Resolution JPEG: 8.8 Megapixel, 4096 x 2160 (17:9) JPEG: 8.3 Megapixel, 3840 x 2160 (16:9) JPEG: 2.1 Megapixel, 1920 x 1080 (16:9) Channels 2.0-Channel Audio Format AAC Dolby Digital 2ch LPCM Display Display Type Viewfinder Screen Size .45\" Pixel Count 1,226,880 2nd Display Display Type LCD Touchscreen Yes Screen Size 3.5\" Pixel Count 1,152,000 Rotation Turning Angle: 270\u00b0 Features Image Stabilization Optical Lux 1400 4 (Super Gain 30dB, Shutter 1/30) Shutter Speed Not Specified By Manufacturer White Balance Modes 3000K 5500K Auto Manual Built-in Mic Yes Built-in Speaker Yes Wi-Fi Yes, 802.11b/g/n Accessory Shoe 1x Cold Tripod Mount 1/4\" - 20 Input/Output Connectors Inputs 2x\u00a0XLR\u00a0microphone 1x\u00a01/8\" (3.5mm) Stereo Mini\u00a0camera remote 1x\u00a0LANC Terminal\u00a02.5 mm super mini jack camera remote Outputs 1x\u00a0A/V 1x\u00a0HDMI A (Full Size) 1x\u00a0USB 3.0\u00a0Type A (Host) 1x\u00a0USB Micro-B\u00a0USB 3.0 Microphone Input Yes Headphone Jack Yes General Battery Rechargeable Lithium-Ion Battery Pack, 7.2VDC Charging Method AC Adapter Power Adapter 12-VDC Power Consumption in LCD Operation: 15.4 W in Viewfinder Operation: 14.3 W Dimensions (WxHxD) 6.3 x 6.7 x 12.4\"\u00a0/\u00a0160.0 x 170.0 x 315.0 mm Weight 3.41 lb\u00a0/\u00a01550 g Without Battery or SD card",
    "focallength": "4.08 - 81.6 mm",
    "outputs": "1x\u00a0A/V 1x\u00a0HDMI A (Full Size) 1x\u00a0USB 3.0\u00a0Type A (Host) 1x\u00a0USB Micro-B\u00a0USB 3.0",
    "brand": "Panasonic",
    "miscellaneous": "No",
    "headphonejack": "Yes",
    "includes": "Panasonic HC-X1000 4K DCI/Ultra HD/Full HD Camcorder AC Adapter 2 x AC Cables 5,800mAh Rechargeable Battery Battery Charger HDMI Cable USB Cable Microphone Holder 2 x Microphone Holder Screws 2 x Input Terminal Caps Shoulder Strap EVF Eyepiece Cup Limited 1-Year Warranty",
    "builtinmic": "Yes",
    "screensize": "3.5\"",
    "aspectratio": "16:9 17:9",
    "shutterspeed": "Not Specified By Manufacturer",
    "name": "Panasonic HC-X1000 4K DCI/Ultra HD/Full HD Camcorder",
    "pixelcount": "1,152,000",
    "tripodmount": "1/4\" - 20",
    "wifi": "Yes, 802.11b/g/n",
    "zoom": "Optical: 20x Intelligent: 40x\u00a0(in HD) Digital: 2x Digital: 5x Digital: 10x",
    "filtersize": "49 mm",
    "microphoneinput": "Yes",
    "displaytype": "LCD"
}