{
    "weight": "10.4 lbs (4.7kg)",
    "powerconsumption": "25W",
    "sensitivity": "F10 (1080 59.94i)/F11 (1080/50i) @2000 lx, 3200K, 89.9% white",
    "horizontalresolution": "1100 TV Lines",
    "framerates": "59.94i, 50i",
    "inputsoutputs": "HD-SDI: BNC (x1 Output) Monitor: BNC (x1 Output) Line/Mic: 3-pin XLR male (x2 Input) Front Mic: 3-pin XLR female (x1 Input) Audio L/R: RCAx2 (x1 Output) Earphone: 3.5mm Mini Jack (x1 Output) PROMPT: BNC (x2 Output) GENLOCK: BNC (x1 Input) AUX: BNC (x1 Input/Output) INCOM: 4-pin XLR (x2) Lens: 12-pin",
    "attr1star": "2 stars3 stars4 stars5 stars",
    "videorecordingsystem": "NTSC/PAL 1080/59.94i, 1080/50i",
    "memorycardslot": "(1) SD Slot (for camera & user settings)",
    "builtinfilters": "Neutral Density: Cap, 100%, 25%, 6.3%, 1.6% CC: 3200K, 4300K, 6300K, Cross, Diffusion",
    "dimensionswxhxd": "5.3 x 10.25 x 14.25\" (13.5 x 26 x 36 cm)",
    "category": "camera",
    "videoformats": "1080i",
    "specifications": "Image Device 2/3\" IT-3CCD Picture Elements 2.2MP Video Recording System NTSC/PAL 1080/59.94i, 1080/50i Lens Mount 2/3\" Bayonet Resolution 2010 x 1120 total (1920 x 1080 effective) Horizontal Resolution 1100 TV Lines Built-in Filters Neutral Density: Cap, 100%, 25%, 6.3%, 1.6% CC: 3200K, 4300K, 6300K, Cross, Diffusion Gain Selection Not specified by manufacturer Sensitivity F10 (1080 59.94i)/F11 (1080/50i) @2000 lx, 3200K, 89.9% white S/N Ratio (Video) 60db Vertical Smear 130dB Video Formats 1080i Frame Rates 59.94i, 50i Inputs/Outputs HD-SDI: BNC (x1 Output) Monitor: BNC (x1 Output) Line/Mic: 3-pin XLR male (x2 Input) Front Mic: 3-pin XLR female (x1 Input) Audio L/R: RCAx2 (x1 Output) Earphone: 3.5mm Mini Jack (x1 Output) PROMPT: BNC (x2 Output) GENLOCK: BNC (x1 Input) AUX: BNC (x1 Input/Output) INCOM: 4-pin XLR (x2) Lens: 12-pin Memory Card Slot (1) SD Slot (for camera & user settings) LCD Monitor None Viewfinder Optional Power Requirements 12VDC Power Consumption 25W Dimensions (WxHxD) 5.3 x 10.25 x 14.25\" (13.5 x 26 x 36 cm) Weight 10.4 lbs (4.7kg)",
    "brand": "Panasonic",
    "miscellaneous": "No",
    "includes": "Panasonic AK-HC3500 2/3\" HD Studio Camera 2-Year Parts, 1-Year Labor Warranty",
    "gainselection": "Not specified by manufacturer",
    "lensmount": "2/3\" Bayonet",
    "lcdmonitor": "None",
    "powerrequirements": "12VDC",
    "imagedevice": "2/3\" IT-3CCD",
    "name": "Panasonic AK-HC3500 2/3\" HD Studio Camera",
    "pictureelements": "2.2MP",
    "viewfinder": "Optional",
    "resolution": "2010 x 1120 total (1920 x 1080 effective)"
}