{
    "externalflashconnection": "Hot Shoe",
    "weight": "19.75 oz\u00a0/\u00a0560 g with SD card and Battery",
    "includedsoftwarerequirements": "Windows: XP, Vista, 7, 8 Mac: OS X 10.5 or later",
    "battery": "1x   Rechargeable Lithium-Ion Battery Pack, 7.2VDC, 1860mAh",
    "isosensitivity": "200-25600 (Extended Mode: 100-25600)",
    "memorycardtype": "SD SDHC SDXC",
    "viewfinderpixelcount": "2,359,000",
    "lensmount": "Micro Four Thirds",
    "videoformat": "High Definition MOV 4096 x 2160p / 24 fps (100Mbps) 3840 x 2160p / 23.98 fps (100Mbps) 3840 x 2160p / 24 fps (100Mbps) 3840 x 2160p / 25 fps (100Mbps) 3840 x 2160p / 29.97 fps (100Mbps) 1920 x 1080p / 23.98 fps (200Mbps) 1920 x 1080p / 24 fps (200Mbps) 1920 x 1080p / 25 fps (200Mbps) 1920 x 1080p / 29.97 fps (200Mbps) 1920 x 1080p / 50 fps (200Mbps) 1920 x 1080p / 59.94 fps (200Mbps) High Definition MP4 4096 x 2160p / 24 fps (100Mbps) 3840 x 2160p / 23.98 fps (100Mbps) 3840 x 2160p / 24 fps (100Mbps) 3840 x 2160p / 25 fps (100Mbps) 3840 x 2160p / 29.97 fps (100Mbps) 1920 x 1080p / 23.98 fps (200Mbps) 1920 x 1080p / 24 fps (200Mbps) 1920 x 1080p / 25 fps (200Mbps) 1920 x 1080p / 29.97 fps (200Mbps) 1920 x 1080p / 50 fps (200Mbps) 1920 x 1080p / 59.94 fps (200Mbps) 1920 x 1080p / 25 fps (20Mbps) 1920 x 1080p / 29.97 fps (20Mbps) 1920 x 1080p / 50 fps (28Mbps) 1920 x 1080p / 59.94 fps (28Mbps) 1280 x 720p / 25 fps (10Mbps) 1280 x 720p / 29.97 fps (10Mbps) Standard Definition MP4 640 x 480p / 25 fps (4Mbps) 640 x 480p / 29.97 fps (4Mbps) High Definition AVCHD 1920 x 1080p / 23.98 fps (24Mbps) 1920 x 1080p / 50 fps (28Mbps) 1920 x 1080p / 59.94 fps (28Mbps) 1920 x 1080i / 50 fps (24Mbps) 1920 x 1080i / 50 fps (17Mbps) 1920 x 1080i / 59.94 fps (24Mbps) 1920 x 1080i / 59.94 fps (17Mbps)",
    "attr1star": "2 stars3 stars4 stars5 stars",
    "shutter": "60 - 1/8000\u00a0sec 60\u00a0minute in Bulb Mode 1/24 - 1/16000\u00a0sec in Movie Mode",
    "maxsyncspeed": "1 / 250 sec",
    "burstrate": "Up to 40 fps",
    "operatingstoragetemperature": "Operating 32 to 104\u00b0F (0 to 40\u00b0C) Humidity: 10 - 80%",
    "viewfindereyepoint": "21.0 mm",
    "fileformats": "Still Images: JPEG, MPO, RAW Movies: MOV, MP4, MPEG-4 AVCHD Audio: AAC, Dolby Digital 2ch, Linear PCM",
    "selftimer": "10 sec, 2 sec Number of Shots: 1-3",
    "diopteradjustment": "- 4.0 to +4.0 m",
    "dimensionswxhxd": "5.2 x 3.7 x 3.3\"\u00a0/\u00a0132.9 x 93.4 x 83.9 mm",
    "viewfindercoverage": "100%",
    "meteringmethod": "Center-weighted average metering, Multiple, Spot metering",
    "audiorecording": "With Video, Stereo",
    "whitebalancemodes": "Auto, Cloudy, Color Temperature, Daylight, Flash, Incandescent, Shade, White Set",
    "dustreductionsystem": "Yes",
    "category": "camera",
    "viewfindermagnification": "Approx. 1.34x",
    "specifications": "Imaging Lens Mount Micro Four Thirds Camera Format Micro Four Thirds  (2x Crop Factor) Pixels Actual: 17.2 Megapixel Effective: 16.05 Megapixel Max Resolution 4608 x 3456 Sensor Type / Size MOS, 17.3 x 30.0 mm File Formats Still Images: JPEG, MPO, RAW Movies: MOV, MP4, MPEG-4 AVCHD Audio: AAC, Dolby Digital 2ch, Linear PCM Dust Reduction System Yes Memory Card Type SD SDHC SDXC AV Recording Video Recording Yes, NTSC/PAL Video Format High Definition MOV 4096 x 2160p / 24 fps (100Mbps) 3840 x 2160p / 23.98 fps (100Mbps) 3840 x 2160p / 24 fps (100Mbps) 3840 x 2160p / 25 fps (100Mbps) 3840 x 2160p / 29.97 fps (100Mbps) 1920 x 1080p / 23.98 fps (200Mbps) 1920 x 1080p / 24 fps (200Mbps) 1920 x 1080p / 25 fps (200Mbps) 1920 x 1080p / 29.97 fps (200Mbps) 1920 x 1080p / 50 fps (200Mbps) 1920 x 1080p / 59.94 fps (200Mbps) High Definition MP4 4096 x 2160p / 24 fps (100Mbps) 3840 x 2160p / 23.98 fps (100Mbps) 3840 x 2160p / 24 fps (100Mbps) 3840 x 2160p / 25 fps (100Mbps) 3840 x 2160p / 29.97 fps (100Mbps) 1920 x 1080p / 23.98 fps (200Mbps) 1920 x 1080p / 24 fps (200Mbps) 1920 x 1080p / 25 fps (200Mbps) 1920 x 1080p / 29.97 fps (200Mbps) 1920 x 1080p / 50 fps (200Mbps) 1920 x 1080p / 59.94 fps (200Mbps) 1920 x 1080p / 25 fps (20Mbps) 1920 x 1080p / 29.97 fps (20Mbps) 1920 x 1080p / 50 fps (28Mbps) 1920 x 1080p / 59.94 fps (28Mbps) 1280 x 720p / 25 fps (10Mbps) 1280 x 720p / 29.97 fps (10Mbps) Standard Definition MP4 640 x 480p / 25 fps (4Mbps) 640 x 480p / 29.97 fps (4Mbps) High Definition AVCHD 1920 x 1080p / 23.98 fps (24Mbps) 1920 x 1080p / 50 fps (28Mbps) 1920 x 1080p / 59.94 fps (28Mbps) 1920 x 1080i / 50 fps (24Mbps) 1920 x 1080i / 50 fps (17Mbps) 1920 x 1080i / 59.94 fps (24Mbps) 1920 x 1080i / 59.94 fps (17Mbps) Aspect Ratio 4:3, 16:9 Video Clip Length Up to 220\u00a0Min Audio Recording With Video, Stereo Focus Control Focus Type Auto & Manual Focus Mode Single-servo AF (S), Continuous-servo AF (C), Manual Focus (M) , Flexible (AFF) Viewfinder/Display Viewfinder Type Electronic Viewfinder Pixel Count 2,359,000 Viewfinder Eye Point 21.0 mm Viewfinder Coverage 100% Viewfinder Magnification Approx. 1.34x Diopter Adjustment - 4.0 to +4.0 m Display Screen 3\"\u00a0Touchscreen\u00a0Swivel\u00a0\u00a0OLED (1,036,000) Screen Coverage 100% Exposure Control ISO Sensitivity 200-25600 (Extended Mode: 100-25600) Shutter 60 - 1/8000\u00a0sec 60\u00a0minute in Bulb Mode 1/24 - 1/16000\u00a0sec in Movie Mode Remote Control DMW-RSL1 (Optional) Metering Method Center-weighted average metering, Multiple, Spot metering Exposure Modes Modes: Aperture Priority, Manual, Program, Shutter Priority Metering Range: EV 0.0 - EV 18.0 White Balance Modes Auto, Cloudy, Color Temperature, Daylight, Flash, Incandescent, Shade, White Set Burst Rate Up to 40 fps Flash Flash Modes Auto Auto/Red-eye Reduction Forced On Forced On/Red-eye Reduction Off Slow Sync Slow Sync/Red-eye Reduction Built-in Flash Yes Max Sync Speed 1 / 250 sec Flash Compensation -3 EV to +3 EV (in 1/3 EV steps) Dedicated Flash System TTL External Flash Connection Hot Shoe Performance Self Timer 10 sec, 2 sec Number of Shots: 1-3 Interval Recording Yes Connectivity 1/8\" Headphone, 1/8\" Microphone, AV Output, HDMI D (Micro), USB 2.0, Wired Remote Port Wi-Fi Capable Yes Included Software Requirements Windows: XP, Vista, 7, 8 Mac: OS X 10.5 or later Power Battery 1x   Rechargeable Lithium-Ion Battery Pack, 7.2VDC, 1860mAh Operating/Storage Temperature Operating 32 to 104\u00b0F (0 to 40\u00b0C) Humidity: 10 - 80% Physical Dimensions (WxHxD) 5.2 x 3.7 x 3.3\"\u00a0/\u00a0132.9 x 93.4 x 83.9 mm Weight 19.75 oz\u00a0/\u00a0560 g with SD card and Battery",
    "brand": "Panasonic",
    "sensortypesize": "MOS, 17.3 x 30.0 mm",
    "miscellaneous": "IN STOCK",
    "includes": "Panasonic Lumix DMC-GH4 Mirrorless Micro Four Thirds Digital Camera - Body Only 7.2V 1860mAh Lithium-Ion Battery Pack Battery Charger Body Cap Hot Shoe Cover USB Connection Cable Shoulder Strap DVD PHOTOfunSTUDIO 9.5 PE (Windows) SILKYPIX\u00ae Developer Studio 4.1 SE (Windows & Mac) LoiLoScope (Trial Version, Windows) Limited 1-Year Warranty FREE\u00a0SanDisk 32GB Extreme PRO SDHC UHS-II Memory Card",
    "connectivity": "1/8\" Headphone, 1/8\" Microphone, AV Output, HDMI D (Micro), USB 2.0, Wired Remote Port",
    "cameraformat": "Micro Four Thirds  (2x Crop Factor)",
    "focustype": "Auto & Manual",
    "videorecording": "Yes, NTSC/PAL",
    "aspectratio": "4:3, 16:9",
    "displayscreen": "3\"\u00a0Touchscreen\u00a0Swivel\u00a0\u00a0OLED (1,036,000)",
    "pixels": "Actual: 17.2 Megapixel Effective: 16.05 Megapixel",
    "intervalrecording": "Yes",
    "remotecontrol": "DMW-RSL1 (Optional)",
    "name": "Panasonic Lumix DMC-GH4 Mirrorless Micro Four Thirds Digital Camera - Body Only with Free Memory Card",
    "videocliplength": "Up to 220\u00a0Min",
    "flashmodes": "Auto Auto/Red-eye Reduction Forced On Forced On/Red-eye Reduction Off Slow Sync Slow Sync/Red-eye Reduction",
    "builtinflash": "Yes",
    "exposuremodes": "Modes: Aperture Priority, Manual, Program, Shutter Priority Metering Range: EV 0.0 - EV 18.0",
    "focusmode": "Single-servo AF (S), Continuous-servo AF (C), Manual Focus (M) , Flexible (AFF)",
    "flashcompensation": "-3 EV to +3 EV (in 1/3 EV steps)",
    "viewfindertype": "Electronic",
    "dedicatedflashsystem": "TTL",
    "maxresolution": "4608 x 3456",
    "screencoverage": "100%",
    "wificapable": "Yes"
}