{
    "weight": "1.7 lb (765 g)",
    "oledviewscreen": "3.5\" Touch Panel Pixel Count: Approximately 1,230,000 dots",
    "category": "camera",
    "maximumrecordingtime": "MPEG4 8Gb: 30 minutes @ 35 Mb/s, 40 minutes @ 24 Mb/s, 60 minutes @ 17 Mb/s, 260 minutes @ 4 Mb/s, 340 minutes @ 3 Mb/s 128Gb:  8 hours @ 35 Mb/s, 11 hours 55 minutes @24 Mb/s, 16 hours 45 min @ 17  Mb/s, 69 hours 30 min @ 4 Mb/s, 91 hours 55 min @ 3 Mb/s AVCHD 8Gb: 35 minutes @ 28 Mb/s, 40 minutes @ 24 Mb/s, 60 minutes @ 17 Mb/s, 3 hours @ 5 Mb/s 128Gb: 10 hours 10 minutes @ 28 Mb/s, 11 hours 55 minutes @ 24 Mb/s, 16 hours 45 minutes @ 17 Mb/s, 49 hours @ 5 Mb/s",
    "dimensionswxhxd": "4.3 x 3.3 7.2\" (10.9 x 8.4 x 18.3 cm)",
    "brand": "Canon",
    "attr1star": "2 stars3 stars4 stars5 stars",
    "specifications": "Image Device 1/2.84\" CMOS Sensor Resolution: 1920 x 1080 Total Pixels: 3.09 Mp Effective Pixels: 2.91 Mp RGB Primary Color Filter Compatible with NTSC Lens Zoom Range: 20x Optical/ 400x Digital Max Aperture: 1.8 - 2.8 Focal Length: 3.67 to 73.4mm 35mm Equivalent: 26.8 to 576mm (28.8 to 576mm with Dynamic IS) Minimum Focus Wide: 0.8\" (20 mm) Minimum Focus Throughout Zoom Range: 23.6\" (60 cm) Filter Rings Size:  58 mm Zoom Speed Settings: Variable, Constant (16 levels), Fast, Normal,  Slow Minimum Illumination Nominal: 1.2 Lux Low Light Mode: Approx 0.1 Lux (shutter speed at 0.5 sec) OLED Viewscreen 3.5\" Touch Panel Pixel Count: Approximately 1,230,000 dots Viewfinder 0.24\" Color EVF Pixel Count: Approximately 1,560,000 dots Media Card Slots 2 x SD/SDHC/SDXC Codec / Format Support MPEG4 1080: 59.94p, 29.97p, 23.98p 720/360: 29.97p, 23.98p AVCHD 1080: 59.94p, 59.94i, PF29.97, 23.98p Note: PF29.97 is Canon's designation for 29.97p video in a 59.94i stream Bit Rates MPEG4 35 Mb/s: 1920 x 1080 @ 59.94p 24 Mb/s: 1920 x 1080 @ 29.97p,23.98p 17 Mb/s: 1920 x 1080 @ 29.97p,23.98p 4 Mb/s: 1280 x 720 @ 29.97p,23.98p 3 Mb/s: 640 x 360 @ 29.97p,23.98p AVCHD 28 Mb/s: 1920 x 1080 @ 59.94p 24 Mb/s: 1920 x 1080 @ 59.94i/p, PF29.97, 23.98p 17 Mb/s: 1920 x 1080 @ 59.94i/p, PF29.97, 23.98p 5 Mb/s: 1920 x 1080 @ 59.94i/p, PF29.97, 23.98p Maximum Recording Time MPEG4 8Gb: 30 minutes @ 35 Mb/s, 40 minutes @ 24 Mb/s, 60 minutes @ 17 Mb/s, 260 minutes @ 4 Mb/s, 340 minutes @ 3 Mb/s 128Gb:  8 hours @ 35 Mb/s, 11 hours 55 minutes @24 Mb/s, 16 hours 45 min @ 17  Mb/s, 69 hours 30 min @ 4 Mb/s, 91 hours 55 min @ 3 Mb/s AVCHD 8Gb: 35 minutes @ 28 Mb/s, 40 minutes @ 24 Mb/s, 60 minutes @ 17 Mb/s, 3 hours @ 5 Mb/s 128Gb: 10 hours 10 minutes @ 28 Mb/s, 11 hours 55 minutes @ 24 Mb/s, 16 hours 45 minutes @ 17 Mb/s, 49 hours @ 5 Mb/s Shutter Speed Max: 1/2000 sec Audio Linear PCM (2 Channel): when recording in AVCHD 28 Mb/s @ 23.98 Dolby Digital Dobly Digital 5.1 when using Optional SM-V1 Power Requirements Battery: 7.4V DC Power Supply: 8.4V DC Operating Temperature Operation: 23 to 113\u00b0F (-5 to 45\u00b0C) Performance: 32 to 104\u00b0F (0 to 40\u00b0C) Dimensions (WxHxD) 4.3 x 3.3 7.2\" (10.9 x 8.4 x 18.3 cm) Weight 1.7 lb (765 g)",
    "minimumillumination": "Nominal: 1.2 Lux Low Light Mode: Approx 0.1 Lux (shutter speed at 0.5 sec)",
    "miscellaneous": "No",
    "includes": "Canon XA20 Professional HD Camcorder Lens Hood Lens Cap Eye Cup BP-820 Lithium-Ion Battery Pack (1780mAh) Detachable Top Handle with Screws Microphone Holder with Screws WL-D89 Wireless Controller CR2025 Lithium Battery CA-570 Compact AC Power Adapter Ferrite Core AC Cable A Stereo Video Cable Interface Cable Set High Speed HDMI Cable Software CD Limited 1-Year Warranty",
    "lens": "Zoom Range: 20x Optical/ 400x Digital Max Aperture: 1.8 - 2.8 Focal Length: 3.67 to 73.4mm 35mm Equivalent: 26.8 to 576mm (28.8 to 576mm with Dynamic IS) Minimum Focus Wide: 0.8\" (20 mm) Minimum Focus Throughout Zoom Range: 23.6\" (60 cm) Filter Rings Size:  58 mm Zoom Speed Settings: Variable, Constant (16 levels), Fast, Normal,  Slow",
    "shutterspeed": "Max: 1/2000 sec",
    "powerrequirements": "Battery: 7.4V DC Power Supply: 8.4V DC",
    "operatingtemperature": "Operation: 23 to 113\u00b0F (-5 to 45\u00b0C) Performance: 32 to 104\u00b0F (0 to 40\u00b0C)",
    "imagedevice": "1/2.84\" CMOS Sensor Resolution: 1920 x 1080 Total Pixels: 3.09 Mp Effective Pixels: 2.91 Mp RGB Primary Color Filter Compatible with NTSC",
    "name": "Canon XA20 HD Professional Camcorder",
    "mediacardslots": "2 x SD/SDHC/SDXC",
    "viewfinder": "0.24\" Color EVF Pixel Count: Approximately 1,560,000 dots",
    "audio": "Linear PCM (2 Channel): when recording in AVCHD 28 Mb/s @ 23.98 Dolby Digital Dobly Digital 5.1 when using Optional SM-V1",
    "codecformatsupport": "MPEG4 1080: 59.94p, 29.97p, 23.98p 720/360: 29.97p, 23.98p AVCHD 1080: 59.94p, 59.94i, PF29.97, 23.98p Note: PF29.97 is Canon's designation for 29.97p video in a 59.94i stream"
}