{
    "weight": "3.01 oz\u00a0/\u00a085.4\u00a0 g without batteries",
    "battery": "2x AA Batteries",
    "channels": "2-Channel Stereo",
    "displaytype": "LCD",
    "builtinspeaker": "Yes",
    "poweradapter": "5-VDC",
    "stillimageresolution": "Not Specified By Manufacturer",
    "videoformat": "High Definition MPEG AVC/H.264 1920 x 1080p / 30 fps High Definition MPEG AVC/H.264 1280 x 720p / 60 fps / 30 fps Standard Definition MPEG AVC/H.264 800 x 480 / 60 fps / 30 fps",
    "attr1star": "2 stars3 stars4 stars5 stars",
    "system": "NTSC",
    "dimensionswxhxd": "2.01 x 5.00 x 1.38\"\u00a0/\u00a05.1 x 12.69 x 3.5 cm",
    "tripodmount": "Not Specified By Manufacturer",
    "category": "camera",
    "touchscreen": "No",
    "specifications": "Optics Sensor 5 Megapixel 1/3.2\" CMOS Lens Fixed Focus f/3.2 Zoom Digital: 4x Recording System NTSC Recording Media SD/SDHC/SDXC\u00a0Up To 64GB Video Format High Definition MPEG AVC/H.264 1920 x 1080p / 30 fps High Definition MPEG AVC/H.264 1280 x 720p / 60 fps / 30 fps Standard Definition MPEG AVC/H.264 800 x 480 / 60 fps / 30 fps Still Image Resolution Not Specified By Manufacturer Channels 2-Channel Stereo Display Display Type LCD Screen Size 2.0\" Touchscreen No Features Built-in Mic Yes Built-in Speaker Yes Built-in Light/Flash Light - No Flash - No Tripod Mount Not Specified By Manufacturer Input/Output Connectors Outputs 1x\u00a0HDMI C (Mini) 1x\u00a01/8\" (3.5mm) Stereo Output (Jack)\u00a0Phones / Line Out 1x\u00a0USB Mini-B\u00a0USB 2.0 - Video / USB 2.0 - Audio Microphone Input No Headphone Jack Yes General System Requirements Windows XP (SP2) XP (SP3) Vista (SP1) Vista (SP2) 7 Pentium 4\u00a01.4GHz Processor or greater 512MB RAM USB 2.0 Interface 1024 x 600 Pixel Resolution Mac OS X 10.4.6 or later / 10.5 / 10.6 / 10.7 Core 2 Duo\u00a01.66GHz Processor or greater 512MB RAM USB 2.0 Interface 1024 x 600 Pixel Resolution Battery 2x AA Batteries Power Adapter 5-VDC Dimensions (WxHxD) 2.01 x 5.00 x 1.38\"\u00a0/\u00a05.1 x 12.69 x 3.5 cm Weight 3.01 oz\u00a0/\u00a085.4\u00a0 g without batteries",
    "outputs": "1x\u00a0HDMI C (Mini) 1x\u00a01/8\" (3.5mm) Stereo Output (Jack)\u00a0Phones / Line Out 1x\u00a0USB Mini-B\u00a0USB 2.0 - Video / USB 2.0 - Audio",
    "brand": "Zoom",
    "miscellaneous": "No",
    "headphonejack": "Yes",
    "includes": "Zoom     Q2HD Handy Video Recorder 2GB SD Card AC Adapter 2 x          AA/LR6 Batteries 1-Year Limited Warranty",
    "lens": "Fixed Focus f/3.2",
    "builtinmic": "Yes",
    "screensize": "2.0\"",
    "name": "Zoom Q2HD Handy Video Recorder",
    "recordingmedia": "SD/SDHC/SDXC\u00a0Up To 64GB",
    "sensor": "5 Megapixel 1/3.2\" CMOS",
    "zoom": "Digital: 4x",
    "systemrequirements": "Windows XP (SP2) XP (SP3) Vista (SP1) Vista (SP2) 7 Pentium 4\u00a01.4GHz Processor or greater 512MB RAM USB 2.0 Interface 1024 x 600 Pixel Resolution Mac OS X 10.4.6 or later / 10.5 / 10.6 / 10.7 Core 2 Duo\u00a01.66GHz Processor or greater 512MB RAM USB 2.0 Interface 1024 x 600 Pixel Resolution",
    "microphoneinput": "No"
}