{
    "videooutput": "4 x 3G/HD-SDI Main Outputs (BNC connectors) 2 x 3G/HD-SDI Monitor Outputs (BNC connectors, one front mounted, one rear mounted) 1 x HDMI 1.3 output (Type A connector, front mounted) 1 x HDMI 1.4 output (Type A connector, rear mounted)",
    "weight": "Without top handle: 6.4 lb (2.9 kg) With top handle: 7.4 lb (3.4 kg)",
    "powerconsumption": "38 to 42 W (typical) 45 to 47 W (maximum) Note: Does not include power draw from 2-pin out connector)",
    "networkinterface": "1 x LAN (RJ-45 connector, 10/100/1000)",
    "recordingmedia": "AJA Pak media",
    "poweradapter": "100 to 240 VAC, 50/60 Hz",
    "dynamicrange": "12 stops",
    "storagetemperature": "Power OFF: -4 to 140\u00b0F (-20 to 60\u00b0C)",
    "attr1star": "2 stars3 stars4 stars5 stars",
    "sensorsize": "22.5 x 11.9 mm (4K APS-C sized)",
    "userinterface": "6 x Dedicated Menu Buttons (STATUS, CONFIG, MEDIA, FPS, EI and WB) 4 x Transport Buttons (Play, Fast Forward, Reverse Playback, Stop) 1 x Media Unmount Button 1 x Record Button 1 x User Interface Control Knob 1 x User Interface Screen, 320x240 LCD",
    "audioinput": "2 x Balanced analog audio (3-pin XLR connectors, dedicated line/mic/48v selection switch per input)",
    "category": "camera",
    "videoformats": "DCI 4K DCI 4K (4096x2160) progressive 23.98/24/25/29.97/30/50/59.94/60/119.88/120 Internal (to AJA Pak media): Apple ProRes 4444 or Apple ProRes 422 (all versions) up to 30 fps Apple ProRes 422 (or a lower data rate ProRes version) for 50/59.94/60 fps SDI output: 23.98/24/25/29.97/30 fps (4x SDI YCbCr, 4x SDI RGB, or 1x SDI Raw) 50/59.94/60 fps (4x SDI YCbCr or 2x SDI Raw) 119.88/120 fps (4x SDI Raw) Ultra HD Ultra HD (3840x2160) progressive 23.98/24/25/29.97/30/50/59.94/60/119.88/120 Internal (to AJA Pak media): Apple ProRes 4444 or Apple ProRes 422 (all versions) up to 30 fps Apple ProRes 422 (or a lower data rate ProRes version) for 50/59.94/60 fps SDI output: 23.98/24/25/29.97/30 fps (4x SDI YCbCr, 4x SDI RGB, or 1x SDI Raw) 50/59.94/60 fps (4x SDI YCbCr or 2x SDI RAW) 119.88/120 fps (4x SDI Raw) 2K 2K (2048x1080) progressive 23.98/24/25/29.97/30/50/59.94/60 Internal (to AJA Pak media): Apple ProRes 4444 or Apple ProRes 422 (all versions) up to 30 fps Apple ProRes 422 (all versions) for 50/59.94/60 fps SDI output: 23.98/24/25/29.97/30 fps (1x SDI YCbCr, 1x SDI RGB, or 1x SDI RGB) 50/59.94/60 fps (2x SDI YCbCr or 1x SDI YCbCr) 1080p 1920x1080 progressive 23.98/24/25/29.97/30/50/59.94/60 Internal (to AJA Pak media): Apple ProRes 4444 or Apple ProRes 422 (all versions) up to 30 fps Apple ProRes 422 (all versions) for 50/59.94/60 fps SDI output: 23.98/24/25/29.97/30 fps (1x SDI YCbCr, 2x SDI RGB, or 1x SDI RGB) 50/59.94/60 fps (2x SDI YCbCr or 1x SDI YCbCr) 1080i 1920x1080 interlaced 25/29.97/30 Internal (to AJA Pak media): Apple ProRes 422 (all versions) up to 30 fps SDI output: Up to 30 fps (1 x SDI YCbCr)",
    "power": "4-pin XLR connector or 2-pin input connector 12 to 18 VDC, 5 A maximum",
    "specifications": "Sensor Type CMOS, electronic global shutter Sensor Size 22.5 x 11.9 mm (4K APS-C sized) Dynamic Range 12 stops Lens Mount PL Filtration Optical Low Pass Filter and IR Cut Filter (combined) Recording Media AJA Pak media Video Formats DCI 4K DCI 4K (4096x2160) progressive 23.98/24/25/29.97/30/50/59.94/60/119.88/120 Internal (to AJA Pak media): Apple ProRes 4444 or Apple ProRes 422 (all versions) up to 30 fps Apple ProRes 422 (or a lower data rate ProRes version) for 50/59.94/60 fps SDI output: 23.98/24/25/29.97/30 fps (4x SDI YCbCr, 4x SDI RGB, or 1x SDI Raw) 50/59.94/60 fps (4x SDI YCbCr or 2x SDI Raw) 119.88/120 fps (4x SDI Raw) Ultra HD Ultra HD (3840x2160) progressive 23.98/24/25/29.97/30/50/59.94/60/119.88/120 Internal (to AJA Pak media): Apple ProRes 4444 or Apple ProRes 422 (all versions) up to 30 fps Apple ProRes 422 (or a lower data rate ProRes version) for 50/59.94/60 fps SDI output: 23.98/24/25/29.97/30 fps (4x SDI YCbCr, 4x SDI RGB, or 1x SDI Raw) 50/59.94/60 fps (4x SDI YCbCr or 2x SDI RAW) 119.88/120 fps (4x SDI Raw) 2K 2K (2048x1080) progressive 23.98/24/25/29.97/30/50/59.94/60 Internal (to AJA Pak media): Apple ProRes 4444 or Apple ProRes 422 (all versions) up to 30 fps Apple ProRes 422 (all versions) for 50/59.94/60 fps SDI output: 23.98/24/25/29.97/30 fps (1x SDI YCbCr, 1x SDI RGB, or 1x SDI RGB) 50/59.94/60 fps (2x SDI YCbCr or 1x SDI YCbCr) 1080p 1920x1080 progressive 23.98/24/25/29.97/30/50/59.94/60 Internal (to AJA Pak media): Apple ProRes 4444 or Apple ProRes 422 (all versions) up to 30 fps Apple ProRes 422 (all versions) for 50/59.94/60 fps SDI output: 23.98/24/25/29.97/30 fps (1x SDI YCbCr, 2x SDI RGB, or 1x SDI RGB) 50/59.94/60 fps (2x SDI YCbCr or 1x SDI YCbCr) 1080i 1920x1080 interlaced 25/29.97/30 Internal (to AJA Pak media): Apple ProRes 422 (all versions) up to 30 fps SDI output: Up to 30 fps (1 x SDI YCbCr) Video Output 4 x 3G/HD-SDI Main Outputs (BNC connectors) 2 x 3G/HD-SDI Monitor Outputs (BNC connectors, one front mounted, one rear mounted) 1 x HDMI 1.3 output (Type A connector, front mounted) 1 x HDMI 1.4 output (Type A connector, rear mounted) Audio Input 2 x Balanced analog audio (3-pin XLR connectors, dedicated line/mic/48v selection switch per input) Audio Output 1 x Headphone jack (3.5 mm stereo mini TRS) Reference Input 1 x Reference input (BNC connector, analog color black) Timecode 1 x LTC (BNC connector, 0.5 to 4.5 vPP) LANC 2 x 2.5mm LANC connectors (one on top and one on side) Network Interface 1 x LAN (RJ-45 connector, 10/100/1000) Data Output AJA Raw via 3G-SDI up to 120 fps or Thunderbolt up to 30 fps User Interface 6 x Dedicated Menu Buttons (STATUS, CONFIG, MEDIA, FPS, EI and WB) 4 x Transport Buttons (Play, Fast Forward, Reverse Playback, Stop) 1 x Media Unmount Button 1 x Record Button 1 x User Interface Control Knob 1 x User Interface Screen, 320x240 LCD Power 4-pin XLR connector or 2-pin input connector 12 to 18 VDC, 5 A maximum Power Adapter 100 to 240 VAC, 50/60 Hz Power Consumption 38 to 42 W (typical) 45 to 47 W (maximum) Note: Does not include power draw from 2-pin out connector) Power Output 2-pin power output connector, 10 W recommended maximum Operating Temperature 41 to 104\u00b0F (5 to 40\u00b0C) Storage Temperature Power OFF: -4 to 140\u00b0F (-20 to 60\u00b0C) Weight Without top handle: 6.4 lb (2.9 kg) With top handle: 7.4 lb (3.4 kg)",
    "brand": "AJA",
    "miscellaneous": "No",
    "includes": "AJA CION 4K / 2K Production Camera Top Handle Limited 2-Year Warranty",
    "sensortype": "CMOS, electronic global shutter",
    "timecode": "1 x LTC (BNC connector, 0.5 to 4.5 vPP)",
    "lensmount": "PL",
    "poweroutput": "2-pin power output connector, 10 W recommended maximum",
    "operatingtemperature": "41 to 104\u00b0F (5 to 40\u00b0C)",
    "audiooutput": "1 x Headphone jack (3.5 mm stereo mini TRS)",
    "lanc": "2 x 2.5mm LANC connectors (one on top and one on side)",
    "name": "AJA CION 4K / 2K Production Camera"
}