{
    "weight": "Main Unit Only: Approx. 3.3 lb (1.50 kg) With Battery and an SD Card: Approx. 3.9 lb (1.78 kg)",
    "powerconsumption": "12.9 W",
    "operatingtemperature": "32 to 104\u00b0 F (0 ~ 40\u00b0 C)",
    "lenscoating": "Nano Surface Coating",
    "recordingmedia": "2 x SD/SDHC/SDXC (compatible with UHS-I Speed Class 1)",
    "zoomratio": "12x optical 25x i.Zoom 2x, 5x, 10x digital zoom",
    "imagestabilization": "Optical (hybrid optical image stabilizer, active mode)",
    "audioformat": "Dolby Digital",
    "sensorsize": "1/4.7\"",
    "videoformat": "AVCHD version 2.0 compliant, AVCHD Progressive",
    "category": "camera",
    "opticalimagestabilization": "5-Axis Hybrid OIS",
    "compression": "Video: MPEG-4 AVC/H.264 Audio: Dolby Digital (5.1ch/2 ch) Still Picture: JPEG (based on Exif 2.2 standard)",
    "attr35mmequivalentfocallength": "29.8 - 357.6 mm",
    "recordingmodes": "PS Mode: 1920x1080 59.94p (25 Mbps average; 28 Mbps max) PH Mode: 1920x1080 59.94i/29.97p/23.98p (21 Mbps average; 24 Mbps max) HA Mode: 1920x1080 59.94i (17 Mbps average) HE Mode: 1440x1080 59.94i (6 Mbps average) PM Mode: 1280x720 59.94p (8 Mbps average) SA Mode: 720x480 59.94i (9 Mbps average) CS Mode: 720x480 59.94i (3.5 Mbps average)",
    "maximumrecordingtime": "With two 64GB SDXC memory cards: PS Mode: Approx. 10 hours 40 minutes PH Mode: Approx. 12 hours HA Mode: Approx. 16 hours HE Mode: Approx. 48 hours PM Mode: Approx. 38 hours SA Mode: Approx. 33 hours CS Mode: Approx. 82 hours",
    "focallength": "2.84 - 34.1 mm",
    "aperture": "f/1.5 to f/2.8",
    "brand": "Panasonic",
    "attr1star": "2 stars3 stars4 stars5 stars",
    "specifications": "Sensor Sensor Type 3x MOS (with backside illumination) Sensor Size 1/4.7\" Sensor Resolution 2.19 MP (2,190,00 effective pixels) each Minimum Illumination Approx. 3 lux (iA mode, auto slow shutter ON) Lens Focal Length 2.84 - 34.1 mm 35mm Equivalent Focal Length 29.8 - 357.6 mm Zoom Ratio 12x optical 25x i.Zoom 2x, 5x, 10x digital zoom Aperture f/1.5 to f/2.8 Optical Image Stabilization 5-Axis Hybrid OIS Lens Coating Nano Surface Coating Control Rings 3 (focus, zoom, iris) Filter Thread 49 mm Image Stabilization Optical (hybrid optical image stabilizer, active mode) Recording Specifications Signal System NTSC (60 Hz) Video Format AVCHD version 2.0 compliant, AVCHD Progressive Compression Video: MPEG-4 AVC/H.264 Audio: Dolby Digital (5.1ch/2 ch) Still Picture: JPEG (based on Exif 2.2 standard) Recording Modes PS Mode: 1920x1080 59.94p (25 Mbps average; 28 Mbps max) PH Mode: 1920x1080 59.94i/29.97p/23.98p (21 Mbps average; 24 Mbps max) HA Mode: 1920x1080 59.94i (17 Mbps average) HE Mode: 1440x1080 59.94i (6 Mbps average) PM Mode: 1280x720 59.94p (8 Mbps average) SA Mode: 720x480 59.94i (9 Mbps average) CS Mode: 720x480 59.94i (3.5 Mbps average) Maximum Recording Time With two 64GB SDXC memory cards: PS Mode: Approx. 10 hours 40 minutes PH Mode: Approx. 12 hours HA Mode: Approx. 16 hours HE Mode: Approx. 48 hours PM Mode: Approx. 38 hours SA Mode: Approx. 33 hours CS Mode: Approx. 82 hours Shutter Speed 60i/60p/30p: 1/30 to 1/2000 (auto slow shutter ON), 1/60 to 1/2000 (auto slow shutter OFF) Note: at motion picture recording, manual mode Audio Channels CH1, CH2 Audio Format Dolby Digital Still Capture 3 MP still photographs (can be captured during video recording) Interface Recording Media 2 x SD/SDHC/SDXC (compatible with UHS-I Speed Class 1) Input/Outputs 1 x HDMI output (1080p/1080i/480p) 1 x AV Multi output (D-connector, component video, composite video and audio 2 channel) 1 x USB 2.0 1 x 2.5mm remote terminal for zoom and REC START/STOP 1 x 3.5mm remote terminal for iris and focus 2 x XLR audio input (MIC/LINE/+48V selectable) General Specifications LCD Monitor 3.5\" (8.8 cm) touchscreen 1,152 K dot resolution 270\u00b0 rotation Viewfinder 0.24\" LCOS color EVF with 263 K dot resolution Supply Voltage DC 12V (when the AC adaptor is used) DC 7.2V (when the battery is used) Power Consumption 12.9 W Operating Temperature 32 to 104\u00b0 F (0 ~ 40\u00b0 C) Operating Humidity 10 to 80% (no condensation) Dimensions 6.31 x 7.69 x 13.06\" (160 x 195 x 350 mm) Weight Main Unit Only: Approx. 3.3 lb (1.50 kg) With Battery and an SD Card: Approx. 3.9 lb (1.78 kg)",
    "minimumillumination": "Approx. 3 lux (iA mode, auto slow shutter ON)",
    "miscellaneous": "No",
    "filterthread": "49 mm",
    "includes": "Panasonic AG-AC90A AVCCAM Handheld Camcorder Battery Pack Battery Charger AC Adaptor 2 x AC Cable Eye Cup Remote Control CD-ROM (Operating Instructions) USB Cable AV Multi Cable Lens Cap Shoulder Strap Microphone Holder 2 x Input Terminal Cap Microphone Holder Adaptor Microphone Holder Screws Limited 1-Year Warranty (Extendable to 3 Years with Production Registration)",
    "sensortype": "3x MOS (with backside illumination)",
    "signalsystem": "NTSC (60 Hz)",
    "lcdmonitor": "3.5\" (8.8 cm) touchscreen 1,152 K dot resolution 270\u00b0 rotation",
    "shutterspeed": "60i/60p/30p: 1/30 to 1/2000 (auto slow shutter ON), 1/60 to 1/2000 (auto slow shutter OFF) Note: at motion picture recording, manual mode",
    "dimensions": "6.31 x 7.69 x 13.06\" (160 x 195 x 350 mm)",
    "supplyvoltage": "DC 12V (when the AC adaptor is used) DC 7.2V (when the battery is used)",
    "name": "Panasonic AG-AC90A AVCCAM Handheld Camcorder",
    "operatinghumidity": "10 to 80% (no condensation)",
    "audiochannels": "CH1, CH2",
    "sensorresolution": "2.19 MP (2,190,00 effective pixels) each",
    "viewfinder": "0.24\" LCOS color EVF with 263 K dot resolution"
}