{
    "fnumber": "f/1.8 (wide) to f/2.7 (tele)",
    "weight": "Main body only: Approx. 3.97 lb (1.8 kg)",
    "powerconsumption": "5.0W (recording)",
    "focus": "Auto/manual",
    "effectivepixels": "Motion Image 4:3: 1.02 Mp (tele) to 1.44 Mp (wide) 16:9: 1.36 Mp (tele) to 1.92 Mp (wide) Still Image 3:2: 1.46 Mp (tele) to 2.08 Mp (wide) 16:9: 1.36 Mp (tele) to 1.92 Mp (wide) 4:3: 1.52 Mp (tele) to 2.16 Mp (wide)",
    "illumination": "Standard: 1400 lux Minimum: Approx. 4 lux (1/30 Low Light scene mode); approx. 1 lux (Color Night View)",
    "category": "camera",
    "microphone": "2-channel stereo (with zoom function) 1x 3.5 mm external mic-in jack",
    "compression": "MPEG-4 AVC / H.264",
    "attr35mmequivalentfocallength": "Motion Image: 35.8-716mm (16:9), 43.9-878 (4:3) Still Image: 35.8-716mm (16:9), 35.8-716mm (4:3), 35.8-716mm (3:2)",
    "recordingmodes": "1920 x 1080: HA (approx. 17 Mb/s VBR), HG (approx. 13 Mb/s VBR), HX (approx. 9 Mb/s VBR), HE (approx. 5 Mb/s VBR) 720 x 480: SA (approx. 9 Mb/s VBR), SX (approx. 4.5 Mb/s VBR)",
    "maximumrecordingtime": "HA Mode: Approx. 8 hrs 30 min HG Mode: Approx. 11 hrs HX Mode: Approx. 16 hrs 50 min HE Mode: Approx. 27 hrs 30 min SA Mode: Approx. 16 hrs 30 min SX Mode: Approx. 33 hrs 1",
    "backlightcompensation": "Yes",
    "speaker": "1 round speaker, dynamic type",
    "dimensionswxhxd": "8.5 x 8.9 x 17.1\" (216 x 224 x 432mm)",
    "attr1star": "2 stars3 stars4 stars5 stars",
    "specifications": "Image Device 1/4.1 Type MOS (3.32 Mp) Effective Pixels Motion Image 4:3: 1.02 Mp (tele) to 1.44 Mp (wide) 16:9: 1.36 Mp (tele) to 1.92 Mp (wide) Still Image 3:2: 1.46 Mp (tele) to 2.08 Mp (wide) 16:9: 1.36 Mp (tele) to 1.92 Mp (wide) 4:3: 1.52 Mp (tele) to 2.16 Mp (wide) Illumination Standard: 1400 lux Minimum: Approx. 4 lux (1/30 Low Light scene mode); approx. 1 lux (Color Night View) White Balance Auto / Indoor1 / Indoor2 / Sunny / Cloudy / White settings Shutter Speed Motion Image: (At 60i) 1/60 to 1/8000 sec Still Image: 1/2 to 1/2000 sec Image Stabilizer Hybrid Optical Image Stabilizer (O.I.S.) / O.I.S. Lock Focus Auto/manual Iris Auto/manual Backlight Compensation Yes Lens Panasonic Lens, 2.9-48.7mm (16.8x optical zoom, 23x intelligent zoom) Digital Zoom 50x / 1200x 35mm Equivalent Focal Length Motion Image: 35.8-716mm (16:9), 43.9-878 (4:3) Still Image: 35.8-716mm (16:9), 35.8-716mm (4:3), 35.8-716mm (3:2) F Number f/1.8 (wide) to f/2.7 (tele) LCD Monitor 2.7\" (6.7 cm) widescreen LCD (230,000 pixels) Viewfinder Yes (no specifications provided) Still Mode JPEG (design rule for Camera File system, based on Exif 2.2 standard) Still Picture Resolution Still Picture Only 3:2: 2.8 Mp (2064 x 1376) 16:9: 2.1 Mp (1920 x 1080) 4:3: 2.9 Mp (1952 x 1464); 0.3 Mp (640 x 480) Simultaneous Recording 16:9: 2.1 Mp (1920 x 1080) 4:3: 0.3 Mp (640 x 480) Creating Still Picture from Motion Picture 16:9: 2.1 Mp (1920 x 1080); 0.2 Mp (640 x 360) 4:3: 0.3 Mp (640 x 480) Signal System 1080i60, 480i60 Compression MPEG-4 AVC / H.264 Recording Modes 1920 x 1080: HA (approx. 17 Mb/s VBR), HG (approx. 13 Mb/s VBR), HX (approx. 9 Mb/s VBR), HE (approx. 5 Mb/s VBR) 720 x 480: SA (approx. 9 Mb/s VBR), SX (approx. 4.5 Mb/s VBR) Clip Splitting SD/SDHC/SDXC Memory Card Slot Maximum Recording Time HA Mode: Approx. 8 hrs 30 min HG Mode: Approx. 11 hrs HX Mode: Approx. 16 hrs 50 min HE Mode: Approx. 27 hrs 30 min SA Mode: Approx. 16 hrs 30 min SX Mode: Approx. 33 hrs 1 Audio  Compression Dolby Digital (2-channel) Microphone 2-channel stereo (with zoom function) 1x 3.5 mm external mic-in jack Speaker 1 round speaker, dynamic type LANC No Outputs HDMI USB 2.0 Component connector video output level: Y; 1.0 Vp-p, 75 h/Pb; 0.7 Vp-p, 75 h/Pr; 0.7 Vp-p, 75 h AV connector video output level: 1.0 Vp-p, 75 h, NTSC system AV connector audio output level (Line): 316 mV, 600 h, 2 ch Headphone: 77mV, 32 h (stereo mini jack) Power Requirements 9.3 V DC (when using AC adapter) 7.2 V DC (when using battery) Power Consumption 5.0W (recording) Dimensions (WxHxD) 8.5 x 8.9 x 17.1\" (216 x 224 x 432mm) Weight Main body only: Approx. 3.97 lb (1.8 kg)",
    "outputs": "HDMI USB 2.0 Component connector video output level: Y; 1.0 Vp-p, 75 h/Pb; 0.7 Vp-p, 75 h/Pr; 0.7 Vp-p, 75 h AV connector video output level: 1.0 Vp-p, 75 h, NTSC system AV connector audio output level (Line): 316 mV, 600 h, 2 ch Headphone: 77mV, 32 h (stereo mini jack)",
    "brand": "Panasonic",
    "imagestabilizer": "Hybrid Optical Image Stabilizer (O.I.S.) / O.I.S. Lock",
    "miscellaneous": "No",
    "includes": "Panasonic AG-AC7 Shoulder-Mount AVCHD Camcorder AC Adapter AC Cable DC Cable VW-VBG260 Lithium-Ion Battery Pack AV Cable Component Video Cable USB Cable Shoulder Strap Lens Cap Stylus Pen 1 Year Limited Warranty",
    "lens": "Panasonic Lens, 2.9-48.7mm (16.8x optical zoom, 23x intelligent zoom)",
    "signalsystem": "1080i60, 480i60",
    "lcdmonitor": "2.7\" (6.7 cm) widescreen LCD (230,000 pixels)",
    "shutterspeed": "Motion Image: (At 60i) 1/60 to 1/8000 sec Still Image: 1/2 to 1/2000 sec",
    "powerrequirements": "9.3 V DC (when using AC adapter) 7.2 V DC (when using battery)",
    "iris": "Auto/manual",
    "imagedevice": "1/4.1 Type MOS (3.32 Mp)",
    "lanc": "No",
    "name": "Panasonic AG-AC7 Shoulder-mount AVCHD Camcorder",
    "audiocompression": "Dolby Digital (2-channel)",
    "digitalzoom": "50x / 1200x",
    "viewfinder": "Yes (no specifications provided)",
    "whitebalance": "Auto / Indoor1 / Indoor2 / Sunny / Cloudy / White settings"
}