{
    "videooutput": "6G-SDI (x1) for 10-bit 4:2:2 with choice of Film or Video dynamic range",
    "framerates": "3840 x 2160p: 23.98, 24, 25, 29.97, 30 1920 x 1080p: 23.98, 24, 25, 29.97, 30 1920 x 1080i: 50, 59.94",
    "weight": "3.75 lb (1.7 kg)",
    "battery": "Built-in Battery Life: approx. 90 minutes Battery Charge Time: approx. 2 hours when not in use",
    "powerinput": "11 - 30 VDC port for external battery power or 12V AC adapter",
    "recordingmedia": "Removable 2.5\" SSD Mac OS Extended or exFAT format. SSDs can be formatted on any Mac or use Mediafour MacDrive (not included) on a Windows PC.",
    "builtinspeaker": "Integrated mono speaker",
    "dynamicrange": "12 stops",
    "storagetemperature": "-4 ~ 113\u00b0 F (-20 ~ 45\u00b0 C)",
    "operatingsystem": "Mac OS X 10.8 Mountain Lion or later Windows 7 or later",
    "attr1star": "2 stars3 stars4 stars5 stars",
    "builtinmicrophone": "Integrated mono microphone",
    "dimensions": "6.53 x 4.45 x 4.96\" (166 x 113 x 126 mm)",
    "sensorsize": "21.12 x 11.88mm (Super 35)",
    "recordingformat": "Apple ProRes 422 (HQ) (3840x2160 and 1920x1080) Compressed CinemaDNG RAW (3840x2160 and 1920x1080)",
    "displayresolution": "800 x 480",
    "computerinterface": "Thunderbolt port for capture of HD video and audio (x1) USB 2.0 mini B port for software updates and configuration (x1)",
    "effectiveresolution": "3840 x 2160",
    "relativehumidity": "0 ~ 90% non-condensing",
    "category": "camera",
    "power": "11 - 30 VDC",
    "specifications": "Camera Sensor Size 21.12 x 11.88mm (Super 35) Effective Resolution 3840 x 2160 Dynamic Range 12 stops Lens Mount EF and ZE mount compatible with electronic iris control Recording Recording Media Removable 2.5\" SSD Mac OS Extended or exFAT format. SSDs can be formatted on any Mac or use Mediafour MacDrive (not included) on a Windows PC. Recording Format Apple ProRes 422 (HQ) (3840x2160 and 1920x1080) Compressed CinemaDNG RAW (3840x2160 and 1920x1080) Bit Rate 880 Mbps using Apple ProRes 422 (HQ) Recording Resolution 3840 x 2160 OR 1920 x 1080 Frame Rates 3840 x 2160p: 23.98, 24, 25, 29.97, 30 1920 x 1080p: 23.98, 24, 25, 29.97, 30 1920 x 1080i: 50, 59.94 Display Display Type Integrated LCD capacitive touchscreen Display Size 5\" Display Resolution 800 x 480 Interface Compliance SDI: SMPTE 292M Video Output 6G-SDI (x1) for 10-bit 4:2:2 with choice of Film or Video dynamic range Audio Output SDI: 2 channels, 48 kHz and 24 bit (embedded in 6G-SDI) Analog: 3.5mm stereo headphone jack (x1) Analog Audio Input 1/4\" jacks (x2) for professional balanced analog audio (switchable between mic and line levels) Computer Interface Thunderbolt port for capture of HD video and audio (x1) USB 2.0 mini B port for software updates and configuration (x1) Remote 2.5mm LANC (x1) Power Input 11 - 30 VDC port for external battery power or 12V AC adapter General Built-In Microphone Integrated mono microphone Built-in Speaker Integrated mono speaker Operating System Mac OS X 10.8 Mountain Lion or later Windows 7 or later Power 11 - 30 VDC Battery Built-in Battery Life: approx. 90 minutes Battery Charge Time: approx. 2 hours when not in use Operating Temperature 32 ~ 104\u00b0 F (0 ~ 40\u00b0 C) Storage Temperature -4 ~ 113\u00b0 F (-20 ~ 45\u00b0 C) Relative Humidity 0 ~ 90% non-condensing Dimensions 6.53 x 4.45 x 4.96\" (166 x 113 x 126 mm) Weight 3.75 lb (1.7 kg)",
    "brand": "Blackmagic Design",
    "miscellaneous": "No",
    "includes": "Blackmagic Design Blackmagic Production Camera 4K Sun Shield Camera Strap Turret Dust Cap 12V AC Adapter DaVinci Resolve (software) UltraScope (software) 1-Year Limited Warranty",
    "analogaudioinput": "1/4\" jacks (x2) for professional balanced analog audio (switchable between mic and line levels)",
    "recordingresolution": "3840 x 2160 OR 1920 x 1080",
    "lensmount": "EF and ZE mount compatible with electronic iris control",
    "bitrate": "880 Mbps using Apple ProRes 422 (HQ)",
    "name": "Blackmagic Design Blackmagic Production Camera 4K",
    "audiooutput": "SDI: 2 channels, 48 kHz and 24 bit (embedded in 6G-SDI) Analog: 3.5mm stereo headphone jack (x1)",
    "remote": "2.5mm LANC (x1)",
    "operatingtemperature": "32 ~ 104\u00b0 F (0 ~ 40\u00b0 C)",
    "displaytype": "Integrated LCD capacitive touchscreen",
    "compliance": "SDI: SMPTE 292M",
    "displaysize": "5\""
}