{
    "weight": "16.9 Oz.",
    "flashtype": "Pop-up Flash",
    "height": "3.9 in.",
    "displaytype": "LCD",
    "maxvideoresolution": "1920 x 1080",
    "category": "camera",
    "displayrotation": "Rotating",
    "facedetection": "Yes",
    "lightsensitivitymax": "25600",
    "stillimageformat": "JPEG, NEF (RAW), RAW + JPEG",
    "redeyereduction": "Yes",
    "lensforsd": "Body only",
    "sensorsize": "15.6 x 23.5mm",
    "width": "4.9 in.",
    "mpn": "1519",
    "wirelessimagetransferringprotocols": "IEEE 802.11b, IEEE 802.11g",
    "brand": "Nikon",
    "sensortype": "CMOS",
    "specialeffects": "Color outline, Color sketch, Fisheye, HDR Painting, Landscape, Miniature, Monochrome, Neutral, Perspective Control, Portrait, Silhouette, Toy camera, Vivid",
    "screensize": "3.2\"",
    "digitalvideoformat": "H.264, MOV",
    "wevemadeafewchangestobidding": "Were these helpful?",
    "lightsensitivity": "ISO 100-12800, ISO 25600, ISO auto",
    "batteryformfactor": "Manufacturer specific",
    "cameratype": "Digital SLR",
    "shootingprograms": "Autumn color, Beach/snow, Blossom, Candle, Children, Close-up, Dawn/dusk, Food, Landscape, Night landscape, Night portrait, Party/indoor, Pet portrait, Portrait mode, Sports mode, Sunset",
    "upc": "018208015191",
    "displaysize": "3.2\"",
    "depth": "3 in.",
    "sensorresolution": "24.2 MP",
    "viewfindertype": "Optical",
    "supportedflashmemory": "SD Memory Card, SDHC Memory Card, SDXC Card, SDXC Memory Card",
    "model": "D5300",
    "storecategoriesstorehomelensesbatterychargersfiltersandfilterkitsbatteryandchargerkitsbatterygripscamerasandcamcordersother": "100% FULLY TESTED OPEN BOX SPECIALS IN NEW CONDITION W/ 3 YEAR WARRANTY. PACKAGED IN NON RETAIL WHITE BOX. MONEY BACK GUARANTEE IF NOT SATISFIED. THESE CAMERAS ARE OPEN BOX SPECIALS IN NEW CONDITION AND WERE THOROUGHLY CHECKED AND TESTED BY FACTORY TRAINED TECHNICIANS. WE ARE SO CONFIDENT OF THEM WORKING 100%,THAT WE ARE PROVIDING A 3 YEAR CPS WARRANTY. THEY COME WITH ALL THE ORIGINAL FACTORY ACCESSORIES. WE GIVE PERSONAL ATTENTION TO ALL OUR CLIENTS AND CAN BE REACHED TILL MIDNITE IF YOU HAVE ANY QUESTIONS VIA E-MAIL. CUSTOMER SERVICE IS OUR MAIN PRIORITY! THANK YOU FOR YOUR PATRONAGE.\" Product Information Capture and instantly share the most vibrant, lifelike images of your life. Meet the first in an exciting new generation of Wi-Fi enabled, ultra-high-resolution Nikon HD-SLRs: the D5300. With built-in Wi-Fi for instant photo sharing to your smartphone or tablet, GPS and mapping, a cutting edge 24.2-megapixel image sensor, an extra-large swiveling Vari-angle LCD and more, D5300 brings an outstanding new level of image quality and capabilities in a compact, ergonomic design. Pair it with any NIKKOR lens-like the outstanding AF-S DX NIKKOR 18-140mm f/3.5-5.6G ED VR kit lens-and unleash the full potential of its innovative image sensor. Every photo will be richer, truer to life than most photos you've seen. Every HD video will have a stunning cinematic look, a level of sharpness and clarity that ignites on ultra-high-resolution tablets, laptops and TVs. And the first time you use your smartphone or tablet to instantly share photos from the D5300, you'll realize the game has truly changed. Product Features 24.2-megapixel DX-format CMOS sensor Even the finest details are captured with stunning sharpness. Built-in Wi-Fi Send images directly from the D5300 to a smartphone or tablet for easy sharing. Simply download the free the Wireless Mobile Utility to your smart device. Built-in GPS Geotag your images with precise location information. A great way to get your travel photography ready for sharing! Large vari-angle monitor Add intrigue to your photos and excitement to your movies. Capture shots from unique perspectives using the flexible swivel monitor. High ISO (100 - 12,800, extendable to 25,600 equivalent) Take advantage of great low-light performance to shoot detailed images in dark situations and capture clear shots of fast-moving subjects. EXPEED 4 Enjoy high-speed operation and remarkably clear images with excellent color reproduction, plus enhanced movie recording, thanks to Nikon's fast and powerful image processing engine. D-Movies Record smooth, finely detailed Full HD video clips you'll be proud of (at frame rates up to 50p/60p). Continuous Live View autofocus keeps your subjects sharp, even when the action is fast. Product Highlights Video Product Identifiers Brand Nikon Model D5300 MPN 1519 UPC 018208015191 Key Features Camera Type Digital SLR Sensor Resolution 24.2 MP Screen Size 3.2\" Optical Sensor Sensor Size 15.6 x 23.5mm Sensor Type CMOS Lens System Lens For SD Body only Exposure Light Sensitivity ISO 100-12800, ISO 25600, ISO auto Light Sensitivity Max 25600 Camera Flash Flash Type Pop-up Flash Red Eye Reduction Yes Memory / Storage Supported Flash Memory SD Memory Card, SDHC Memory Card, SDXC Card, SDXC Memory Card Viewfinder Viewfinder Type Optical Dimensions Depth 3 in. Height 3.9 in. Width 4.9 in. Weight 16.9 Oz. Display Display Type LCD Display Rotation Rotating Display Size 3.2\" Battery Battery Form Factor Manufacturer specific File Format Digital Video Format H.264, MOV Still Image Format JPEG, NEF (RAW), RAW + JPEG Resolution Max Video Resolution 1920 x 1080 Other Features Face Detection Yes Miscellaneous Shooting Programs Autumn color, Beach/snow, Blossom, Candle, Children, Close-up, Dawn/dusk, Food, Landscape, Night landscape, Night portrait, Party/indoor, Pet portrait, Portrait mode, Sports mode, Sunset Special Effects Color outline, Color sketch, Fisheye, HDR Painting, Landscape, Miniature, Monochrome, Neutral, Perspective Control, Portrait, Silhouette, Toy camera, Vivid Wireless Image Transferring Protocols IEEE 802.11b, IEEE 802.11g THIS KIT INCLUDES: Nikon D5300 Body Nikon 18-55mm VR Lens Original battery Original battery charger Original instruction disc Original usb cable Original lens cap .43x Wide Angle HD Lens 2.2x Telephoto HD Lens Macro Lens 3pc Filter Kit (UV + CPL + FLD) 50\" Tripod 16gb Memory Card Camera Backpack 5 Piece Starter Kit -5 pc cotton swabs -Cleaning Spray -Cleaning Cloth -3 pc Screen Protectors -Mini Tripod Memory Card Wallet Memory Card Reader Wireless Remote Control Lens Cap Keeper Slave Flash"
}