{
    "dateimprinting": "Date&Time, Date, Off (user selectable)",
    "exposurecontrol": "Program AE, Aperture Priority AE, Shutter Priority AE, Manual Exposure",
    "weight": "0.48 lbs / 0.21 kg",
    "isoequivalent": "Auto, 80, 100, 200, 400, 800, 1600, 3200",
    "totalpixel": "Approx 16.7 MP",
    "exposurecompensation": "\u00b12EV (1/3EV steps)",
    "powersource": "Rechargeable battery: SLB-10A Connector Type: micro USB (5 pin) 155 mins / 310 shots",
    "category": "camera",
    "opticalimagestabilization": "Yes",
    "microphone": "Mono Internal Speaker: Mono",
    "videorecording": "Smart Movie: Landscape, Blue Sky, Natural Green, Sunset Movie Size: 1920x1080(30fp), 1280x720 (30fp), 640x480 (30fps), 240 web 21x optical zoom (Max. recording time: 20min) Voice: Sound Alive, Sound Alive Off Dual Capture (Movie 1080p at 30pfs & Still 2M pixels)",
    "temperature": "32 - 104 deg.F",
    "range": "Normal: 80 cm - Infinity (Wide), 350 cm - Infinity (Tele) Macro: 10 cm - 80 cm (Wide), 150 cm - 350 cm (Tele) Auto Macro: 10 cm - Infinity (Wide), 150 cm - Infinity (Tele) Manual: 10 cm - Infinity (Wide), 150 cm - Infinity (Tele)",
    "speaker": "Mono Internal Speaker: Mono",
    "dimensionswxhxd": "4.47 x 2.56 x 0.98\" / 11.35 x 6.50 x 2.48cm",
    "dcpowerinput": "5.0V",
    "whitebalancemodes": "Auto WB, Daylight, Cloudy, Fluorescent_H, Fluorescent_L, Tungsten, Custom, K",
    "storagefileformat": "Still Image: JPEG (DCF), EXIF 2.21 Movie Clip: MP4 (Video: MPEG4, AVC/H.264, Audio: AAC)",
    "mainlcdscreen": "3\" TFT LCD (C type Touch)",
    "flashrange": "Wide: 0.3m - 4.1m (ISO auto), Tele: 0.5m - 2.9m (ISO auto)",
    "focallength": "4.1-86.1 mm (Equivalent to 23-483 mm in 35mm format)",
    "displaytechnology": "460K dots",
    "wevemadeafewchangestobidding": "Were these helpful?",
    "videoout": "AV: NTSC, PAL (User selectable)",
    "flashrechargingtime": "Approx. 4 sec.",
    "exposuremeteringsystem": "Metering: Multi, Spot, Center-weighted, Face Detection AE Metering Range: EV 1-17 (Wide, ISO Auto), EV 3-17 (Tele, ISO Auto)",
    "storecategoriesstorehomeentertainmentcentertelevisions": "1.888.209.5772 About me Contact Us Shipping Payments FAQ Samsung WB350F Smart Digital Camera, 16.3MP, 21x Optical Zoom, 3\" LCD Display, USB 2.0, Full HD 1080/30p Video, NFC/Wi-Fi/Tag  Go, White SKU: ISGWB350FW Mfr. Part: EC-WB350FBPWUS Item Includes Samsung WB350F Smart Digital Camera - SLB-10A 3.7V 1030mAh Lithium-Ion Battery - - Micro USB Cable - iLauncher PC Software - Samsung 1 Year Parts and Labor Limited Warranty Description The Samsung WB350F Smart Digital Camera (White) is a point-and-shoot with a 16 MP Back Side Illuminated CMOS image sensor and a 3\" HVGA hybrid touch screen. The 21x optical zoom lens gives you a long focal range, from wide angle to telephoto, to cover most shooting situations. It has a 35mm equivalent focal length of 24-432mm with a variable aperture range of f/2.8-5.9. The camera also captures Full HD 1080p video at 30fps. Wi-Fi and NFC connectivity mean that your camera can easily transfer and share files with the Tag & Go feature: simply connect your camera to a smartphone and tap the devices to transfer your files. Features Wi-Fi: NFC and Wi-Fi enabled features like Photo Beam, AutoShare, Remote Viewfinder and Mobile Link let you share images to compatible smartphones right next to you or on the other side of the world. Photo Beam easily sends any photo that you're viewing to a smartphone instantly Wi-Fi Social Sharing: Show off a fabulous selfie with the rest of the world in no time flat. As long as you have a Wi-Fi connection, you can post images and videos directly to Facebook, YouTube, and now Flickr. Tag and add comments, too Autoshare: Save every photo you take with your smartphone. After you set it up, Samsung AutoShare will automatically send every snap instantly to your smartphone or tablet via Wi-Fi that is powered by NFC technology. Using your smartphone, AutoShare also GPS- tags your photos Samsung Link: Effortlessly save every moment you've captured. Samsung Link instantly and wirelessly streams your photos your PC or favorite web storage service such as Dropbox. No more waiting to go home to manually upload images Photo Beam: When a friend wants a copy of that really great shot you took of her, now you can share it right away. Samsung Photo Beam lets you send photos to anybody with just the touch of your camera PC Auto Backup: Wirelessly transfer photos and movies to your PC or Mac. Simply select PC Auto Backup and you're all set. All your photos and videos are wirelessly transferred and safely stored on your computer Mobile Link: Now you can select and send photos or albums directly to a smartphone or tablet with Samsung Mobile Link. No Wi-Fi hotspot is required; the wireless connection is enabled by NFC technology. You don't even have to send the photos as a text message or an email Wi-Fi Group Share: From family brunches to nights out with friends, you can share all of the shots that your friends and family members want with your Samsung Smart Camera. Use Group Share to send images to up to four people simultaneously Wi-Fi Baby Monitor: Download the Home Monitor app from the App Store or Google Play to your smartphone, and place the camera near your baby to watch your sleeping baby from another room. Remote View Finder: Control your camera by using your smartphone as the viewfinder. The NFC-enabled Remote Viewfinder lets you preview photos, adjust camera settings, zoom in and out, and frame each scene-all wirelessly from your phone Smart Mode: A quick tap on the Smart Mode and you're set with various features. Capture perfect trails of light at night on a busy intersection full of red taillights or instantly capture a high-speed scene with Action Freeze Retro Modern Design: Inspired from the simplicity of vintage camera design and built from state-of-the-art innovation, the retro and modern silhouette of the Samsung SMART CAMERA WB350F impresses with elegant, flowing lines and a luxurious, leather-like textured feel 23mm Wide Angle: From up close or far away, preserve the moment exactly how you want to remember it. Capture a spectacular mural that takes up the entire side of a building-or a field of colorful wildflowers that seems to stretch for miles-with the 23mm wide-angle lens. 21x Optical Zoom: When you can't get physically closer to your subject, the 21x optical zoom lets you capture every sharp detail 16.3MP BSI CMOS sensor: There are times you don't want to use a flash, like when you want to capture special moments indoors without disturbing others around you. The 16.3-MP BSI CMOS sensor needs less light than conventional sensors, so you can capture properly exposed images without a flash Full HD Video Recording (1080p /30fps): The WB350F shoots 1920x1080p Full HD video at 30 frames per second with lifelike color and extraordinarily sharp details Dual Capture: Dual Capture lets you snap great photos while shooting Full HD video. Record a soccer game as a keepsake for your child without losing the ability to email a frame-worthy still shot of a goal celebration to other family members. Full Manual Mode: Full Manual (A/S/M) gives you full creative control. Aperture Priority and Shutter Priority settings let you experiment with shutter speeds and depth of field 75.0mm(3.0\") HVGA Hybrid Touch Screen: The Hybrid Touch User Interface offers two options: use the 5-way button to quickly move the cursor up, down, left and right to intuitively navigate the menu and make selections on the 3.0\" (75mm) HVGA screen Specifications Camera Type Wi-Fi Effective Pixel Approx 16.3 MP Total Pixel Approx 16.7 MP Image Sensor Type 1/2.3\"(Approx. 7.77mm) BSI CMOS Optical Zoom 21X Digital Zoom Still Image mode: 1.0X - 5.0X Play mode: 1.0X - 9.4X (depends on image size), Intelli-zoom: 2.0X Focal Length 4.1-86.1 mm (Equivalent to 23-483 mm in 35mm format) F No. 2.8(W) - 5.9(T) Shutter Speed Modes Smart Auto: 1/8 - 1/2,000 sec., Program: 1 - 1/2,000 sec., Night: 8 - 1/2,000 sec., Manual: 16 - 1/2,000 sec. Exposure Compensation \u00b12EV (1/3EV steps) Exposure Control Program AE, Aperture Priority AE, Shutter Priority AE, Manual Exposure ISO Equivalent Auto, 80, 100, 200, 400, 800, 1600, 3200 Exposure Metering System Metering: Multi, Spot, Center-weighted, Face Detection AE Metering Range: EV 1-17 (Wide, ISO Auto), EV 3-17 (Tele, ISO Auto) Focusing Modes TTL Auto Focus (Center AF, Multi AF, Tracking AF, Face Detection AF, Touch AF) Manual Focus Movie CAF Range Normal: 80 cm - Infinity (Wide), 350 cm - Infinity (Tele) Macro: 10 cm - 80 cm (Wide), 150 cm - 350 cm (Tele) Auto Macro: 10 cm - Infinity (Wide), 150 cm - Infinity (Tele) Manual: 10 cm - Infinity (Wide), 150 cm - Infinity (Tele) Main LCD Screen 3\" TFT LCD (C type Touch) Display Technology 460K dots Video Edit Pause during recording and playing, Still Image Capture, Time Trimming Video Picture Effects Smart Filter: Palette Effect 1, Palette Effect 2, Palette Effect 3, Palette Effect 4, Miniature, Vignetting, Sketch, Fish Eye, Classic, Retro Video Recording Smart Movie: Landscape, Blue Sky, Natural Green, Sunset Movie Size: 1920x1080(30fp), 1280x720 (30fp), 640x480 (30fps), 240 web 21x optical zoom (Max. recording time: 20min) Voice: Sound Alive, Sound Alive Off Dual Capture (Movie 1080p at 30pfs & Still 2M pixels) Flash Modes Auto, Auto & Red-eye reduction, Fill-in flash, Slow sync, Flash Off, Red-eye fix Flash Recharging Time Approx. 4 sec. Flash Range Wide: 0.3m - 4.1m (ISO auto), Tele: 0.5m - 2.9m (ISO auto) Optical Image Stabilization Yes White Balance Modes Auto WB, Daylight, Cloudy, Fluorescent_H, Fluorescent_L, Tungsten, Custom, K Storage File Format Still Image: JPEG (DCF), EXIF 2.21 Movie Clip: MP4 (Video: MPEG4, AVC/H.264, Audio: AAC) Storage Image Size 16M: 4608x3456 14MP: 4608x3072 10M: 3648x2736, 12MW: 4608x2592, 5M: 2592x1944, 3M: 1984x1488, 2MW: 1920x1080, 1M: 1024x768 8M: 2832x2832 Storage Internal Memory Approximately 9.5MB Storage External Memory (Optional) MicroSD (up to 2GB guaranteed), MicroSDHC (up to 32GB guaranteed), MicroSDXC (up to 64GB guaranteed) - Class 6 and above recommended Still Image Edit 1 Mode (Dial): 1) Auto 2) Program 3) A/S/M 4) Smart 5) Best Face 6) Magic Plus 7) Settings 8) Wi-Fi Auto: Portrait, Night Portrait, Night, Backlight Portrait, Backlight, Landscape, White, Macro, Macro Text, Tripod, Action, Macro Color, Natural Green, Blue Sky, Sunset, Fireworks, lowlight, spotlight, spotlight macro, spotlight portrait Smart:, Beauty Face, Landscape Still Image Edit 2 Action Freeze, Panorama, Waterfall, Silhouette, Sunset, Fireworks, Light Trace, Low Light Shot, Rich tone, Continuous Shot, Macro Magic Plus: Effect Artist, Color Brush, My Magic Frame, Motion Photo, Photo Filter, Movie Filter, Photo Editor Wi-Fi: MobileLink, Remote Viewfinder, SNS & Cloud, E-mail, Auto Backup, AllShare Play, S/W Upgrade Notifier, AutoShare Drive: Single, Continuous(High, Low), BKT(AE) Self timer: Off, 2 sec., 10 sec. Image Playback Options Single image, Thumbnails, Advanced Slide Show, Movie Clip, Smart Album Date Imprinting Date&Time, Date, Off (user selectable) Microphone Mono Internal Speaker: Mono Speaker Mono Internal Speaker: Mono Wireless Connectivity 1 Wi-Fi Connectivity - MobileLink, Remote Viewfinder, SNS & Cloud, E-mail, Auto Backup, Samsung Link - S/W Upgrade Notifier, AutoShare Samsung Link: Nearby Device, Web Storage SNS & Cloud - Global(0): Facebook, YouTube, Picasa, Dropbox - China(2): Weibo, RenRen, Poco, Dropbox - Hongkong(4): Facebook, YouTube, Picasa, Weibo, RenRen, Poco, Dropbox - Korea(1): Facebook, YouTube, Picasa, KAKAOSTORY, Dropbox - United States(8): Facebook, YouTube, Picasa Wireless Connectivity 2 EVERNOTE, Dropbox - Russia(5): Facebook, YouTube, Picasa, VK, Odnoklassniki, Dropbox - France(9): Facebook, YouTube, Picasa, Orange, Dropbox - United Kingdom(7): Facebook, YouTube, Picasa, Knowhow, Dropbox S/W Upgrade Notifier: Supported in setup menu not Wi-Fi mode, and only for notification RVF: Added function of home monitoring by connection to AP, streaming without saving facebook, weibo, email: Supporting to add comment USB 2.0 Yes Video Out AV: NTSC, PAL (User selectable) DC power input 5.0V Power Source Rechargeable battery: SLB-10A Connector Type: micro USB (5 pin) 155 mins / 310 shots System Requirements: Windows PC with processor better than Intel Core 2 Duo 1.66 GHz / AMD Athlon X2 Dual-Core 2.2 GHz or higher Minimum 512MB RAM (Over 1GB recommended) Windows XP SP2 / Vista / 7/8 250MB of available hard-disk space (Over 1GB recommend) USB 2.0 port nVIDIA Geforce 7600GT or later / Ati X1600 series or later 1024x768 pixels, 16-bit color display compatible monitor (1280x1024, 32-bit color display recommended) Microsoft DirectX 9.0c or later System Requirements: Macintosh Intel Mac or later Mac OS 10.4 or higher Minimum 256MB RAM 110MB of available hard-disk space USB port Humidity 5 - 85 % Temperature 32 - 104 deg.F Dimensions (WxHxD) 4.47 x 2.56 x 0.98\" / 11.35 x 6.50 x 2.48cm Weight 0.48 lbs / 0.21 kg WHO WE ARE Adorama is one of the nation's largest Photographic retail and mail order suppliers. For over 35 years we have been serving professionals as well as amateurs in the photographic, video, digital imaging and telescope fields. We offer the best combination of quality services, vast selection, knowledgeable staff, and competitive pricing. Adorama Camera is your #1 source for the best and newest products in the photographic industry, and the largest inventory of items such as Digital Cameras, Digital Camera Accessories, Memory Cards, 35mm Cameras, Medium Format Cameras, Lenses, Video Cameras, TV's, MP3 Players, Binoculars, Telescopes, Scanners, Inkjet, Dye-Sub & Laser Printers, Office Fax machines, Shredders, Projectors, Inkjet Paper, Photographic Accessories, Filters, Batteries, Cases, Tripods, Flashes, Lighting & Studio Equipment, Film, Darkroom Products and Audio Video Equipment. All new equipment comes with all of the factory included accessories, including a full manufacturer's warranty, unless otherwise noted. We only post items that are in-stock and ready to ship. PAYMENT Paypal is our only method of payment. Your Paypal account must be a Verified US Paypal account. Selecting \"Immediate Pay\" is the way to go. If you select eCheck, it may take 2-8 days to clear Paypal. In an effort to comply with our Authorized Dealer contracts with the manufacturers and to best control our inventory levels we reserve the right to limit quantities or cancel orders to Resellers and Exporters. Please note: Inventory is not reserved until the item is paid for. Please include a phone number as UPS and our Trucking Companies require it. We prefer to ship to a confirmed Paypal address and whether yes or no we may still contact you for additional verification. For shipments in New York and New Jersey, we are required to collect the appropriate sales tax. INTERNATIONAL International taxes and duties: International shipments may be subject to import fees, duties and taxes, which are levied once a shipment reaches the respective country, in addition to the brokerage fees/custom clearance charges which may be imposed by the carrier. These charges must be borne by the recipient. Adorama has no control over these charges and cannot predict what they might be. Orders shipped using eBays (GSP) \"Global Shipping Platform\" have already paid their taxes and must contact eBay directly for any issues. SHIPPING Most purchases are shipped with 24 Business Hours. Adorama's eBay store ships to the 48 Contiguous United States including Military APO & FPO and Puerto Rico. We now ship to Canada, parts of Europe and Australia. We do not ship to other International locations. Items with \"free shipping\" are only shipped free to the 48 contiguous United States. Combined shipping is available by placing all adoramacamera eBay orders BEFORE making the Payment. eBay's new checkout offers you to consolidate your orders to get better shipping rates. All orders must be shipped with a printed invoice included. We can not ship orders without the invoice or a lower value invoice. Gift Invoices can be sent if you call us immediately after payment is made (if during business hours). No guarantees for emails in this matter. Shipment errors due to a bad address entered by the buyer and will not be credited for shipping charges if returned or at all if lost or abandoned by the carrier. We supply tracking information directly to your eBay account as well as via email within 24 hours after the shipment leaves our warehouse. Please make sure that our email messages don't go into spam or junk. Change requests may not be updated on eBay, please check the emails. All TV's over 50 inches or other large items will ship via special Truck Delivery. An appointment will be made by the Trucking Company 24 hours before final delivery. Therefore, you must provide a phone number. Please read this carefully before purchasing any TV from us. All TV's 50 inches or larger will ship via special truck delivery only. An appointment will be made by the Trucking Company 24 hours before final delivery. LCD, LED and Plasma TVs as well as Monitors from 20\" and above can not be returned unless damaged in transit. At time of arrival If your TV arrives by UPS or FedEx: Please inspect the box from the outside for visible damage. If the box is not in perfect condition you should refuse it. Once you sign for it or open the box, you can not claim in-transit damage. If the box looks fine, you can then sign for it & open the box for further inspection after the carrier/driver leaves. You should check your TV ASAP to make sure that it works fine. If there are any problems, please let us know. If your TV arrives by special truck delivery: Please inspect the TV for both, external damage AND make sure that it powers up before you sign for it. If there's any external damage to the box, or it doesn't power on, do not accept it or sign for it. (According to the trucking company rules, you need to test the TV at the closest power outlet to the door. They are not required to wait until you put the TV in its intended place or till you test the cable connections). After the truck leaves, you should further test the TV to make sure everything works perfectly. If there are any problems, please let us know. Damage claims must be reported within 24 hours of receipt. Returns Please click here for our FULL RETURN POLICY For the first 30 days from date of receipt of your purchase you may return the merchandise for a full money back refund, excluding any shipping charges (for items which we offer free shipping, our standard shipping charges will be deducted from any refund or credit). Returned or exchanged products must be in brand-new, mint condition. Items must be in the original, undamaged manufacturer's packaging with all packaging materials, including instruction booklets, packing inserts, and the blank warranty cards. Memory cards and any other Blister Pack items are not returnable once opened. Any merchandise missing the original Universal Product Code (UPC) cannot be returned. The manufacturer's labeled packaging must be enclosed within an additional shipping carton. Please do not place stickers or shipping labels on the original manufacturer's package. Printers, Desktop Computers, Laptops, Tablets & Notebooks are not returnable once they are booted up or the toner is installed, as per the manufacturers contracts, all service to be done through them directly. Please ship your parcel back to Adorama freight prepaid and Insured. Sorry, Adorama cannot accept COD or freight-collect shipments. Return shipping cost (the cost to send an item back to our store) is not reimbursable. Please enclose a copy of your invoice with your return and tell us whether you would like the item to be replaced, exchanged, or refunded. Returns can take up to 8 days in-house from the date we receive it to process. When returning an item, please make sure you use a shipper which provides you with Insurance and a tracking number. Items returned without a tracking number might take much longer to be processed. We do not require a RMA. Returns should be shipped to: ACC Order processing 7 Slater Drive Elizabeth, NJ 07206 If you live in New York you may bring the return to our Manhattan store for exchange or refund. Warranty Information Most products have the warranty length listed in the description. To obtain a free copy of the manufacturers warranty details for any product we carry, please write to us and be sure to include the Brand Name and Model Number. Adorama Camera, Inc. Warranty Requests 42 West 18th Street New York, NY 10011 Contact Us Got a question? click here Product Information: 800-223-2500 Customer Service: 888-209-5772 HOURS OF OPERATION Mon-Thurs: 9:00am - 5:00pm Friday: 9:00am - 12:00pm On Sep-29-14 at 05:48:45 PDT, seller added the following information: Protect It Now with a Consumer Priority Service Extended Warranty",
    "imagesensortype": "1/2.3\"(Approx. 7.77mm) BSI CMOS",
    "cameratype": "Wi-Fi",
    "effectivepixel": "Approx 16.3 MP",
    "opticalzoom": "21X",
    "humidity": "5 - 85 %",
    "flashmodes": "Auto, Auto & Red-eye reduction, Fill-in flash, Slow sync, Flash Off, Red-eye fix",
    "digitalzoom": "Still Image mode: 1.0X - 5.0X Play mode: 1.0X - 9.4X (depends on image size), Intelli-zoom: 2.0X",
    "usb20": "Yes",
    "fno": "2.8(W) - 5.9(T)",
    "focusingmodes": "TTL Auto Focus (Center AF, Multi AF, Tracking AF, Face Detection AF, Touch AF) Manual Focus Movie CAF"
}