{
    "warranty": "12 Months",
    "exposurecontrol": "-2.0EV~+2.0EV",
    "exposuremode": "Auto and Manual",
    "pcinterface": "Mini USB. Movable HDD and PC camera drive mode",
    "externalmemory": "SD Card (up to 32 GB)",
    "mainfeatures": "100% brand new and high quality digital camera 2.7\" TFT LCD display With 5.0 Megapixel and 8X digital zoom Exterior SD/SDHC card up to 32GB (not included) Light weight, exquisite size and fashionable design",
    "category": "camera",
    "continuousshooting": "3 photos",
    "operationsystem": "Windows XP/Vista/7",
    "selftimer": "10 seconds",
    "imageresolution": "5.0 Mega pixels",
    "specifications": "Model: DC-660 Image sensor: 14Mega Pixel /1/2.5''COMS sensor Image Resolution: 5.0 Mega pixels Video resolution: 2560*1920, 2048*1536, 1280*960, 640*480 LCD Display: 2.7'' TFT Interpolation: 4320*3240, 3456*2592 Files Format: Photo: JPEG (EMIF2.1 version), Flash: AVI /MotionJpeg640*480, Audio: WAV Photo mode: Standard; Black & White; Vintage Digital Zoom: 8*Digital Zoom Operation System: Windows XP/Vista/7 Focus Range: 1.2(Normal)200mm~1.2m(Micro) Exposure Mode: Auto and Manual Exposure Control: -2.0EV~+2.0EV PC Interface: Mini USB. Movable HDD and PC camera drive mode Flash Light: Built-in wide-angle flashlight, Auto/Force/No Flash mode; Best distance for Flash: about 2m White Balance: Auto/Daylight/Cloudy/Incandescent/Fluorescent Continuous Shooting: 3 photos Self-timer: 10 seconds Others: Anti-shake, Face detection, PC Camera, USB download External memory: SD Card (up to 32 GB)",
    "focusrange": "1.2(Normal)200mm~1.2m(Micro)",
    "others": "Anti-shake, Face detection, PC Camera, USB download",
    "imagesensor": "14Mega Pixel /1/2.5''COMS sensor",
    "digitalzoom": "8*Digital Zoom",
    "packagecontents": "1 x Digital camera 1 x USB cable 1 x Lithium-ion battery 1 x Battery charger 1 x CD disk 1 x User manual",
    "model": "DC-660",
    "lcddisplay": "2.7'' TFT",
    "videoresolution": "2560*1920, 2048*1536, 1280*960, 640*480",
    "whitebalance": "Auto/Daylight/Cloudy/Incandescent/Fluorescent"
}