{
    "color": "Red/ Pink/ Yellow/ Green/ Blue",
    "focus": "30cm to infinity",
    "mainfeatures": "Superb performance in a compact, elegant and stylish body With 3MP, great for travel or everyday shooting Press the button to capture wonderful moments of your life Strong low-light shooting capability for natural shots",
    "category": "camera",
    "autopoweroff": "30 Seconds",
    "capacity": "5 pictures with 2.0Mega / 26pictures with 0.3Mega / 17S with QVGA movie",
    "usb": "USB1.1",
    "selftimer": "10 Seconds",
    "photoformat": "JPEG",
    "type": "TFT LCD(480*240)",
    "power": "AAA x 1 / DC5V Via USB(Only Mass storage Mode)",
    "specifications": "Max. Resolution: 2.0Mega (Interpolation) Image Sensor: 0.3Mega CMOS Sensor Video Clip: 320 x 240@15fps Video Resolution (Camcorder): 3 Shots Self Timer: 10 Seconds Shutter Speed: Auto Auto Shooting: 2sec./10sec./Off White Balance: Auto Setting: Auto, Skin, Night, Backlight Exposure: Auto Internal Memory: 8MB SD RAM (Data will lost when power over) Photo Format: JPEG Auto Power Off: 30 Seconds Movie Format: AVI Type: TFT LCD(480*240) Capacity: 5 pictures with 2.0Mega / 26pictures with 0.3Mega / 17S with QVGA movie Focus: 30cm to infinity USB: USB1.1 Power: AAA x 1 / DC5V Via USB(Only Mass storage Mode) Compatibility: Win98//2000/XP/ME/ Mac 9.1 and above Dimension: 80 x 50 x 20(mm) Color: Red/ Pink/ Yellow/ Green/ Blue",
    "videoclip": "320 x 240@15fps",
    "internalmemory": "8MB SD RAM (Data will lost when power over)",
    "movieformat": "AVI",
    "maxresolution": "2.0Mega (Interpolation)",
    "shutterspeed": "Auto",
    "compatibility": "Win98//2000/XP/ME/ Mac 9.1 and above",
    "exposure": "Auto",
    "imagesensor": "0.3Mega CMOS Sensor",
    "dimension": "80 x 50 x 20(mm)",
    "packagecontents": "1 x Camera 1 x USB Cable 1 x Manual",
    "whitebalance": "Auto"
}