{
    "warranty": "12 Months",
    "exposurecontrol": "Exposure Value (+3, +2, +1, 0, -1, -2, -3)",
    "color": "Pink, Grey, Blue",
    "sensitivity": "Auto, 100, 200, 400",
    "flashmode": "Auto, Forced, Anti-red-eye, Off",
    "mainfeatures": "2.7-inch TFT LCD color screen With 1/2.5\" CMOS sensor 8x digital zoom Support smile capture Support video recording Support shooting under Black and White, Invert or Emboss special modes Built-in flash light Multi OSD languages options",
    "operatingsystem": "WIN98/2000/ME/XP",
    "category": "camera",
    "osdlanguage": "English, Simplified Chinese, Traditional Chinese, French, German, Spanish, Russian, Italian, Portuguese, Japanese etc.",
    "memory": "External 1~32GB",
    "aperture": "F = 2.8",
    "power": "3.7v lithium battery",
    "specifications": "Color: Pink, Grey, Blue Effectual Resolution: 12.0 Mega pixels Digital Sensor: 1/2.5\" CMOS Picture Resolution: 4000 x 3000, 3648 x 2736, 3456 x 2592, 3264 x 2448, 3072 x 2304, 2592 x 1944, 2048 x 1536, 1600 x 1200, 1280 x 960, 640 x 480 Memory: External 1~32GB Picture format: JPEG, AVI Photo Shooting Mode: Single Shot, Continuous, Self-timer (2s, 5s, 10s) Shutter Speed: Electronic Shutter 1 / 2 ~ 1 / 2, 000s Zoom: 8x Digital Zoom White Balance: Automatic, Sunny, Cloudy, Tungsten, Fluorescent, Flash off Exposure Control: Exposure Value (+3, +2, +1, 0, -1, -2, -3) Flash Mode: Auto, Forced, Anti-red-eye, Off Sensitivity: Auto, 100, 200, 400 Data Transfer: USB 2.0 Power: 3.7v lithium battery Focal Lens: F = 6.0mm Aperture: F = 2.8 Automatic Shutdown: 1-.Min OSD Language: English, Simplified Chinese, Traditional Chinese, French, German, Spanish, Russian, Italian, Portuguese, Japanese etc. Operating System: WIN98/2000/ME/XP",
    "pictureresolution": "4000 x 3000, 3648 x 2736, 3456 x 2592, 3264 x 2448, 3072 x 2304, 2592 x 1944, 2048 x 1536, 1600 x 1200, 1280 x 960, 640 x 480",
    "pictureformat": "JPEG, AVI",
    "shutterspeed": "Electronic Shutter 1 / 2 ~ 1 / 2, 000s",
    "datatransfer": "USB 2.0",
    "zoom": "8x Digital Zoom",
    "packagecontents": "1 x 12.0MP 2.7-inch Digital Camera 1 x USB cable 1 x Bag 1 x Wrist Strap 1 x Rechargeable Li-battery 1 x Drive Disc 1 x User Manual",
    "whitebalance": "Automatic, Sunny, Cloudy, Tungsten, Fluorescent, Flash off"
}