{
    "category": "camera",
    "publisher": "Vivitar",
    "dimensions": "6.0 x 3.0 x 9.0 centimetres (0.42 kg)",
    "shareaddtowishlist": "\u00bb Home \u00bb Electronics \u00bb Camera & Photo \u00bb Digital Cameras Point & Shoot Digital Cameras Vivitar Vivicam X035 http://www.fishpond.co.uk/Electronics/Vivitar-Vivicam-X035/9999254913552 10 MP,2.2 -inch LCD By Vivitar Free Shipping Worldwide This item is unavailable. Email Me We will email you if this item comes back into\u00a0stock. Rating: 1 2 3 4 5 Register or sign-in to rate and get recommendations. Other Information: Vivicam X035 Product Description: The VX035 digital camera from Vivitar is compact and easy to use. This 10.2-megapixel cancer has a 4x digital zoom and saves pictures on an SD memory card. It integrates a flash and functions on 3 AAA batteries (batteries not included). Publisher: Vivitar Dimensions: 6.0 x 3.0 x 9.0 centimetres (0.42 kg)",
    "rating": "1 2 3 4 5 Register or sign-in to rate and get recommendations.",
    "otherinformation": "Vivicam X035"
}