{
    "shutter": "Type: Electronic Speed: 30 - 1/16000\u00a0sec",
    "externalflashconnection": "None",
    "imagestabilization": "Yes",
    "weight": "4.1 oz (116 g)",
    "maxsyncspeed": "Electronic Shutter: 1 / 60 sec",
    "battery": "1x EN-EL20\u00a0 Rechargeable Lithium-Ion Battery Pack",
    "isosensitivity": "Auto, 160-6400",
    "memorycardtype": "SD SDHC SDXC",
    "diaphragmblades": "7",
    "acpoweradapter": "EH-5b AC Adapter (Optional)",
    "incameraimageediting": "Color Balance, D-Lighting, Miniature Effect, Soft Focus",
    "aspectratio": "3:2, 16:9",
    "attr1star": "2 stars3 stars4 stars5 stars",
    "datetimestamp": "Yes",
    "bitdepth": "12-bit",
    "dimensions": "No",
    "liveview": "Yes",
    "autofocuspoints": "135",
    "dimensionsdxl": "Approx. 2.3 x 1.7\" (5.84 x 4.32 cm)",
    "pixels": "Actual: 15.1 Megapixel Effective: 14.2 Megapixel",
    "selftimer": "2 sec, 5 sec, 10 sec",
    "focallength": "10 - 30 mm Comparable 35mm Focal Length: 27 - 81 mm",
    "flashmodes": "Auto Auto/Red-eye Reduction Fill-in Off Red-eye Reduction Second-curtain Sync Slow Sync./Red-eye Reduction",
    "aperture": "Maximum: f/3.5 - 5.6 Minimum: f/16 - 16",
    "dimensionswxhxd": "4.0 x 2.4 x 1.1\"\u00a0/\u00a0101.0 x 60.5 x 28.8 mm",
    "autofocus": "Yes",
    "continuousshooting": "Up to 15 fps",
    "meteringmethod": "3D Color Matrix Metering, Center-weighted average     metering, Spot metering",
    "audiorecording": "With Video, Stereo",
    "whitebalancemodes": "Auto, Cloudy, Daylight, Flash, Fluorescent (Day White),     Incandescent, Preset Manual, Shade, Underwater",
    "dustreductionsystem": "Yes",
    "category": "camera",
    "specifications": "imaging Lens Mount Nikon 1 Mount Camera Format Nikon CX (2.7x Crop Factor) Pixels Actual: 15.1 Megapixel Effective: 14.2 Megapixel Max Resolution 4608 x 3072 @ 3:2 Other Resolutions 3456 x 2304 @ 3:2 2304 x 1536 @ 3:2 4800 x 920 1536 x 4800 9600 x 920 1536 x 9600 1280 x 856 @ 3:2 4608 x 2592 @ 16:9 Sensor Type / Size CMOS, 13.2 x 8.8 mm File Formats Still Images: JPEG, RAW Movies: MPEG-4 AVC/H.264, MOV Audio: AAC Bit Depth 12-bit Dust Reduction System Yes Memory Card Type SD SDHC SDXC A/V Recording Video Recording Yes, NTSC Resolution 1920 x 1080: 60 fps, 30 fps 1280 x 720: 60 fps, 30 fps 640 x 240: 400 fps 320 x 120: 1200 fps Aspect Ratio 3:2, 16:9 Audio Recording With Video, Stereo Focus Control Focus Type Auto & Manual Focus Mode Single-servo AF (S), Continuous-servo AF (C), Manual     Focus (M) , Focus Lock AF Area Mode Autofocus Points 135 Viewfinder/Display Viewfinder Type LCD Display Display Screen 3\"\u00a0Rear Screen\u00a0\u00a0Live Preview\u00a0LCD (921,000) Live View Yes Exposure Control ISO Sensitivity Auto, 160-6400 Shutter Type: Electronic Speed: 30 - 1/16000\u00a0sec Metering Method 3D Color Matrix Metering, Center-weighted average     metering, Spot metering Exposure Modes Modes: Aperture Priority, Auto, Manual, Programmed Auto,     Shutter Priority Compensation: -3 EV to +3 EV (in 1/3 EV steps) White Balance Modes Auto, Cloudy, Daylight, Flash, Fluorescent (Day White),     Incandescent, Preset Manual, Shade, Underwater Burst Rate Up to 15 fps at 14.2 MP Flash Flash Modes Auto Auto/Red-eye Reduction Fill-in Off Red-eye Reduction Second-curtain Sync Slow Sync./Red-eye Reduction Built-in Flash Yes Guide No. 16'\u00a0(4.88 m)\u00a0ISO100 20.7'\u00a0(6.31 m)\u00a0ISO160 Max Sync Speed Electronic Shutter: 1 / 60 sec Flash Compensation -3 EV to +1 EV (in 1/3 EV steps) Dedicated Flash System iTTL External Flash Connection None Performance In-Camera Image Editing Color Balance, D-Lighting, Miniature Effect, Soft Focus Continuous Shooting Up to 15 fps Self Timer 2 sec, 5 sec, 10 sec Date & Time Stamp Yes Connectivity HDMI C (Mini), USB 2.0 Wi-Fi Capable Yes Power Battery 1x EN-EL20\u00a0 Rechargeable Lithium-Ion Battery Pack AC Power Adapter EH-5b AC Adapter (Optional) Physical Dimensions (WxHxD) 4.0 x 2.4 x 1.1\"\u00a0/\u00a0101.0 x 60.5 x 28.8 mm Weight 7.1 oz\u00a0/\u00a0201\u00a0 g body only Kit Lens Focal Length 10 - 30 mm Comparable 35mm Focal Length: 27 - 81 mm Aperture Maximum: f/3.5 - 5.6 Minimum: f/16 - 16 Angle of View 77\u00b0 - 29\u00b0 Minimum Focus Distance .66'\u00a0(20 cm) Groups/Elements 9/12 Diaphragm Blades 7 Autofocus Yes Image Stabilization Yes Filter Thread Front: 40.5 mm Dimensions (DxL) Approx. 2.3 x 1.7\" (5.84 x 4.32 cm) Weight 4.1 oz (116 g)",
    "flashcompensation": "-3 EV to +1 EV (in 1/3 EV steps)",
    "freeshipping": "Yes",
    "brand": "Nikon",
    "sensortypesize": "CMOS, 13.2 x 8.8 mm",
    "filterthread": "Front: 40.5 mm",
    "connectivity": "HDMI C (Mini), USB 2.0",
    "cameraformat": "Nikon CX (2.7x Crop Factor)",
    "groupselements": "9/12",
    "angleofview": "77\u00b0 - 29\u00b0",
    "focustype": "Auto & Manual",
    "included": "Nikon 1 J3 Mirrorless Digital Camera (Black) 1 NIKKOR 10-30mm f/3.5-5.6 VR Lens UC-E15 USB Cable for Nikon 1 AN-N1000 Neck Strap for Nikon 1 J1 / V1 Digital Camera (Silver) BF-N1000 Body Cap for Nikon 1 Cameras LC-N40.5 Front Lens Cap for 1 Nikkor Lenses LF-N1000 Rear Lens Cap EN-EL20 Rechargeable Li-ion Battery (1020mAh) MH-27 Battery Charger ViewNX 2 Software Short Movie Creator Software User's Manual Reference Manual CD Limited 1-Year Warranty",
    "videorecording": "Yes, NTSC",
    "lensmount": "Nikon 1 Mount",
    "displayscreen": "3\"\u00a0Rear Screen\u00a0\u00a0Live Preview\u00a0LCD (921,000)",
    "fileformats": "Still Images: JPEG, RAW Movies: MPEG-4 AVC/H.264, MOV Audio: AAC",
    "condition": "New",
    "burstrate": "Up to 15 fps at 14.2 MP",
    "otherresolutions": "3456 x 2304 @ 3:2 2304 x 1536 @ 3:2 4800 x 920 1536 x 4800 9600 x 920 1536 x 9600 1280 x 856 @ 3:2 4608 x 2592 @ 16:9",
    "builtinflash": "Yes",
    "exposuremodes": "Modes: Aperture Priority, Auto, Manual, Programmed Auto,     Shutter Priority Compensation: -3 EV to +3 EV (in 1/3 EV steps)",
    "opticalzoom": "Interchangable Lens",
    "focusmode": "Single-servo AF (S), Continuous-servo AF (C), Manual     Focus (M) , Focus Lock AF Area Mode",
    "minimumfocusdistance": ".66'\u00a0(20 cm)",
    "viewfindertype": "LCD Display",
    "dedicatedflashsystem": "iTTL",
    "maxresolution": "4608 x 3072 @ 3:2",
    "guideno": "16'\u00a0(4.88 m)\u00a0ISO100 20.7'\u00a0(6.31 m)\u00a0ISO160",
    "resolution": "1920 x 1080: 60 fps, 30 fps 1280 x 720: 60 fps, 30 fps 640 x 240: 400 fps 320 x 120: 1200 fps",
    "wificapable": "Yes"
}