{
    "itemid": "RIDT",
    "features": "No",
    "weight": "3.35 oz\u00a0/\u00a095.0 g",
    "battery": "1x Built-in\u00a0Rechargeable Lithium-Ion Battery Pack",
    "isosensitivity": "100-1600",
    "stillimagespergb": "JPEG : 300",
    "attr1star": "2 stars3 stars4 stars5 stars",
    "operatingstoragetemperature": "Operating 32 to 104\u00b0F (0 to 40\u00b0C) Humidity: 0 - 90% Storage -4 to 140\u00b0F (-20 to 60\u00b0C)",
    "freeshipping": "Yes",
    "builtinmemory": "4GB",
    "dimensionswxhxd": "1.7 x 5.1 x 0.9\"\u00a0/\u00a042.0 x 129.0 x 22.8 mm",
    "softwaresystemrequirements": "Windows: 7 (SP1), 8 Mac: OS X 10.6, 10.7, 10.8",
    "category": "camera",
    "specifications": "Imaging Image Stabilization None Optics Filter Thread None Zoom None Focus Range Auto: 3.93\" (9.98 cm) - Infinity Exposure Control ISO Sensitivity 100-1600 Shutter 1/7.5 - 1/8000\u00a0seconds Exposure Modes Modes: Auto Compensation: -2 EV to +2 EV (in 1/3 EV steps) White Balance Modes Auto Remote Control iPhone (Optional) Memory Built-in Memory 4GB Still Images per GB JPEG : 300 Connectivity/System Requirements Connectivity 1x Micro-USB, USB 2.0 Wi-Fi Yes built-in Software System Requirements Windows: 7 (SP1), 8 Mac: OS X 10.6, 10.7, 10.8 Environmental Operating/Storage Temperature Operating 32 to 104\u00b0F (0 to 40\u00b0C) Humidity: 0 - 90% Storage -4 to 140\u00b0F (-20 to 60\u00b0C) Waterproofing None Power Battery 1x Built-in\u00a0Rechargeable Lithium-Ion Battery Pack AC Power Adapter None Physical Dimensions (WxHxD) 1.7 x 5.1 x 0.9\"\u00a0/\u00a042.0 x 129.0 x 22.8 mm Weight 3.35 oz\u00a0/\u00a095.0 g",
    "brand": "Ricoh",
    "filterthread": "None",
    "connectivity": "1x Micro-USB, USB 2.0",
    "focusrange": "Auto: 3.93\" (9.98 cm) - Infinity",
    "included": "Ricoh THETA Spherical 360 Degree Panorama Built-In WiFi Digital Camera, Lightweight: 3.3 oz, Wireless Sharing USB Cable Carrying Pouch Limited 1-Year Warranty",
    "condition": "New",
    "imagestabilization": "None",
    "remotecontrol": "iPhone (Optional)",
    "waterproofing": "None",
    "acpoweradapter": "None",
    "wifi": "Yes built-in",
    "exposuremodes": "Modes: Auto Compensation: -2 EV to +2 EV (in 1/3 EV steps)",
    "zoom": "None",
    "shutter": "1/7.5 - 1/8000\u00a0seconds",
    "whitebalancemodes": "Auto"
}