{
    "itemid": "NIDD5200B",
    "externalflashconnection": "Hot Shoe",
    "freeshipping": "Yes",
    "exposurecontrol": "Auto:\u00a0Shutter Speed, Aperture, ISO Manual:\u00a0Shutter Speed, ISO",
    "weight": "1.22 lb\u00a0/\u00a0555 g",
    "maxsyncspeed": "Electronic Shutter: 1 / 200 sec",
    "battery": "1x EN-EL14\u00a0 Rechargeable Lithium-Ion Battery           Pack, 7.4VDC, 1030mAh",
    "framerate": "@ 1920 x 1080: 60 fps, 30 fps, 24 fps @ 1920 x 1080: 50 fps, 25 fps @ 1280 x 720: 60 fps, 50 fps @ 640 x 424: 30 fps, 25 fps",
    "isosensitivity": "Auto, 200 - 6400",
    "noisereduction": "Yes",
    "focus": "Auto Manual Continuous Auto",
    "memorycardtype": "SD SDHC SDXC",
    "shutter": "Type: Charge-coupled Electronic Speed: 30 - 1/4000\u00a0sec",
    "lensmount": "Nikon F",
    "viewfindercoverage": "95%",
    "attr1star": "2 stars3 stars4 stars5 stars",
    "datetimestamp": "Yes",
    "videorecording": "Yes, NTSC/PAL",
    "operatingstoragetemperature": "Operating 32 to 104 \u00b0F (0 to 40 \u00b0C) Humidity: 0 - 85%",
    "brand": "Nikon",
    "pixels": "Actual: 24.71 Megapixel Effective: 24.1 Megapixel",
    "selftimer": "2 sec, 5 sec, 10 sec, 20 sec Number of Shots: 1-9",
    "liveview": "Yes",
    "features": "No",
    "filesize": "1920 x 1080i\u00a0(Full HD) 1920 x 1080p\u00a0(Full HD) 1280 x 720p\u00a0(HD) 640 x 424p\u00a0(SD)",
    "focustype": "Auto & Manual",
    "continuousshooting": "Up to 5 fps",
    "meteringmethod": "3D Color Matrix Metering, Center-weighted           average metering, Spot metering",
    "audiorecording": "With Video, Stereo, Via Optional External Mic",
    "whitebalancemodes": "Auto, Cloudy, Custom, Daylight, Flash,           Fluorescent, Incandescent, Preset Manual, Shade",
    "category": "camera",
    "viewfindermagnification": "Approx. 0.78x",
    "specifications": "New Page 2 New Page 1 New Page 1 New Page 1 New Page 1 New Page 1 New Page 1 Imaging Camera Type Digital SLR with Interchangeable lenses Lens Mount Nikon F Camera Format DX / (1.5x Crop Factor) Pixels Actual: 24.71 Megapixel Effective: 24.1 Megapixel Max Resolution 6000 x 4000 Other            Resolutions 4496 x 3000 2992 x 2000 Aspect Ratio 3:2 Sensor Type /            Size CMOS, 23.5 x 15.6 mm File Formats Still Images: JPEG,           RAW Movies: MPEG-4           AVC/H.264, MOV Audio: Linear           PCM Bit Depth 14-bit Noise Reduction Yes Memory Card Type SD SDHC SDXC Focus Control Focus Type Auto & Manual Focus Mode Single-servo AF (S), Continuous-servo AF (C),           Manual Focus (M) , Focus Lock AF Area Mode Autofocus Points 39 Viewfinder/Display Viewfinder Type Pentamirror Viewfinder            Coverage 95% Viewfinder            Magnification Approx. 0.78x Diopter            Adjustment - 1.7 to +0.7 m Display Screen 3\"\u00a0Rear Screen\u00a0Swivel\u00a0\u00a0LCD (921000) Screen Coverage 100% Angle of View 170\u00b0 Live View Yes Exposure            Control ISO Sensitivity Auto, 100-6400 (Extended Mode: 100-25600) Shutter Type: Charge-coupled Electronic Speed: 30 - 1/4000\u00a0sec Remote Control ML-L3 (Optional) Metering Method 3D Color Matrix Metering, Center-weighted           average metering, Spot metering Exposure Modes Modes: Aperture Priority, Auto, Flash Off,           Manual, Program, Shutter Priority Compensation: -5 EV to +5 EV (in 0.3, 0.33 or           0.5 EV steps) White Balance            Modes Auto, Cloudy, Custom, Daylight, Flash,           Fluorescent, Incandescent, Preset Manual, Shade Flash Flash Modes Auto Auto/Red-eye Reduction Fill-in Off Red-eye Reduction Second-curtain Sync Slow Sync Slow Sync./Red-eye Reduction Built-in Flash Yes Guide No. 39'\u00a0(11.89 m)\u00a0ISO100 Max Sync Speed Electronic Shutter: 1 / 200 sec Flash            Compensation -3 EV to +1 EV (in 0.3 or 0.5 EV steps) Continuous            Shooting Up to 5 fps Dedicated Flash            System iTTL External Flash            Connection Hot Shoe AV Recording Video Recording Yes, NTSC/PAL File Size 1920 x 1080i\u00a0(Full HD) 1920 x 1080p\u00a0(Full HD) 1280 x 720p\u00a0(HD) 640 x 424p\u00a0(SD) Frame Rate @ 1920 x 1080: 60 fps, 30 fps, 24 fps @ 1920 x 1080: 50 fps, 25 fps @ 1280 x 720: 60 fps, 50 fps @ 640 x 424: 30 fps, 25 fps Exposure Control Auto:\u00a0Shutter Speed, Aperture, ISO Manual:\u00a0Shutter Speed, ISO ISO Sensitivity Auto, 200 - 6400 Exposure            Compensation -0 EV to +2 EV (in 0.3, 0.7 or 1 EV steps) Focus Auto Manual Continuous Auto Audio Recording With Video, Stereo, Via Optional External Mic Performance Self Timer 2 sec, 5 sec, 10 sec, 20 sec Number of Shots: 1-9 Interval            Recording Yes Date & Time            Stamp Yes Connectivity 1/8\" Microphone, HDMI C (Mini), USB 2.0 Wi-Fi Capable            (With Optional Transmitter) Yes Power Battery 1x EN-EL14\u00a0 Rechargeable Lithium-Ion Battery           Pack, 7.4VDC, 1030mAh Operating/Storage Temperature Operating 32 to 104 \u00b0F (0 to 40 \u00b0C) Humidity: 0 - 85% Physical Dimensions (WxHxD) 5.1 x 3.9 x 3.1\"\u00a0/\u00a0129 x 98 x 78 mm Weight 1.22 lb\u00a0/\u00a0555 g",
    "flashcompensation": "-3 EV to +1 EV (in 0.3 or 0.5 EV steps)",
    "sensortypesize": "CMOS, 23.5 x 15.6 mm",
    "connectivity": "1/8\" Microphone, HDMI C (Mini), USB 2.0",
    "cameraformat": "DX / (1.5x Crop Factor)",
    "angleofview": "170\u00b0",
    "dimensionswxhxd": "5.1 x 3.9 x 3.1\"\u00a0/\u00a0129 x 98 x 78 mm",
    "included": "Nikon D5200 Digital SLR Camera Body (Black) EN-EL14 Lithium-Ion Battery (1030mAh) MH-24 Quick Charger for EN-EL14 Battery DK-5 Eyepiece Shield (Replacement) DK-20 Rubber Eyecup UC-E17 USB Cable EG-CP16 Nikon Audio/Video Cable AN-DC3 Camera Strap (Black) BF-1B Body Cap BS-1 Hot-Shoe Cover ViewNX 2 CD-ROM Limited 1-Year Warranty",
    "bitdepth": "14-bit",
    "aspectratio": "3:2",
    "displayscreen": "3\"\u00a0Rear Screen\u00a0Swivel\u00a0\u00a0LCD (921000)",
    "fileformats": "Still Images: JPEG,           RAW Movies: MPEG-4           AVC/H.264, MOV Audio: Linear           PCM",
    "condition": "New",
    "intervalrecording": "Yes",
    "otherresolutions": "4496 x 3000 2992 x 2000",
    "remotecontrol": "ML-L3 (Optional)",
    "diopteradjustment": "- 1.7 to +0.7 m",
    "exposurecompensation": "-0 EV to +2 EV (in 0.3, 0.7 or 1 EV steps)",
    "flashmodes": "Auto Auto/Red-eye Reduction Fill-in Off Red-eye Reduction Second-curtain Sync Slow Sync Slow Sync./Red-eye Reduction",
    "builtinflash": "Yes",
    "cameratype": "Digital SLR with Interchangeable lenses",
    "exposuremodes": "Modes: Aperture Priority, Auto, Flash Off,           Manual, Program, Shutter Priority Compensation: -5 EV to +5 EV (in 0.3, 0.33 or           0.5 EV steps)",
    "focusmode": "Single-servo AF (S), Continuous-servo AF (C),           Manual Focus (M) , Focus Lock AF Area Mode",
    "wificapablewithoptionaltransmitter": "Yes",
    "viewfindertype": "Pentamirror",
    "autofocuspoints": "39",
    "dedicatedflashsystem": "iTTL",
    "maxresolution": "6000 x 4000",
    "guideno": "39'\u00a0(11.89 m)\u00a0ISO100",
    "screencoverage": "100%"
}