{
    "itemid": "NIDD5200RDK",
    "externalflashconnection": "Hot   Shoe",
    "exposurecontrol": "Auto:   Shutter Speed, Aperture, ISO Manual: Shutter Speed, ISO",
    "weight": "7.23   oz (205 g)",
    "maxsyncspeed": "Electronic Shutter: 1 / 200   sec",
    "battery": "1x   EN-EL14 Rechargeable   Lithium-Ion Battery Pack,   7.4VDC, 1030mAh",
    "framerate": "@   1920 x 1080: 60 fps, 30 fps,   24 fps @ 1920 x 1080: 50 fps, 25   fps @ 1280 x 720: 60 fps, 50 fps @ 640 x 424: 30 fps, 25 fps",
    "isosensitivity": "Auto,   200 - 6400",
    "noisereduction": "Yes",
    "focallength": "18 -   55 mm Comparable DX Focal Length:   27 - 82.5 mm",
    "focus": "Auto Manual Continuous Auto",
    "screencoverage": "100%",
    "memorycardtype": "SD SDHC SDXC",
    "diaphragmblades": "7",
    "imagestabilization": "Yes",
    "aspectratio": "3:2",
    "viewfindermagnification": "Approx. 0.78x",
    "viewfindercoverage": "95%",
    "attr1star": "2 stars3 stars4 stars5 stars",
    "datetimestamp": "Yes",
    "minimumfocusdistance": "11.02\" (28 cm)",
    "continuousshooting": "Up to   5 fps",
    "dimensions": "2.78 x 2.91\" (70.5 x 74 mm)",
    "bitdepth": "14-bit",
    "operatingstoragetemperature": "Operating 32 to 104 \u00b0F (0 to 40 \u00b0C) Humidity: 0 - 85%",
    "dimensionsdxl": "Approx. 2.78 x 2.91\" (70.5 x   74 mm)",
    "fileformats": "Still Images: JPEG, RAW Movies: MPEG-4   AVC/H.264, MOV Audio: Linear PCM",
    "selftimer": "2   sec, 5 sec, 10 sec, 20 sec Number of Shots: 1-9",
    "liveview": "Yes",
    "magnification": "0.31x",
    "filesize": "1920   x 1080i (Full HD) 1920 x 1080p (Full HD) 1280 x 720p (HD) 640 x 424p (SD)",
    "focusmode": "Single-servo AF (S),   Continuous-servo AF (C),   Manual Focus (M) , Focus   Lock AF Area Mode",
    "aperture": "Maximum: f/3.5 Minimum: f/22",
    "dimensionswxhxd": "5.1 x   3.9 x 3.1\" / 129 x 98 x 78   mm",
    "autofocus": "Yes",
    "otherresolutions": "4496   x 3000 2992 x 2000",
    "meteringmethod": "3D   Color Matrix Metering,   Center-weighted average   metering, Spot metering",
    "audiorecording": "With   Video, Stereo, Via Optional   External Mic",
    "whitebalancemodes": "Auto,   Cloudy, Custom, Daylight,   Flash, Fluorescent,   Incandescent, Preset Manual,   Shade",
    "category": "camera",
    "specifications": "New Page 1 New Page 1 Imaging Camera   Type Digital SLR with   Interchangeable lenses Lens   Mount Nikon   F Camera   Format DX /   (1.5x Crop Factor) Pixels Actual: 24.71 Megapixel Effective: 24.1 Megapixel Max   Resolution 6000   x 4000 Other   Resolutions 4496   x 3000 2992 x 2000 Aspect   Ratio 3:2 Sensor   Type / Size CMOS,   23.5 x 15.6 mm File   Formats Still Images: JPEG, RAW Movies: MPEG-4   AVC/H.264, MOV Audio: Linear PCM Bit   Depth 14-bit Noise   Reduction Yes Memory   Card Type SD SDHC SDXC Focus Control Focus   Type Auto   & Manual Focus   Mode Single-servo AF (S),   Continuous-servo AF (C),   Manual Focus (M) , Focus   Lock AF Area Mode Autofocus Points 39 Viewfinder/Display Viewfinder Type Pentamirror Viewfinder Coverage 95% Viewfinder Magnification Approx. 0.78x Diopter Adjustment - 1.7   to +0.7 m Display Screen 3\"   Rear Screen Swivel LCD   (921000) Screen   Coverage 100% Angle   of View 170\u00b0 Live   View Yes Exposure Control ISO   Sensitivity Auto,   100-6400 (Extended Mode:   100-25600) Shutter Type:   Charge-coupled Electronic Speed: 30 - 1/4000 sec Remote   Control ML-L3   (Optional) Metering Method 3D   Color Matrix Metering,   Center-weighted average   metering, Spot metering Exposure Modes Modes: Aperture Priority,   Auto, Flash Off, Manual,   Program, Shutter Priority Compensation: -5 EV to +5 EV   (in 0.3 or 0.5 EV steps) White   Balance Modes Auto,   Cloudy, Custom, Daylight,   Flash, Fluorescent,   Incandescent, Preset Manual,   Shade Flash Flash   Modes Auto Auto/Red-eye Reduction Fill-in Off Red-eye Reduction Second-curtain Sync Slow Sync Slow Sync./Red-eye Reduction Built-in Flash Yes Guide   No. 39'   (11.89 m) ISO100 Max   Sync Speed Electronic Shutter: 1 / 200   sec Flash   Compensation -3 EV   to +1 EV (in 0.3 or 0.5 EV   steps) Continuous Shooting Up to   5 fps Dedicated Flash System iTTL External Flash Connection Hot   Shoe AV Recording Video   Recording Yes,   NTSC/PAL File   Size 1920   x 1080i (Full HD) 1920 x 1080p (Full HD) 1280 x 720p (HD) 640 x 424p (SD) Frame   Rate @   1920 x 1080: 60 fps, 30 fps,   24 fps @ 1920 x 1080: 50 fps, 25   fps @ 1280 x 720: 60 fps, 50 fps @ 640 x 424: 30 fps, 25 fps Exposure Control Auto:   Shutter Speed, Aperture, ISO Manual: Shutter Speed, ISO ISO   Sensitivity Auto,   200 - 6400 Exposure Compensation -0 EV   to +2 EV (in 0.3, 0.7 or 1   EV steps) Focus Auto Manual Continuous Auto Audio   Recording With   Video, Stereo, Via Optional   External Mic Performance Self   Timer 2   sec, 5 sec, 10 sec, 20 sec Number of Shots: 1-9 Interval Recording Yes Date &   Time Stamp Yes Connectivity 1/8\"   Microphone, HDMI C (Mini),   USB 2.0 Wi-Fi   Capable (With Optional   Transmitter) Yes Power Battery 1x   EN-EL14 Rechargeable   Lithium-Ion Battery Pack,   7.4VDC, 1030mAh Operating/Storage   Temperature Operating 32 to 104 \u00b0F (0 to 40 \u00b0C) Humidity: 0 - 85% Physical Dimensions (WxHxD) 5.1 x   3.9 x 3.1\" / 129 x 98 x 78   mm Weight 1.22   lb / 555 g Kit Lens Focal   Length 18 -   55 mm Comparable DX Focal Length:   27 - 82.5 mm Aperture Maximum: f/3.5 Minimum: f/22 Angle   of View 76\u00b0 -   25.5\u00b0 Minimum Focus Distance 11.02\" (28 cm) Magnification 0.31x Groups/Elements 5/7 Diaphragm Blades 7 Autofocus Yes Image   Stabilization Yes Filter   Thread Front: 52 mm Dimensions (DxL) Approx. 2.78 x 2.91\" (70.5 x   74 mm) Weight 7.23   oz (205 g)",
    "flashcompensation": "-3 EV   to +1 EV (in 0.3 or 0.5 EV   steps)",
    "freeshipping": "Yes",
    "brand": "Nikon",
    "sensortypesize": "CMOS,   23.5 x 15.6 mm",
    "filterthread": "Front: 52 mm",
    "connectivity": "1/8\"   Microphone, HDMI C (Mini),   USB 2.0",
    "cameraformat": "DX /   (1.5x Crop Factor)",
    "groupselements": "5/7",
    "angleofview": "76\u00b0 -   25.5\u00b0",
    "focustype": "Auto   & Manual",
    "included": "Nikon D5200 Digital SLR Camera (Red) 18-55mm f/3.5-5.6G VR AF-S DX Nikkor Lens EN-EL14 Lithium-Ion Battery (1030mAh) MH-24 Quick Charger for EN-EL14 Battery DK-5 Eyepiece Shield (Replacement) DK-20 Rubber Eyecup UC-E17 USB Cable EG-CP16 Nikon Audio/Video Cable AN-DC3 Camera Strap (Black) BF-1B Body Cap BS-1 Hot-Shoe Cover ViewNX 2 CD-ROM Limited 1-Year Warranty",
    "videorecording": "Yes,   NTSC/PAL",
    "lensmount": "Nikon   F",
    "displayscreen": "3\"   Rear Screen Swivel LCD   (921000)",
    "pixels": "Actual: 24.71 Megapixel Effective: 24.1 Megapixel",
    "condition": "New",
    "intervalrecording": "Yes",
    "remotecontrol": "ML-L3   (Optional)",
    "diopteradjustment": "- 1.7   to +0.7 m",
    "cameratype": "Digital SLR with   Interchangeable lenses",
    "builtinflash": "Yes",
    "exposuremodes": "Modes: Aperture Priority,   Auto, Flash Off, Manual,   Program, Shutter Priority Compensation: -5 EV to +5 EV   (in 0.3 or 0.5 EV steps)",
    "dedicatedflashsystem": "iTTL",
    "opticalzoom": "Interchangable Lens",
    "shutter": "Type:   Charge-coupled Electronic Speed: 30 - 1/4000 sec",
    "flashmodes": "Auto Auto/Red-eye Reduction Fill-in Off Red-eye Reduction Second-curtain Sync Slow Sync Slow Sync./Red-eye Reduction",
    "wificapablewithoptionaltransmitter": "Yes",
    "viewfindertype": "Pentamirror",
    "autofocuspoints": "39",
    "exposurecompensation": "-0 EV   to +2 EV (in 0.3, 0.7 or 1   EV steps)",
    "maxresolution": "6000   x 4000",
    "guideno": "39'   (11.89 m) ISO100",
    "resolution": "24 Megapixels"
}