{
    "itemid": "nidd3100b",
    "externalflashconnection": "Hotshoe with sync and data            contacts and safety lock",
    "imagestabilization": "Depends on lens",
    "weight": "1 lbs (453g) Body without            battery, memory card, or body cap",
    "durability": "N/A",
    "sensitivity": "ISO 100 to 3200 in steps of            1 EV; Can also be set to approx. 1 EV above            ISO 3200 (ISO 6400 equivalent) or to approx.            2 EV above ISO 3200 (ISO 12800 equivalent);            auto ISO sensitivity control available",
    "multichannelplayback": "Yes",
    "resolution": "Total: 14.8 Megapixels,            Effective: 14.2 Megapixels",
    "weatherproofing": "N/A",
    "shutterspeeds": "Electronically controlled            vertical-travel focal-plane shutter 1/4000 to 30 s in steps of 1/3 EV, Bulb",
    "memorycardtype": "SD, SDHC, & SDXC compliant",
    "poweradapter": "EH-5a AC adapter (sold            separately); requires EP-5A power connector            (sold separately)",
    "stillimagespergb": "Not Specified by            Manufacturer",
    "colorspaces": "Not Specified by            Manufacturer",
    "batterytype": "EN-EL14 rechargeable Li-ion            battery (included)",
    "viewfindercoverage": "Approx. 95% horizontal and            95% vertical",
    "attr1star": "2 stars3 stars4 stars5 stars",
    "videorecording": "Yes",
    "dimensions": "4.9 x 3.8 x 3\" (124.46 x            96.52 x 76.2mm) camera",
    "operatingstoragetemperature": "Temperature: 32 to 104\u00b0F (0            to 40\u00b0C)",
    "mirrorlockup": "Not Specified by            Manufacturer",
    "selftimer": "2 sec, 10 sec",
    "freeshipping": "Yes",
    "builtinmemory": "None",
    "focustype": "Nikon Multi-CAM 1000            autofocus sensor module with TTL phase            detection 11 focus points (including one cross-type            sensor), and AF-assist illuminator (range            approx. 1' 8\" to 9' 10\") Autofocus (AF): Single-servo AF (AF-S);            full-time-servo AF (AF-F), Manual focus (MF) AF-area mode: Face-priority AF, wide-area            AF, normal-area AF, subject-tracking AF",
    "sensor": "23.1 x 15.4mm Nikon            DX-format CMOS sensor",
    "audiorecording": "Linear PCM",
    "filesize": "4608 x 3072 (L), 3456 x 2304            (M), 2304 x 1536 (S)",
    "category": "camera",
    "systemsoftwarerequirements": "Not Specified by            Manufacturer",
    "specifications": "New Page 1 New Page 1 Camera Type Single-lens reflex digital            camera Imaging Resolution Total: 14.8 Megapixels,            Effective: 14.2 Megapixels Sensor 23.1 x 15.4mm Nikon            DX-format CMOS sensor Bit Depth Not Specified by            Manufacturer File Formats NEF (RAW), JPEG:            JPEG-Baseline compliant with fine (approx.            1:4), normal (approx. 1:8), or basic            (approx. 1:16) compression, NEF (RAW) +            JPEG: Single photograph recorded in both NEF            (RAW) and JPEG formats File Size 4608 x 3072 (L), 3456 x 2304            (M), 2304 x 1536 (S) Color Spaces Not Specified by            Manufacturer Creative Color Modes Standard, Neutral, Vivid,            Monochrome Film Modes Not Specified by            Manufacturer Movie Modes Yes HD 1080P (24fps;            recording duration 10 minutes) HD 720P (30, 25, 24fps user selectable;            recording duration 10 minutes) VGA/SD equivalent (30fps; recording duration            10 minutes) QVGA equivalent (30fps; recording duration            10 minutes ) Image Stabilization Depends on lens Crop Factor 1.5x Focus Type Nikon Multi-CAM 1000            autofocus sensor module with TTL phase            detection 11 focus points (including one cross-type            sensor), and AF-assist illuminator (range            approx. 1' 8\" to 9' 10\") Autofocus (AF): Single-servo AF (AF-S);            full-time-servo AF (AF-F), Manual focus (MF) AF-area mode: Face-priority AF, wide-area            AF, normal-area AF, subject-tracking AF Shooting Controls Sensitivity ISO 100 to 3200 in steps of            1 EV; Can also be set to approx. 1 EV above            ISO 3200 (ISO 6400 equivalent) or to approx.            2 EV above ISO 3200 (ISO 12800 equivalent);            auto ISO sensitivity control available Shutter Speeds Electronically controlled            vertical-travel focal-plane shutter 1/4000 to 30 s in steps of 1/3 EV, Bulb Metering Matrix: 3D color matrix            metering II (type G and D lenses); color            matrix metering II (other CPU lenses) Center-weighted: Weight of 75% given to 8-mm            circle in center of frame Spot: Meters 3.5-mm circle (about 2.5% of            frame) centered on selected focus point Exposure Modes Auto modes (auto, auto            [flash off ]); Scene Modes (Portrait;            Landscape; Child; Sports; Close up; Night            portrait); programmed auto with flexible            program (P); shutter-priority auto (S);            aperture-priority auto (A); manual (M), -5            to +5 EV in increments of 1/3 EV, Luminosity            locked at detected value with AE-L/AF-L            button White Balance Auto, incandescent,            fluorescent (7 types), direct sunlight,            flash, cloudy, shade, preset manual(up to 5            values can be stored), Fine tune by Kelvin            color temperature setting (2,500 K to            10,000K) Mirror Lock-Up Not Specified by            Manufacturer Burst Capability Up to 3 frames per second Self Timer 2 sec, 10 sec Interval Recording No Remote Control MC-DC2 (available            separately), GPS unit: GP-1 (available            separately) Flash Built-in Flash Built-in pop up, auto, auto            with red-eye reduction, fill-flash, auto            slow sync, auto slow sync with red-eye            correction, and rear curtain with slow sync Effective Flash Range Guide number: Approx. 39' ( 12m ),            43' ( 13m ) with manual flash (ISO            100), -3 to +1 EV in increments of 1/3 EV External Flash Connection Hotshoe with sync and data            contacts and safety lock Dedicated Flash System TTL: i-TTL balanced            fill-flash and standard i-TTL flash for            digital SLR using 420-pixel RGB sensor are            available with built-in flash and SB-900,            SB-800, SB-600, or SB-400 (i-TTL balanced            fill-flash is available when matrixor            center-weighted metering is selected) Auto aperture: Available with SB-900/SB-800            and CPU lens \u2022 Non-TTL auto: Supported flash units include            SB-900, SB-800, SB-80DX, SB-28DX, SB-28,            SB-27, and SB-22S Distance-priority manual: Available with            SB-900 and SB-800 Advanced Wireless Lighting supported with            SB-900, SB-800, or SU-800 as commander;            Flash Color Information Communication            supported with built-in flash and all CLS-compatible            flash units Max Sync Speed 1/200 Memory Built-in Memory None Memory Card Type SD, SDHC, & SDXC compliant Still Images per GB Not Specified by            Manufacturer A/V Recording Recording Formats MOV, H.264/MPEG-4 Advanced            Video Coding Video Recording Yes Video Resolution 1920 x 1080 (24p): 24fps            (23.976fps) 1280 x 720 (30p): 30fps (29.97fps) 1280 x 720 (25p): 25fps 1280 x 720 (24p): 24fps (23.976fps) 640 x 424 (24p): 24fps (23.976fps) Video Clip Length 10 minutes Audio Recording Linear PCM Viewfinder/Display Viewfinder Type Eye-level pentamirror            single-lens reflex viewfinder Diopter adjustment: 1.7 to +0.5 m-1 Eyepoint: 18mm (-1.0 m-1) Magnification: Approx. 0.8 x (50mm f/1.4            lens at infinity, -1.0 m-1) Focusing screen: Type B BriteView Clear            Matte Mark VII screen Viewfinder Coverage Approx. 95% horizontal and            95% vertical Display 3\", Approx. 230k-dot TFT LCD            with brightness adjustment Multi-Channel Playback Yes Connectivity/System            Requirements Connectivity USB - Hi-speed USB, Type C            mini-pin HDMI connector, NTSC, PAL System & Software            Requirements Not Specified by            Manufacturer Environmental Operating/Storage            Temperature Temperature: 32 to 104\u00b0F (0            to 40\u00b0C) Weatherproofing N/A Durability N/A Power Battery Type EN-EL14 rechargeable Li-ion            battery (included) Power Adapter EH-5a AC adapter (sold            separately); requires EP-5A power connector            (sold separately) Physical Dimensions 4.9 x 3.8 x 3\" (124.46 x            96.52 x 76.2mm) camera Weight 1 lbs (453g) Body without            battery, memory card, or body cap",
    "cropfactor": "1.5x",
    "brand": "Nikon",
    "whitebalance": "Auto, incandescent,            fluorescent (7 types), direct sunlight,            flash, cloudy, shade, preset manual(up to 5            values can be stored), Fine tune by Kelvin            color temperature setting (2,500 K to            10,000K)",
    "metering": "Matrix: 3D color matrix            metering II (type G and D lenses); color            matrix metering II (other CPU lenses) Center-weighted: Weight of 75% given to 8-mm            circle in center of frame Spot: Meters 3.5-mm circle (about 2.5% of            frame) centered on selected focus point",
    "connectivity": "USB - Hi-speed USB, Type C            mini-pin HDMI connector, NTSC, PAL",
    "recordingformats": "MOV, H.264/MPEG-4 Advanced            Video Coding",
    "included": "D3100 Camera body with body cap and accessory shoe cover installed (Imported Model) Viewfinder eyepiece cover EN-EL14 (1030mAh) Lithium Ion battery pack MH-24 battery charger Nylon adjustable shoulder strap Nikon ViewNX2 Software CD-ROM Nikon Reference Manual CD-ROM User Manual Quick Start Guide",
    "bitdepth": "Not Specified by            Manufacturer",
    "creativecolormodes": "Standard, Neutral, Vivid,            Monochrome",
    "burstcapability": "Up to 3 frames per second",
    "fileformats": "NEF (RAW), JPEG:            JPEG-Baseline compliant with fine (approx.            1:4), normal (approx. 1:8), or basic            (approx. 1:16) compression, NEF (RAW) +            JPEG: Single photograph recorded in both NEF            (RAW) and JPEG formats",
    "condition": "New",
    "intervalrecording": "No",
    "remotecontrol": "MC-DC2 (available            separately), GPS unit: GP-1 (available            separately)",
    "cameratype": "Single-lens reflex digital            camera",
    "builtinflash": "Built-in pop up, auto, auto            with red-eye reduction, fill-flash, auto            slow sync, auto slow sync with red-eye            correction, and rear curtain with slow sync",
    "exposuremodes": "Auto modes (auto, auto            [flash off ]); Scene Modes (Portrait;            Landscape; Child; Sports; Close up; Night            portrait); programmed auto with flexible            program (P); shutter-priority auto (S);            aperture-priority auto (A); manual (M), -5            to +5 EV in increments of 1/3 EV, Luminosity            locked at detected value with AE-L/AF-L            button",
    "opticalzoom": "Interchangable Lens",
    "filmmodes": "Not Specified by            Manufacturer",
    "videocliplength": "10 minutes",
    "viewfindertype": "Eye-level pentamirror            single-lens reflex viewfinder Diopter adjustment: 1.7 to +0.5 m-1 Eyepoint: 18mm (-1.0 m-1) Magnification: Approx. 0.8 x (50mm f/1.4            lens at infinity, -1.0 m-1) Focusing screen: Type B BriteView Clear            Matte Mark VII screen",
    "maxsyncspeed": "1/200",
    "effectiveflashrange": "Guide number: Approx. 39' ( 12m ),            43' ( 13m ) with manual flash (ISO            100), -3 to +1 EV in increments of 1/3 EV",
    "dedicatedflashsystem": "TTL: i-TTL balanced            fill-flash and standard i-TTL flash for            digital SLR using 420-pixel RGB sensor are            available with built-in flash and SB-900,            SB-800, SB-600, or SB-400 (i-TTL balanced            fill-flash is available when matrixor            center-weighted metering is selected) Auto aperture: Available with SB-900/SB-800            and CPU lens \u2022 Non-TTL auto: Supported flash units include            SB-900, SB-800, SB-80DX, SB-28DX, SB-28,            SB-27, and SB-22S Distance-priority manual: Available with            SB-900 and SB-800 Advanced Wireless Lighting supported with            SB-900, SB-800, or SU-800 as commander;            Flash Color Information Communication            supported with built-in flash and all CLS-compatible            flash units",
    "videoresolution": "1920 x 1080 (24p): 24fps            (23.976fps) 1280 x 720 (30p): 30fps (29.97fps) 1280 x 720 (25p): 25fps 1280 x 720 (24p): 24fps (23.976fps) 640 x 424 (24p): 24fps (23.976fps)",
    "display": "3\", Approx. 230k-dot TFT LCD            with brightness adjustment",
    "moviemodes": "Yes HD 1080P (24fps;            recording duration 10 minutes) HD 720P (30, 25, 24fps user selectable;            recording duration 10 minutes) VGA/SD equivalent (30fps; recording duration            10 minutes) QVGA equivalent (30fps; recording duration            10 minutes )"
}