{
    "itemid": "NIDCPS800CW",
    "imagestabilization": "Optical",
    "weight": "6.5   oz\u00a0/\u00a0184\u00a0 g With battery   and SD memory card",
    "battery": "NIENEL12\u00a0Rechargeable   Lithium-Ion Battery Pack,   3.7VDC, 1050mAh",
    "memorycardtype": "SD SDHC",
    "connectors": "1x USB Port   Out",
    "acpoweradapter": "NIEH69P   (Optional)",
    "attr1star": "2 stars3 stars4 stars5 stars",
    "videorecording": "Yes,   NTSC/PAL",
    "dimensions": "4.4 x 2.4 x 1.1\"",
    "operatingstoragetemperature": "Operating 32 to 104 \u00b0F (0 to 40 \u00b0C)",
    "brand": "Nikon",
    "fileformats": "Still   Images: JPEG Movies: MPEG-4 AVC/H.264,   MOV Audio: AAC, WAV",
    "freeshipping": "Yes",
    "builtinmemory": "1.7GB",
    "dimensionswxhxd": "4.4 x 2.4 x   1.1\"\u00a0/\u00a011.18 x 6.10 x 2.79   cm Excluding projections",
    "sensor": "1/2.3\" CMOS",
    "audiorecording": "With Video,   Stereo",
    "category": "camera",
    "specifications": "New Page 2 Imaging Pixels Actual: 16.8   Megapixel Effective: 16 Megapixel Sensor 1/2.3\" CMOS File Formats Still   Images: JPEG Movies: MPEG-4 AVC/H.264,   MOV Audio: AAC, WAV Max   Resolution 16MP: 4608 x   3456 @ 4:3 Aspect Ratio 4:3 Image   Stabilization Optical Optics Lens NIKKOR, 8   elements in 8 groups EFL: 4.5-45 mm\u00a0(35 mm   equivalent: 25-250 mm) Aperture: f/3.2 (W) - 5.8   (T) Filter   Thread None Zoom Optical: 10x Digital: 4x Focus Range Wide: 1.64'   (0.50 m) - Infinity Telephoto: 3.28' (1 m) -   Infinity Macro: 3.94\" (10 cm) -   Infinity Flash Flash Modes Auto Built-in   Flash Yes Effective   Flash Range Wide: 1.64 -   18.37' (0.5 - 5.6 m) Telephoto: 3.28 - 10.17'   (1.0 - 3.1 m) Memory Built-in   Memory 1.7GB Memory Card   Type SD SDHC Recording Video   Recording Yes,   NTSC/PAL Video Audio   Recording With Video,   Stereo Display Screen 3.5\" OLED\u00a0Rear   Screen\u00a0(819000 pixels) Connectivity/System   Requirements Connectivity 1x HDMI C   (Mini)\u00a0(out) Connectors 1x USB Port   Out Wi-Fi Yes built-in Environmental Operating/Storage   Temperature Operating 32 to 104 \u00b0F (0 to 40 \u00b0C) Waterproofing None Power Battery NIENEL12\u00a0Rechargeable   Lithium-Ion Battery Pack,   3.7VDC, 1050mAh AC Power   Adapter NIEH69P   (Optional) Physical Dimensions (WxHxD) 4.4 x 2.4 x   1.1\"\u00a0/\u00a011.18 x 6.10 x 2.79   cm Excluding projections Weight 6.5   oz\u00a0/\u00a0184\u00a0 g With battery   and SD memory card",
    "screen": "3.5\" OLED\u00a0Rear   Screen\u00a0(819000 pixels)",
    "filterthread": "None",
    "lens": "NIKKOR, 8   elements in 8 groups EFL: 4.5-45 mm\u00a0(35 mm   equivalent: 25-250 mm) Aperture: f/3.2 (W) - 5.8   (T)",
    "connectivity": "1x HDMI C   (Mini)\u00a0(out)",
    "focusrange": "Wide: 1.64'   (0.50 m) - Infinity Telephoto: 3.28' (1 m) -   Infinity Macro: 3.94\" (10 cm) -   Infinity",
    "included": "Nikon COOLPIX S800c Digital Camera (White) EN-EL12 Rechargeable Lithium-Ion Battery (3.7V, 1050mAh) UC-E6 USB Cable AN-CP19 Strap Replacement EH-69P AC Adapter Charger NikonView NX 2 CD-ROM 1-Year TheCameraBox Warranty",
    "aspectratio": "4:3",
    "pixels": "Actual: 16.8   Megapixel Effective: 16 Megapixel",
    "condition": "New",
    "waterproofing": "None",
    "flashmodes": "Auto",
    "effectiveflashrange": "Wide: 1.64 -   18.37' (0.5 - 5.6 m) Telephoto: 3.28 - 10.17'   (1.0 - 3.1 m)",
    "wifi": "Yes built-in",
    "zoom": "Optical: 10x Digital: 4x",
    "opticalzoom": "10x Zoom",
    "builtinflash": "Yes",
    "maxresolution": "16MP: 4608 x   3456 @ 4:3",
    "resolution": "16 Megapixels"
}