{
    "itemid": "PKDK3",
    "externalflashconnection": "Hot Shoe, PC   Terminal, Wireless",
    "acpoweradapter": "K-AC132 (Optional)",
    "weight": "1.8 lb\u00a0/\u00a0816\u00a0 g with battery and memory card",
    "mirrorlockup": "Yes",
    "battery": "1x D-LI90\u00a0   Rechargeable Lithium-Ion Battery   Pack, 7.2VDC, 1860mAh",
    "framerate": "@ 1920 x 1080: 60   fps, 50 fps, 30 fps, 25 fps, 24 fps @ 1280 x 720: 60 fps, 50 fps, 30   fps, 25 fps, 24 fps",
    "isosensitivity": "Auto, 100-51200",
    "noisereduction": "Yes",
    "focus": "Auto Manual Continuous Auto",
    "screencoverage": "100%",
    "memorycardtype": "SD SDHC SDXC",
    "imagestabilization": "Sensor-Shift",
    "incameraimageediting": "Base Parameter   Adjustment, Bold Monochrome, Extract   Color, Fisheye, High Contrast,   Invert Color, Miniature Effect,   Pastel, Posterization, Retro,   Shading, Sketch Filter, Slim, Soft,   Starburst, Tone Expansion, Toy   Camera, Unicolor Bold, Watercolor",
    "lensmount": "Pentax K",
    "softwarerequirements": "Windows: XP (SP3),   Vista, 7, 8 Mac: OS X 10.6 or later",
    "attr1star": "2 stars3 stars4 stars5 stars",
    "shutter": "Type: Electronic &   Mechanical Speed: 30 - 1/8000\u00a0sec, Bulb Mode",
    "videorecording": "Yes, NTSC/PAL",
    "dimensions": "No",
    "bitdepth": "14-bit",
    "operatingstoragetemperature": "Operating 14 to 104\u00b0F (-10 to 40\u00b0C)",
    "pixels": "Actual: 24.71 Megapixel Effective: 23.35 Megapixel",
    "selftimer": "12 sec, 2 sec",
    "liveview": "Yes",
    "filesize": "1920 x 1080i\u00a0(Full   HD) 1920 x 1080p\u00a0(Full HD) 1280 x 720p\u00a0(HD)",
    "continuousshootingtime": "1920 x 1080 25 min.",
    "dimensionswxhxd": "5.2 x 3.9 x   3.1\"\u00a0/\u00a0132.1 x 99.1 x 78.7 mm",
    "viewfindercoverage": "100%",
    "meteringmethod": "Center-weighted   average metering, Multi-zone   metering, Spot metering",
    "audiorecording": "Built-in Mic: With   Video, Stereo, Optional External Mic: With Video,",
    "whitebalancemodes": "Auto, CTE, Cloudy,   Color Temperature, Daylight, Flash,   Fluorescent (Cool White),   Fluorescent (Day White), Fluorescent   (Daylight), Fluorescent (Warm   White), Manual, Multi Auto WB,   Shade, Tungsten",
    "dustreductionsystem": "Yes",
    "category": "camera",
    "specifications": "Imaging Camera Type Digital SLR with Interchangeable   lenses Lens Mount Pentax K Camera Format APS-C / (1.5x Crop Factor) Pixels Actual: 24.71 Megapixel Effective: 23.35 Megapixel Max Resolution 24MP: 6016 x 4000 @ 3:2 Other Resolutions 14MP: 4608 x 3072 @ 3:2 6MP: 3072 x 2048 @ 3:2 2MP: 1920 x 1080 @ 16:9 Aspect Ratio 3:2, 16:9 Sensor Type / Size CMOS, 23.5 x 15.6 mm File Formats Still Images: DNG, JPEG, RAW Movies: AVI, MOV, MPEG-4 AVC/H.264 Bit Depth 14-bit Dust Reduction System Yes Noise Reduction Yes Memory Card Type SD SDHC SDXC Image Stabilization Sensor-Shift Focus Control Focus Type Auto & Manual Focus Mode Single-servo AF (S),   Continuous-servo AF (C), Manual   Focus (M) , Focus Lock AF Area Mode Autofocus Points Phase Detection: 27 Viewfinder/Display Viewfinder Type Pentaprism Viewfinder Coverage 100% Viewfinder   Magnification Approx. 0.95x Diopter Adjustment - 2.5 to +1.5 m Display Screen 3.2\"\u00a0Rear   Screen\u00a0\u00a0\u00a0LCD (1,037,000) Screen Coverage 100% Live View Yes Exposure Control ISO Sensitivity Auto, 100-51200 Shutter Type: Electronic &   Mechanical Speed: 30 - 1/8000\u00a0sec, Bulb Mode Remote Control Remote Control F or   Remote Control WP (Optional) Mirror Lock-Up Yes Metering Method Center-weighted   average metering, Multi-zone   metering, Spot metering Exposure Modes Modes: Aperture   Priority, Bulb, Green, Hyper   Program, Metered Manual, Sensitivity   Priority, Shutter Priority,   Shutter/Aperture Priority, User,   X-Speed Metering Range: EV -3.0 - EV 20.0 Compensation: -5 EV to +5 EV (in .3   or .5 EV steps) White Balance Modes Auto, CTE, Cloudy,   Color Temperature, Daylight, Flash,   Fluorescent (Cool White),   Fluorescent (Day White), Fluorescent   (Daylight), Fluorescent (Warm   White), Manual, Multi Auto WB,   Shade, Tungsten Flash Flash Modes Modes: Auto Flash On Hi-Speed Sync Manual Red-eye Reduction Second-curtain Sync Slow Sync Slow Sync./Red-eye Reduction Wireless Compensation: -2 EV to +1 EV (in .5   EV steps) Built-in Flash Yes Guide No. 42.65'\u00a0(13   m)\u00a0ISO100 Max Sync Speed 1 / 180 sec Dedicated Flash   System P-TTL External Flash   Connection Hot Shoe, PC   Terminal, Wireless AV Recording Video Recording Yes, NTSC/PAL File Size 1920 x 1080i\u00a0(Full   HD) 1920 x 1080p\u00a0(Full HD) 1280 x 720p\u00a0(HD) Aspect Ratio 16:9 Frame Rate @ 1920 x 1080: 60   fps, 50 fps, 30 fps, 25 fps, 24 fps @ 1280 x 720: 60 fps, 50 fps, 30   fps, 25 fps, 24 fps Focus Auto Manual Continuous Auto Continuous Shooting   Time 1920 x 1080 25 min. Audio Recording Built-in Mic: With   Video, Stereo, Optional External Mic: With Video, Performance Continuous Shooting Up to 8.3 fps Self Timer 12 sec, 2 sec Interval Recording Yes In-Camera Image   Editing Base Parameter   Adjustment, Bold Monochrome, Extract   Color, Fisheye, High Contrast,   Invert Color, Miniature Effect,   Pastel, Posterization, Retro,   Shading, Sketch Filter, Slim, Soft,   Starburst, Tone Expansion, Toy   Camera, Unicolor Bold, Watercolor Connectivity USB 3.0 AV Output HDMI C (Mini)\u00a0(out) DC Input 1/8\" Microphone 1/8\" Headphone Cable Switch X-Sync Socket Wi-Fi Capable Yes (with   Optional Transmitter) Software   Requirements Windows: XP (SP3),   Vista, 7, 8 Mac: OS X 10.6 or later Power Battery 1x D-LI90\u00a0   Rechargeable Lithium-Ion Battery   Pack, 7.2VDC, 1860mAh AC Power Adapter K-AC132 (Optional) Operating/Storage   Temperature Operating 14 to 104\u00b0F (-10 to 40\u00b0C) Physical Dimensions (WxHxD) 5.2 x 3.9 x   3.1\"\u00a0/\u00a0132.1 x 99.1 x 78.7 mm Weight 1.8 lb\u00a0/\u00a0816\u00a0 g with battery and memory card",
    "viewfindermagnification": "Approx. 0.95x",
    "freeshipping": "Yes",
    "brand": "Pentax",
    "sensortypesize": "CMOS, 23.5 x 15.6 mm",
    "connectivity": "USB 3.0 AV Output HDMI C (Mini)\u00a0(out) DC Input 1/8\" Microphone 1/8\" Headphone Cable Switch X-Sync Socket",
    "cameraformat": "APS-C / (1.5x Crop Factor)",
    "focustype": "Auto & Manual",
    "included": "Pentax K-3 DSLR Camera (Body Only) D-LI90 Rechargeable Lithium-Ion Battery Pack (7.2V, 1860mAh) K-BC90 Battery Charger Kit for K7 Digital SLR Camera O-ST132 Strap for Pentax K-5 II DSLR Hotshoe Cover FK Eyecup FS SLR Body Mount Cover Finder Cap ME MF-60 AF Standard Focusing Screen PC Socket Cap Software CD-ROM Limited 1-Year Warranty",
    "continuousshooting": "Up to 8.3 fps",
    "aspectratio": "16:9",
    "displayscreen": "3.2\"\u00a0Rear   Screen\u00a0\u00a0\u00a0LCD (1,037,000)",
    "fileformats": "Still Images: DNG, JPEG, RAW Movies: AVI, MOV, MPEG-4 AVC/H.264",
    "condition": "New",
    "intervalrecording": "Yes",
    "otherresolutions": "14MP: 4608 x 3072 @ 3:2 6MP: 3072 x 2048 @ 3:2 2MP: 1920 x 1080 @ 16:9",
    "remotecontrol": "Remote Control F or   Remote Control WP (Optional)",
    "diopteradjustment": "- 2.5 to +1.5 m",
    "cameratype": "Digital SLR with Interchangeable   lenses",
    "flashmodes": "Modes: Auto Flash On Hi-Speed Sync Manual Red-eye Reduction Second-curtain Sync Slow Sync Slow Sync./Red-eye Reduction Wireless Compensation: -2 EV to +1 EV (in .5   EV steps)",
    "builtinflash": "Yes",
    "exposuremodes": "Modes: Aperture   Priority, Bulb, Green, Hyper   Program, Metered Manual, Sensitivity   Priority, Shutter Priority,   Shutter/Aperture Priority, User,   X-Speed Metering Range: EV -3.0 - EV 20.0 Compensation: -5 EV to +5 EV (in .3   or .5 EV steps)",
    "opticalzoom": "Interchangable Lens",
    "focusmode": "Single-servo AF (S),   Continuous-servo AF (C), Manual   Focus (M) , Focus Lock AF Area Mode",
    "viewfindertype": "Pentaprism",
    "maxsyncspeed": "1 / 180 sec",
    "autofocuspoints": "Phase Detection: 27",
    "dedicatedflashsystem": "P-TTL",
    "maxresolution": "24MP: 6016 x 4000 @ 3:2",
    "guideno": "42.65'\u00a0(13   m)\u00a0ISO100",
    "resolution": "24 Megapixels",
    "wificapable": "Yes (with   Optional Transmitter)"
}