{
    "shutter": "Type: Electronic Speed: 30 - 1/8000\u00a0sec",
    "externalflashconnection": "Hot Shoe, Wireless",
    "exposurecontrol": "Auto:\u00a0Shutter Speed,                Aperture, ISO Manual:\u00a0Aperture",
    "weight": "26.1 oz\u00a0/\u00a0740",
    "maxsyncspeed": "1 / 180 sec",
    "battery": "1x D-L190\u00a0 Rechargeable                Lithium-Ion Battery Pack",
    "exposuremodes": "Modes: Aperture Priority,                Manual, Program, Shutter                Priority Compensation: -5 EV to +5 EV                (in 1/3 EV steps)",
    "isosensitivity": "Auto, 100 - 12800,                Expandable to 51200",
    "noisereduction": "No",
    "condition": "New",
    "focus": "Auto Manual",
    "screencoverage": "100%",
    "memorycardtype": "SD SDHC SDXC",
    "imagestabilization": "Optical",
    "incameraimageediting": "Color Balance, Filter                Effects, Miniature Effect,                Monochrome, NEF (RAW)                Processing",
    "lensmount": "Pentax K",
    "softwarerequirements": "Windows: XP (SP3), Vista, 7 Mac: OS X 10.4.11 or later",
    "attr1star": "2 stars3 stars4 stars5 stars",
    "datetimestamp": "No",
    "continuousshooting": "Up to 7 fps",
    "dimensions": "No",
    "operatingstoragetemperature": "Operating 14 to 104 \u00b0F (-10 to 40 \u00b0C)",
    "pixels": "Actual: 16.9 Megapixel Effective: 16.3 Megapixel",
    "selftimer": "2 sec, 12 sec",
    "liveview": "Yes",
    "filesize": "1920 x 1080p\u00a0(Full HD) 1280 x 720p\u00a0(HD) 640 x 480p\u00a0(SD)",
    "videorecording": "Yes, NTSC/PAL",
    "dimensionswxhxd": "5.2 x 3.8 x 2.9\"\u00a0/\u00a013.2 x                9.7 x 7.4 cm",
    "viewfindercoverage": "100%",
    "meteringmethod": "Center-weighted average                metering, Multi-zone                metering, Spot metering",
    "audiorecording": "With Video, Mono, Via                Optional External Mic",
    "whitebalancemodes": "Auto, Cloudy, Custom,                Daylight, Flash, Fluorescent                (Day White), Fluorescent                (Natural White), Fluorescent                (White), Fluorescent H,                Shade, Tungsten",
    "category": "camera",
    "sensortypesize": "CMOS, 23.7 x 15.7 mm",
    "specifications": "New Page 4 Imaging Camera Type Digital SLR with                Interchangeable lenses Lens Mount Pentax K Camera Format APS-C / (1.5x Crop Factor) Pixels Actual: 16.9 Megapixel Effective: 16.3 Megapixel Max Resolution 16MP: 4928 x 3264 @ 3:2 Other Resolutions 10MP: 3936 x 2624 @ 3:2 6MP: 3072 x 2048 @ 3:2 2MP: 1728 x 1152 @ 3:2 Aspect Ratio 3:2, 16:9 Sensor Type / Size CMOS, 23.7 x 15.7 mm File Formats Still Images: JPEG,                RAW Movies: AVI Bit Depth 14-bit Noise Reduction No Memory Card Type SD SDHC SDXC Image Stabilization Optical Focus Control Focus Type Auto & Manual Focus Mode Single-servo AF (S),                Continuous-servo AF (C),                Manual Focus (M) , Focus                Lock AF Area Mode Autofocus Points 11 Viewfinder/Display Viewfinder Type Pentaprism Viewfinder Coverage 100% Viewfinder Magnification Approx. 0.92x Diopter Adjustment - 2.5 to +1.5 m Display Screen 3.0\"\u00a0Rear Screen\u00a0\u00a0\u00a0LCD                (921000) Screen Coverage 100% Live View Yes Exposure Control ISO Sensitivity Auto, 100-12800 (Extended                Mode: 80-51200) Shutter Type: Electronic Speed: 30 - 1/8000\u00a0sec Remote Control Infrared and Cable Switch                (Optional) Metering Method Center-weighted average                metering, Multi-zone                metering, Spot metering Exposure Modes Modes: Aperture Priority,                Manual, Program, Shutter                Priority Compensation: -5 EV to +5 EV                (in 1/3 EV steps) White Balance Modes Auto, Cloudy, Custom,                Daylight, Flash, Fluorescent                (Day White), Fluorescent                (Natural White), Fluorescent                (White), Fluorescent H,                Shade, Tungsten Flash Flash Modes Auto Flash On Red-eye Reduction Second-curtain Sync Slow Sync Slow Sync./Red-eye Reduction Built-in Flash Yes Guide No. 42.65'\u00a0(13 m)\u00a0ISO100 Max Sync Speed 1 / 180 sec Flash Compensation -2 EV to +1 EV (in 1/2 EV                steps) Continuous Shooting Up to 7 fps Dedicated Flash System P-TTL External Flash Connection Hot Shoe, Wireless AV Recording Video Recording Yes, NTSC/PAL File Size 1920 x 1080p\u00a0(Full HD) 1280 x 720p\u00a0(HD) 640 x 480p\u00a0(SD) Frame Rate @ 1920 x 1080: 25 fps @ 1280 x 720: 30 fps, 25 fps @ 640 x 480: 30 fps, 25 fps Exposure Control Auto:\u00a0Shutter Speed,                Aperture, ISO Manual:\u00a0Aperture ISO Sensitivity Auto, 100 - 12800,                Expandable to 51200 Exposure Compensation -2 EV to +2 EV (in 1/31/2 EV                steps) Focus Auto Manual Continuous Shooting Time 1920 x 1080 25 min. 1280 x 720 25 min. 640 x 480 25 min. Audio Recording With Video, Mono, Via                Optional External Mic Performance In-Camera Image Editing Color Balance, Filter                Effects, Miniature Effect,                Monochrome, NEF (RAW)                Processing Self Timer 2 sec, 12 sec Interval Recording No Date & Time Stamp No Connectivity 1/8\" Microphone, AV Output,                DC Input, HDMI C (Mini), USB                2.0 Software Requirements Windows: XP (SP3), Vista, 7 Mac: OS X 10.4.11 or later Power Battery 1x D-L190\u00a0 Rechargeable                Lithium-Ion Battery Pack AC Power Adapter K-AC50 (Optional) Operating/Storage                Temperature Operating 14 to 104 \u00b0F (-10 to 40 \u00b0C) Physical Dimensions (WxHxD) 5.2 x 3.8 x 2.9\"\u00a0/\u00a013.2 x                9.7 x 7.4 cm Weight 26.1 oz\u00a0/\u00a0740",
    "viewfindermagnification": "Approx. 0.92x",
    "freeshipping": "Yes",
    "brand": "Pentax",
    "continuousshootingtime": "1920 x 1080 25 min. 1280 x 720 25 min. 640 x 480 25 min.",
    "connectivity": "1/8\" Microphone, AV Output,                DC Input, HDMI C (Mini), USB                2.0",
    "cameraformat": "APS-C / (1.5x Crop Factor)",
    "focustype": "Auto & Manual",
    "included": "Pentax K-5 IIs Digital SLR Camera I-USB7 USB Interface Cable I-AVC7 A/V Cable D-LI90 Rechargeable Lithium-Ion Battery Pack (7.2V, 1860mAh) K-BC90 Battery Charger Kit for K7 Digital SLR Camera Hotshoe Cover FK Eyecup FR for K7 Digital SLR Camera (replacement) SLR Body Mount Cover Finder Cap for Original 67 Camera Focusing Screen MF-60 Frame Matte Shoulder Strap O-ST132 PC Socket Cap Software CD-ROM S-SW132 One Year Limited Warranty",
    "bitdepth": "14-bit",
    "aspectratio": "3:2, 16:9",
    "displayscreen": "3.0\"\u00a0Rear Screen\u00a0\u00a0\u00a0LCD                (921000)",
    "fileformats": "Still Images: JPEG,                RAW Movies: AVI",
    "acpoweradapter": "K-AC50 (Optional)",
    "intervalrecording": "No",
    "otherresolutions": "10MP: 3936 x 2624 @ 3:2 6MP: 3072 x 2048 @ 3:2 2MP: 1728 x 1152 @ 3:2",
    "remotecontrol": "Infrared and Cable Switch                (Optional)",
    "diopteradjustment": "- 2.5 to +1.5 m",
    "cameratype": "Digital SLR with                Interchangeable lenses",
    "flashmodes": "Auto Flash On Red-eye Reduction Second-curtain Sync Slow Sync Slow Sync./Red-eye Reduction",
    "builtinflash": "Yes",
    "framerate": "@ 1920 x 1080: 25 fps @ 1280 x 720: 30 fps, 25 fps @ 640 x 480: 30 fps, 25 fps",
    "dedicatedflashsystem": "P-TTL",
    "opticalzoom": "Interchangable Lens",
    "focusmode": "Single-servo AF (S),                Continuous-servo AF (C),                Manual Focus (M) , Focus                Lock AF Area Mode",
    "flashcompensation": "-2 EV to +1 EV (in 1/2 EV                steps)",
    "viewfindertype": "Pentaprism",
    "autofocuspoints": "11",
    "exposurecompensation": "-2 EV to +2 EV (in 1/31/2 EV                steps)",
    "maxresolution": "16MP: 4928 x 3264 @ 3:2",
    "guideno": "42.65'\u00a0(13 m)\u00a0ISO100",
    "resolution": "16 Megapixels"
}