{
    "externalflashconnection": "Hot Shoe, Wireless",
    "imagestabilization": "Sensor-Shift",
    "weight": "8.99 oz (255 g)",
    "maxsyncspeed": "Electronic Shutter: 1 / 180 sec",
    "battery": "1x D-LI109\u00a0 Rechargeable Lithium-Ion Battery Pack,     7.4VDC, 1050mAh 4x AA",
    "exposuremodes": "Modes: Aperture Priority, Auto, Bulb, Manual, Movie,     Program, Scene Modes, Sensitivity Priority, Shutter Priority,     Shutter/Aperture Priority Metering Range: EV 0.0 - EV 22.0 Compensation: -5 EV to +5 EV (in .3 or .5 EV steps)",
    "isosensitivity": "Auto, 100-51200",
    "focallength": "18 - 55 mm Comparable 35mm Focal Length: 27.0 - 82.5 mm",
    "screencoverage": "100%",
    "memorycardtype": "SD SDHC SDXC",
    "diaphragmblades": "6",
    "acpoweradapter": "K-AC128 (Optional)",
    "incameraimageediting": "Base Parameter Adjustment, Color, Extract Color,     Fisheye, High Contrast, Invert Color, Miniature Effect, Monochrome,     Pastel, Posterization, Retro, Shading, Sketch Filter, Slim, Soft Focus,     Tone Expansion, Toy Camera, Watercolor",
    "aspectratio": "16:9",
    "softwarerequirements": "Windows: XP (SP3), Vista, 7, 8 Mac: OS X 10.5 or later",
    "attr1star": "2 stars3 stars4 stars5 stars",
    "shutter": "Type: Electronic Speed: 30 - 1/6000\u00a0sec",
    "videorecording": "Yes, NTSC/PAL",
    "dimensions": "No",
    "bitdepth": "12-bit",
    "operatingstoragetemperature": "Operating 14 to 104\u00b0F (-10 to 40\u00b0C)",
    "dimensionsdxl": "Approx. 2.70 x 2.66\" (68.5 x 67.5 mm)",
    "pixels": "Actual: 16.5 Megapixel Effective: 16.3 Megapixel",
    "selftimer": "12 sec, 2 sec",
    "liveview": "Yes",
    "magnification": "0.34x",
    "filesize": "1920 x 1080p\u00a0(Full HD) 1280 x 720p\u00a0(HD) 640 x 480p\u00a0(SD)",
    "continuousshootingtime": "1920 x 1080 25 min. 1280 x 720 25 min. 640 x 480 25 min.",
    "aperture": "Maximum: f/3.5 - 5.6 Minimum: f/22 - 38",
    "dimensionswxhxd": "5.1 x 3.8 x 2.8\"\u00a0/\u00a013.0 x 9.7 x 7.1 cm",
    "autofocus": "Yes",
    "viewfindercoverage": "100%",
    "meteringmethod": "Center-weighted average metering, Multi-zone metering,     Spot metering",
    "audiorecording": "With Video, Mono",
    "whitebalancemodes": "Auto, Cloudy, Cool White, Daylight, Daylight Color,     Daylight White, Flash, Kelvin, Manual, Shade, Tungsten, Warm White",
    "dustreductionsystem": "Yes",
    "category": "camera",
    "specifications": "Imaging Camera Type Digital SLR with Interchangeable lenses Lens Mount Pentax K Camera Format APS-C / (1.5x Crop Factor) Pixels Actual: 16.5 Megapixel Effective: 16.3 Megapixel Max Resolution 16MP: 4928 x 3264 @ 3:2 Other Resolutions 12MP: 4224 x 2816 @ 3:2 8MP: 3456 x 2304 @ 3:2 5MP: 2688 x 1792 @ 3:2 Aspect Ratio 3:2 Sensor Type / Size CMOS, 23.7 x 15.7 mm File Formats Still Images: DNG, JPEG, RAW Movies: MOV, MPEG-4 AVC/H.264 Bit Depth 12-bit Dust Reduction System Yes Memory Card Type SD SDHC SDXC Image Stabilization Sensor-Shift Focus Control Focus Type Auto & Manual Focus Mode Single-servo AF (S), Continuous-servo AF (C), Manual     Focus (M) , Focus Lock AF Area Mode Autofocus Points Phase Detection: 11 Viewfinder/Display Viewfinder Type Pentaprism Viewfinder Coverage 100% Viewfinder Magnification Approx. 0.92x Diopter Adjustment - 2.5 to +1.5 m Display Screen 3\"\u00a0Rear Screen\u00a0\u00a0\u00a0LCD (921,000) Screen Coverage 100% Live View Yes Exposure Control ISO Sensitivity Auto, 100-51200 Shutter Type: Electronic Speed: 30 - 1/6000\u00a0sec Remote Control Remote Control F or O-RC1 (Optional) Metering Method Center-weighted average metering, Multi-zone metering,     Spot metering Exposure Modes Modes: Aperture Priority, Auto, Bulb, Manual, Movie,     Program, Scene Modes, Sensitivity Priority, Shutter Priority,     Shutter/Aperture Priority Metering Range: EV 0.0 - EV 22.0 Compensation: -5 EV to +5 EV (in .3 or .5 EV steps) White Balance Modes Auto, Cloudy, Cool White, Daylight, Daylight Color,     Daylight White, Flash, Kelvin, Manual, Shade, Tungsten, Warm White Flash Flash Modes Red-eye Reduction Second-curtain Sync Slow Sync TTL Auto Built-in Flash Yes Guide No. 39.37'\u00a0(12 m)\u00a0ISO100 Max Sync Speed Electronic Shutter: 1 / 180 sec Flash Compensation -2 EV to +1 EV (in .3 EV steps) Dedicated Flash System P-TTL\u00a0Remote Firing External Flash Connection Hot Shoe, Wireless AV Recording Video Recording Yes, NTSC/PAL File Size 1920 x 1080p\u00a0(Full HD) 1280 x 720p\u00a0(HD) 640 x 480p\u00a0(SD) Aspect Ratio 16:9 Frame Rate @ 1920 x 1080: 30 fps, 25 fps, 24 fps @ 1280 x 720: 60 fps, 50 fps, 30 fps, 25 fps, 24 fps @ 640 x 480: 30 fps, 25 fps, 24 fps Continuous Shooting Time 1920 x 1080 25 min. 1280 x 720 25 min. 640 x 480 25 min. Audio Recording With Video, Mono Performance Continuous Shooting Up to 6 fps Self Timer 12 sec, 2 sec Interval Recording Yes In-Camera Image Editing Base Parameter Adjustment, Color, Extract Color,     Fisheye, High Contrast, Invert Color, Miniature Effect, Monochrome,     Pastel, Posterization, Retro, Shading, Sketch Filter, Slim, Soft Focus,     Tone Expansion, Toy Camera, Watercolor Connectivity AV Output, USB 2.0 Software Requirements Windows: XP (SP3), Vista, 7, 8 Mac: OS X 10.5 or later Power Battery 1x D-LI109\u00a0 Rechargeable Lithium-Ion Battery Pack,     7.4VDC, 1050mAh 4x AA AC Power Adapter K-AC128 (Optional) Operating/Storage Temperature Operating 14 to 104\u00b0F (-10 to 40\u00b0C) Physical Dimensions (WxHxD) 5.1 x 3.8 x 2.8\"\u00a0/\u00a013.0 x 9.7 x 7.1 cm Weight 22.9 oz\u00a0/\u00a0649\u00a0 g With li-ion battery and memory card Kit Lens Focal Length 18 - 55 mm Comparable 35mm Focal Length: 27.0 - 82.5 mm Aperture Maximum: f/3.5 - 5.6 Minimum: f/22 - 38 Angle of View 76\u00b0 - 29\u00b0 Minimum Focus Distance 9.84\"\u00a0(25 cm) Magnification 0.34x Groups/Elements 8/11 Diaphragm Blades 6 Autofocus Yes Filter Thread Front: 52 mm Dimensions (DxL) Approx. 2.70 x 2.66\" (68.5 x 67.5 mm) Weight 8.99 oz (255 g)",
    "viewfindermagnification": "Approx. 0.92x",
    "freeshipping": "Yes",
    "brand": "Pentax",
    "sensortypesize": "CMOS, 23.7 x 15.7 mm",
    "filterthread": "Front: 52 mm",
    "connectivity": "AV Output, USB 2.0",
    "cameraformat": "APS-C / (1.5x Crop Factor)",
    "groupselements": "8/11",
    "angleofview": "76\u00b0 - 29\u00b0",
    "focustype": "Auto & Manual",
    "included": "Pentax K-50 Digital SLR Camera (Black) SMC DA 18-55mm f/3.5-5.6 AL WR Lens Rechargeable Li-Ion Battery D-Li109 for The KR Digital SLR Camera K-BC109 Battery Charger Kit for D-Li109 Battery AC Plug Cord I-USB7 USB Interface Cable Hotshoe Cover FK Eyecup FR for K7 Digital SLR Camera (replacement) SLR Body Mount Cover Camera Strap Software CD-ROM Limited 1-Year Warranty",
    "continuousshooting": "Up to 6 fps",
    "lensmount": "Pentax K",
    "displayscreen": "3\"\u00a0Rear Screen\u00a0\u00a0\u00a0LCD (921,000)",
    "fileformats": "Still Images: DNG, JPEG, RAW Movies: MOV, MPEG-4 AVC/H.264",
    "condition": "New",
    "intervalrecording": "Yes",
    "flashmodes": "Red-eye Reduction Second-curtain Sync Slow Sync TTL Auto",
    "otherresolutions": "12MP: 4224 x 2816 @ 3:2 8MP: 3456 x 2304 @ 3:2 5MP: 2688 x 1792 @ 3:2",
    "remotecontrol": "Remote Control F or O-RC1 (Optional)",
    "diopteradjustment": "- 2.5 to +1.5 m",
    "cameratype": "Digital SLR with Interchangeable lenses",
    "builtinflash": "Yes",
    "framerate": "@ 1920 x 1080: 30 fps, 25 fps, 24 fps @ 1280 x 720: 60 fps, 50 fps, 30 fps, 25 fps, 24 fps @ 640 x 480: 30 fps, 25 fps, 24 fps",
    "opticalzoom": "Interchangable Lens",
    "focusmode": "Single-servo AF (S), Continuous-servo AF (C), Manual     Focus (M) , Focus Lock AF Area Mode",
    "minimumfocusdistance": "9.84\"\u00a0(25 cm)",
    "flashcompensation": "-2 EV to +1 EV (in .3 EV steps)",
    "viewfindertype": "Pentaprism",
    "autofocuspoints": "Phase Detection: 11",
    "dedicatedflashsystem": "P-TTL\u00a0Remote Firing",
    "maxresolution": "16MP: 4928 x 3264 @ 3:2",
    "guideno": "39.37'\u00a0(12 m)\u00a0ISO100",
    "resolution": "16 Megapixels"
}