{
    "category": "camera",
    "publisher": "Nikon",
    "dimensions": "5.9 x 2.9 x 9.6 centimetres (0.38 kg)",
    "shareaddtowishlist": "\u00bb Home \u00bb Electronics \u00bb Camera & Photo \u00bb Digital Cameras Point & Shoot Digital Cameras Nikon Coolpix L29 http://www.fishpond.co.uk/Electronics/Nikon-Coolpix-L29/9999915220962 16.44 MP,5 x Optical Zoom,2.7 -inch LCD By Nikon \u00a389.95 Free Shipping Worldwide Buy Now Ships from UK supplier Order now for Christmas delivery Rating: 1 2 3 4 5 Register or sign-in to rate and get recommendations. Other Information: VNA683KG01 Hurry - Only 2 left in stock! Product Description: 16.2 Megapixel CCD Sensor 5x Optical Zoom (26-130mm 35mm equiv.) 2.2\" LCD Screen One-Touch High Definition Video Recording Built-In Flash Easy Auto Mode Simple Button Layout for Easy Operation Publisher: Nikon Dimensions: 5.9 x 2.9 x 9.6 centimetres (0.38 kg)",
    "rating": "1 2 3 4 5 Register or sign-in to rate and get recommendations.",
    "otherinformation": "VNA683KG01"
}