{
    "category": "camera",
    "publisher": "Samsung",
    "dimensions": "9.0 x 12.0 x 8.0 centimetres (0.91 kg)",
    "shareaddtowishlist": "\u00bb Home \u00bb Electronics \u00bb Camera & Photo \u00bb Digital Cameras Point & Shoot Digital Cameras Samsung WB35F Smart Camera - White (16.2MP, Optical Image Stabilisation) 6.9cm LCD http://www.fishpond.co.uk/Electronics/Samsung-WB35F-Smart-Camera-White-162MP-Optical-Image-Stabilisation-69cm-LCD/9999804348937 By Samsung \u00a3126 Free Shipping Worldwide Buy Now Ships from UK supplier Order now for Christmas delivery Rating: 1 2 3 4 5 Register or sign-in to rate and get recommendations. Other Information: WB35F Product Description: The WB35F is a stylish compact camera that you can take anywhere. A 16.2 megapixel sensor is paired with a 12x zoom lens to get you closer to the action, whilst Wi-Fi and NFC connectivity let you share your shots with ease. Publisher: Samsung Dimensions: 9.0 x 12.0 x 8.0 centimetres (0.91 kg)",
    "rating": "1 2 3 4 5 Register or sign-in to rate and get recommendations.",
    "otherinformation": "WB35F"
}