{
    "category": "camera",
    "publisher": "Sony",
    "dimensions": "10.8 x 3.8 x 6.4 centimetres (0.91 kg)",
    "shareaddtowishlist": "\u00bb Home \u00bb Electronics \u00bb Camera & Photo \u00bb Digital Cameras Compact System Cameras Sony DSCHX60 Compact Digital Camera with Wi-Fi and NFC - Black http://www.fishpond.co.uk/Electronics/Sony-DSCHX60-Compact-Digital-Camera-with-Wi-Fi-and-NFC-Black/4905524980110 20.4MP, 30x Optical Zoom By Sony \u00a3499 Free Shipping Worldwide Buy Now Ships from UK supplier Order now for Christmas delivery Rating: 1 2 3 4 5 Register or sign-in to rate and get recommendations. Other Information: DSCHX60B.CEH Product Description: DSC-HX60 Black Digital Camera- A 20.2MP Exmor R CMOS sensor- BIONZ X engine for superb detail and noise reduction- Sony G Lens with 30x optical/60x clear image zoom- Keep subjects in focus with lock-on autofocus- PlayMemories Camera Apps expands creativityFeaturesMegapixel20.2 Colour of productBlack Optical zoom30 xWi-FiBuilt-In Sensor type1/2.2 type (7.2mm) Exmor R CMOS sensor Camera shutter speediAuto (4 - 1/1600) / Programme Auto (1 - 1/1600) / Aperture Priority (8 - 1/1600) / Shutter Priority (30 - 1/1600) / Manual (30 - 1/1600) LCD Screen Size3 Video capabilityYes Compatible memory cardsMemory Stick Duo;Memory Stick PRO Duo\u2122;Memory Stick PRO Duo\u2122(high speed);Memory Stick PRO HG Duo\u2122;Memory Stick XC-HG Duo\u2122;Memory Stick Micro;Memory Stick Micro (Mark2);SD Memory Card;SDHC Memory Card;SDXC Memory Card;microSD Memory Card;microSDHC Memory Card;microSDXC Memory Card ISO sensitivityAuto (ISO80-3200 selectable with upper / lower limit) 80/100/200/400/800/1600/3200 Multi-Frame NR:Auto (ISO80-3200) 100/200/400/800/1600/3200/6400 /12800 Dimensions W x D x H108.2 x 38.2 x 63.2 mmWeight272 g Publisher: Sony Dimensions: 10.8 x 3.8 x 6.4 centimetres (0.91 kg)",
    "rating": "1 2 3 4 5 Register or sign-in to rate and get recommendations.",
    "otherinformation": "DSCHX60B.CEH"
}