{
    "focallengthrange": "18mm - 55mm",
    "screendetails": "LCD display - TFT active matrix - 3\" - color",
    "weight": "16 Oz.",
    "flashtype": "Pop-up Flash",
    "microphoneoperationmode": "Mono",
    "redeyereduction": "Yes",
    "dioptriccorrectionrange": "-1.7 to +0.5",
    "maxoperatingtemperature": "40 \u00c2\u00b0C",
    "height": "4.88 in.",
    "additionalfeatures": "1080p  Full HD Movie Recording, AE/FE Lock, AF Lock, AF Tracking, Active  D-Lighting Technology, Automatic Face Tracking, Brightness Control,  Built-In GPS, Built-In Help Guide, Cropping An Image, DPOF Support,  Date/Time Stamp, Digital Image Rotation, Direct Print, Exif Print  Support, Highlight Point Display, Histogram Display, Image  Stabilization, Interchangeable Lenses, LCD Live View Mode, Orientation  Detection, PictBridge Support, RAW Processing, Red eye Fix, Scene  Recognition System (SRS), Text Input To Exif Header, USB 2.0, USB 2.0  Compatibility, With Tripod Mount",
    "exposurecompensation": "\u00c2\u00b15 EV range, in 1/3 EV steps",
    "opticalviewfindertype": "Eye-level penta-dach mirror",
    "cameraflashfeatures": "AF  Illuminator, Auto Flash, Fill-in Flash, Flash +/- Compensation, Flash  Off, Front Sync Flash, Rear Sync Flash, Red-eye Reduction Flash, Slow  Sync, Wireless Off-Camera Control",
    "lenstype": "Zoom lens",
    "connectortypes": "1 x HDMI output, 1 x Hi-Speed USB, 1 x composite video/audio output",
    "incameraimageediting": "In-camera image editing allows creative freedom, without the need for a computer, offering easy editing functions.",
    "easytousefeaturingnikonsguidemode": "Easy-to-use-featuring  Nikon's guide mode with intuitive controls and on-board assistance  helping you take better pictures every step of the way.",
    "maxvideoresolution": "1920 x 1080",
    "category": "camera",
    "attr142megapixeldxformatcmosimagesensor": "14.2 megapixel DX-format CMOS image sensor delivers beautiful photographs and prints well beyond 20 x 30 inches.",
    "displayrotation": "Built-in",
    "attr6automaticexposurescenemodes": "6  Automatic Exposure scene modes just set the Mode dial to Portrait,  Landscape, Child, Sports, Close-up or Night Portrait for stunning  results in otherwise challenging conditions.",
    "facedetection": "Yes",
    "lightsensitivitymax": "12800",
    "stillimageformat": "JPEG, NEF (RAW), RAW + JPEG",
    "shootingprograms": "Children, Close-up, Landscape, Night portrait, Portrait mode, Sports mode",
    "lensfiltersize": "52 mm",
    "lenssystemfeatures": "Silent Wave Motor (SWM), Aspherical Lens",
    "lensforsd": "AF-S DX VR 18-55mm",
    "sensorsize": "15.4 x 23.1mm",
    "viewfinderfieldcoverage": "95%",
    "width": "3.78 in.",
    "sceneautoselector": "Scene auto selector lets the D3100 decide the best mode to match the shooting situation when using Live View.",
    "isosensitivity1003200expandabletoiso12800equivalent": "ISO  sensitivity 100-3200, expandable to ISO 12800 equivalent delivers  exceptional results, even in the most challenging low-light situations.",
    "autofocustype": "TTL contrast and phase detection",
    "sensorresolution": "14.2 MP",
    "scenerecognitionsystem": "Scene  recognition system in Live View automatically optimizes exposure,  autofocus, and white balance, allowing you to obtain beautiful photos  without the hassle of making complicated camera adjustments yourself.",
    "continuousshootingspeed": "3 frames per second",
    "focallengthequivalentto35mmcamera": "27 - 82.5mm",
    "model": "D3100",
    "minshutterspeed": "30 sec",
    "fast11pointautofocussystem": "Fast 11-point Autofocus System delivers razor-sharp pictures.",
    "viewfindermagnification": "0.8x",
    "batteryformfactor": "Manufacturer specific",
    "mpn": "25472",
    "brand": "Nikon",
    "lensconstruction": "8 group(s) / 11 element(s)",
    "sensortype": "CMOS",
    "minoperatingtemperature": "0 \u00c2\u00b0C",
    "specialeffects": "Landscape, Monochrome, Neutral, Portrait, Vivid",
    "builtinpopupflash": "Built-in pop-up flash for those times when there isn't enough light.",
    "screensize": "3\"",
    "digitalvideoformat": "MOV, MPEG-4",
    "wevemadeafewchangestobidding": "Were these helpful?",
    "activedlighting": "Active D-Lighting restores picture-enhancing detail in shadows and highlights.",
    "exposuremetering": "3D color matrix II, Center-Weighted, Spot",
    "microphonetype": "Microphone - built-in - mono",
    "full1080phdcinematicvideowithfulltimeautofocusandsound": "Full  1080p HD Cinematic Video with full-time autofocus and sound lets you  record cinematic-quality movies in Full 1080p HD format (1920 x 1080  pixels).",
    "automaticimagesensorcleaning": "Automatic  image sensor cleaning uses an ultrasonic process and exclusive Airflow  Control combats the accumulation of dust in front of the image sensor,  safeguarding image quality shot after shot.",
    "builtinhdmiport": "Built-in HDMI port lets you connect directly to your HDTV using an optional HDMI cable.",
    "expansionslot": "1 x SD Memory Card",
    "focusadjustment": "Automatic, Manual",
    "displaytype": "LCD",
    "flashmodes": "Auto Mode, Fill-in Mode, OFF mode, Rear Curtain Sync, Red-eye Reduction, Slow Synchro",
    "maxshutterspeed": "1/4000 sec",
    "lightsensitivity": "ISO 100-3200, ISO 12800, ISO 6400, ISO auto",
    "cameratype": "Digital SLR",
    "exposuremodes": "Aperture-Priority, Automatic, Bulb, Manual, Program, Shutter-Priority, i-TTL Program Flash",
    "displaysize": "3\"",
    "whitebalance": "Auto, Cloudy (Preset), Flash (Preset), Fluorescent (Preset)",
    "depth": "2.93 in.",
    "picturecontrol": "Picture  control lets you choose from Standard, Neutral, Vivid, Monochrome,  Portrait, or Landscape to apply a personal look and feel to your  pictures.",
    "exposurerange": "EV 0-20 ( ISO 100 )",
    "viewfindertype": "Optical",
    "opticalzoom": "3.1x",
    "compactandlightweightdesign": "Beautifully styled, ready to go wherever life takes you.",
    "supportedflashmemory": "SD Card, SD Memory Card, SDHC Card, SDHC Memory Card, SDXC Card, SDXC Memory Card",
    "expeed2": "Nikon's image processing engine assures breathtakingly rich image quality, managing color, contrast, exposure, noise and speed.",
    "storecategoriesstorehomelensesbatterychargersfiltersandfilterkitsbatteryandchargerkitsbatterygripscamerasandcamcordersother": "100% FULLY TESTED OPEN BOX SPECIALS IN NEW CONDITION W/ 3 YEAR WARRANTY. PACKAGED IN NON RETAIL WHITE BOX. MONEY BACK GUARANTEE IF NOT SATISFIED. THESE CAMERAS ARE OPEN BOX SPECIALS IN NEW CONDITION AND WERE THOROUGHLY CHECKED AND TESTED BY FACTORY TRAINED TECHNICIANS. WE ARE SO CONFIDENT OF THEM WORKING 100%,THAT WE ARE PROVIDING A 3 YEAR CPS WARRANTY. THEY COME WITH ALL THE ORIGINAL FACTORY ACCESSORIES. WE GIVE PERSONAL ATTENTION TO ALL OUR CLIENTS AND CAN BE REACHED TILL MIDNITE IF YOU HAVE ANY QUESTIONS VIA E-MAIL. CUSTOMER SERVICE IS OUR MAIN PRIORITY! THANK YOU FOR YOUR PATRONAGE.\" Product Information Nikon  D3100 is a small, 14.2 MP camera that captures high-quality images and  videos. This Nikon DSLR has a large 3-inch LCD monitor and is equipped  with automatic correction of lateral chromatic aberration that prevents  purple/green fringing. The Nikon D3100 supports a GPS unit, for  automatically geo-tagging photos. Moreover, this Nikon camera features  continuous autofocus during video recording. The Scene Auto Selector  function in the Nikon D3100 helps with face detection and subject  tracking. This Nikon DSLR includes active D-lighting basic in-camera  movie editing options for greater functionality. Besides, this Nikon  camera works pretty well in low-light situations without the use of  flash. Product Features 14.2 megapixel DX-format CMOS image sensor 14.2 megapixel DX-format CMOS image sensor delivers beautiful photographs and prints well beyond 20 x 30 inches. Full 1080p HD Cinematic Video with full-time autofocus and sound Full  1080p HD Cinematic Video with full-time autofocus and sound lets you  record cinematic-quality movies in Full 1080p HD format (1920 x 1080  pixels). Easy-to-use-featuring Nikon's guide mode Easy-to-use-featuring  Nikon's guide mode with intuitive controls and on-board assistance  helping you take better pictures every step of the way. Fast 11-point Autofocus System Fast 11-point Autofocus System delivers razor-sharp pictures. Built-in HDMI port Built-in HDMI port lets you connect directly to your HDTV using an optional HDMI cable. 6 Automatic Exposure scene modes 6  Automatic Exposure scene modes just set the Mode dial to Portrait,  Landscape, Child, Sports, Close-up or Night Portrait for stunning  results in otherwise challenging conditions. Picture control Picture  control lets you choose from Standard, Neutral, Vivid, Monochrome,  Portrait, or Landscape to apply a personal look and feel to your  pictures. Built-in pop-up flash Built-in pop-up flash for those times when there isn't enough light. Compact and lightweight design Beautifully styled, ready to go wherever life takes you. Split-second shutter response Split-second shutter response eliminates the frustration of shutter delay, capturing moments that other cameras miss. ISO sensitivity 100-3200, expandable to ISO 12800 equivalent ISO  sensitivity 100-3200, expandable to ISO 12800 equivalent delivers  exceptional results, even in the most challenging low-light situations. Scene auto selector Scene auto selector lets the D3100 decide the best mode to match the shooting situation when using Live View. EXPEED 2 Nikon's image processing engine assures breathtakingly rich image quality, managing color, contrast, exposure, noise and speed. Scene recognition system Scene  recognition system in Live View automatically optimizes exposure,  autofocus, and white balance, allowing you to obtain beautiful photos  without the hassle of making complicated camera adjustments yourself. Active D-Lighting Active D-Lighting restores picture-enhancing detail in shadows and highlights. Automatic image sensor cleaning Automatic  image sensor cleaning uses an ultrasonic process and exclusive Airflow  Control combats the accumulation of dust in front of the image sensor,  safeguarding image quality shot after shot. In-camera image editing In-camera image editing allows creative freedom, without the need for a computer, offering easy editing functions. Product Highlights Video Product Identifiers Brand Nikon Model D3100 MPN 25472 Key Features Camera Type Digital SLR Optical Zoom 3.1x Sensor Resolution 14.2 MP Screen Size 3\" Optical Sensor Sensor Size 15.4 x 23.1mm Sensor Type CMOS Lens System Lens Type Zoom lens Lens For SD AF-S DX VR 18-55mm Focal Length Range 18mm - 55mm Focus Adjustment Automatic, Manual Lens Filter Size 52 mm Lens System Features Silent Wave Motor (SWM), Aspherical Lens Auto Focus type TTL contrast and phase detection Lens Construction 8 group(s) / 11 element(s) Focal Length Equivalent to 35mm Camera 27 - 82.5mm Exposure Max Shutter Speed 1/4000 sec Min Shutter Speed 30 sec Exposure compensation \u00c2\u00b15 EV range, in 1/3 EV steps Exposure Range EV 0-20 ( ISO 100 ) Exposure Metering 3D color matrix II, Center-Weighted, Spot Exposure Modes Aperture-Priority, Automatic, Bulb, Manual, Program, Shutter-Priority, i-TTL Program Flash Light Sensitivity ISO 100-3200, ISO 12800, ISO 6400, ISO auto Light Sensitivity Max 12800 Camera Flash Flash Type Pop-up Flash Red Eye Reduction Yes Camera Flash Features AF  Illuminator, Auto Flash, Fill-in Flash, Flash +/- Compensation, Flash  Off, Front Sync Flash, Rear Sync Flash, Red-eye Reduction Flash, Slow  Sync, Wireless Off-Camera Control Flash Modes Auto Mode, Fill-in Mode, OFF mode, Rear Curtain Sync, Red-eye Reduction, Slow Synchro Memory / Storage Supported Flash Memory SD Card, SD Memory Card, SDHC Card, SDHC Memory Card, SDXC Card, SDXC Memory Card Viewfinder Viewfinder Type Optical Optical Viewfinder Type Eye-level penta-dach mirror Viewfinder - Field Coverage 95% Viewfinder Magnification 0.8x Dioptric Correction Range -1.7 to +0.5 Dimensions Depth 2.93 in. Height 4.88 in. Width 3.78 in. Weight 16 Oz. Display Display Type LCD Display Rotation Built-in Screen Details LCD display - TFT active matrix - 3\" - color Display Size 3\" Microphone Microphone Type Microphone - built-in - mono Microphone Operation Mode Mono Connections Connector Types 1 x HDMI output, 1 x Hi-Speed USB, 1 x composite video/audio output Expansion Slot 1 x SD Memory Card Battery Battery Form Factor Manufacturer specific File Format Digital Video Format MOV, MPEG-4 Still Image Format JPEG, NEF (RAW), RAW + JPEG Resolution Max Video Resolution 1920 x 1080 Environmental Parameters Min Operating Temperature 0 \u00c2\u00b0C Max Operating Temperature 40 \u00c2\u00b0C Other Features Additional Features 1080p  Full HD Movie Recording, AE/FE Lock, AF Lock, AF Tracking, Active  D-Lighting Technology, Automatic Face Tracking, Brightness Control,  Built-In GPS, Built-In Help Guide, Cropping An Image, DPOF Support,  Date/Time Stamp, Digital Image Rotation, Direct Print, Exif Print  Support, Highlight Point Display, Histogram Display, Image  Stabilization, Interchangeable Lenses, LCD Live View Mode, Orientation  Detection, PictBridge Support, RAW Processing, Red eye Fix, Scene  Recognition System (SRS), Text Input To Exif Header, USB 2.0, USB 2.0  Compatibility, With Tripod Mount Face Detection Yes Miscellaneous Shooting Programs Children, Close-up, Landscape, Night portrait, Portrait mode, Sports mode Special Effects Landscape, Monochrome, Neutral, Portrait, Vivid White Balance Auto, Cloudy (Preset), Flash (Preset), Fluorescent (Preset) Continuous Shooting Speed 3 frames per second This Kit Includes: Nikon D3100 Body Nikon 18-55mm VR Lens Nikon 70-300 G Zoom Lens Camera Carrying Case .43x Wide Angle Lens Macro Lens Attachment 2.2x Telephoto Lens 50\u00e2\u0080\u009d Tripod Memory Card Reader 2pcs 16GB Memory Cards Slave Flash 3pc Deluxe Filter Kit (UV + CPL + FLD) Starter Kit -Cleaning Liquid -Cotton Swabs -Screen Protectors -Mini Tripod -Cleaning Cloth Memory Card Wallet",
    "splitsecondshutterresponse": "Split-second shutter response eliminates the frustration of shutter delay, capturing moments that other cameras miss."
}